Arg,positive,todo this brute force approach of updating listeners on each and every event  without checking the event type or any other information is going to cause lots of invalidelementexceptions in subclasses implementations of updatelisteners  and they wo not have the event information to make their own decisions
Arg,positive,todo the above statement also refreshes when we are not shown  to be verified  hence not entirely correct
Arg,positive,class to display graphics for a uml synchstate in a diagram p todo if the font increases  the circle should grow  too author pepargouml yahoo es
Arg,positive,todo if this is an ordered list  then you have to add in the right location
Arg,positive,rank the nodes depending on their level  position in hierarchy  and set their weight to achieve a proper node sequence for the layout rows exceeding the maximum row width are split  if standalone nodes are available p weight the other nodes to determine their columns p todo weighting does not appear to be working as intended because multiple groups of children specializations get intermixed in name order rather than being grouped by their parent generalization tfm 
Arg,positive,todo this is a tagged value name which will never trigger an event
Arg,positive,tests copyhelper without using stereotypes p the test is using the tree of objects pre model p p class nestedpackage interface attribute pre todo this test does not match the mdr implementation because it expects the contents of a namespace to be copied it is disabled until it can be fixed to run with both mdr and euml tfm  author bogdan
Arg,positive,todo correctly implement next function in the model subsystem for issue 
Arg,positive,todo the code implementing this method is from see issue mechanically integrated by tfmorris in may  needs to be reviewed updated author decki  endi  yayan  politechnic of bandung computer departement method for changing text of message
Arg,positive,todo why does the next part not work ?
Arg,positive,todo we do not really want this to be filled  but if it is not then the user ca not double click in the compartment to add a new literal apparently gef thinks unfilled figs are only selectable by border setfilled  false
Arg,positive,todo we ca not have a global current language notationproviderfactory setcurrentlanguage  newlanguage
Arg,positive,todo we should warn the user we have removed something tfm
Arg,positive,if we are not visible most likely we 're being deleted todo this indicates a more fundamental problem that should be investigated tfm 
Arg,positive,fixme the following throws org argouml model invalidelementexception javax jmi reflect invalidobjectexception object with mofid e no longer exists applicabletagdefs tagdefcbmodel getapplicabletagdefinitions  aclass  assertnotnull  tag definition was not found in return value of tagdefcbmodel getapplicabletagdefinitions  aclass after loading the project  teststereotypeutility findmodelelementnamed  profilemother tag definition name td  applicabletagdefs
Arg,positive,todo in gef needs to pass us back the description of what is being done
Arg,positive,make it stretch vertically todo the curbody must notify modification
Arg,positive,todo is this next line safe ? what happens if there is just one comment edge or a comment edge and a single message ?
Arg,positive,todo considering all delete events to be valid like below is going to cause lots of unecessary work and some problems
Arg,positive,else if the y coordinate is outside of the classifier role  we fix the y in the max y of the classifier role fixme we should increase the height of the classifier role  do not ? ? ?
Arg,positive,todo this appears to expect that the uml tag name will appear as a property name in an event  but with the uml switch to tagdefinitions  this wo not work
Arg,positive,todo not in uml 
Arg,positive,todo removed from uml non nls 
Arg,positive,todo only occurrence of isconcurrent in uml  is in index it is not on the page that is indexed
Arg,positive,todo this works for  degree angles  but is suboptimal for other angles it should reflect the angle  rather than just using a negative offset along the same vector
Arg,positive,todo map uml names to uml x names non nls  non nls 
Arg,positive,todo except this wo not work because the names are different which will cause a test in checkumlmodelhelper to fail remap put  core permission  core packageimport
Arg,positive,this does not work in uml both owner and property needed
Arg,positive,fixme fails here the current behavior appears intentional  ie the test is wrong  tfm assertnull  the profile stereotype named profilemother stereotype name st should not be found  findmodelelementfromnamespace  stereotypeutility getavailablestereotypes  aclass profilemother stereotype name st  profilemodel
Arg,positive,todo this looks backwards left over from issue  ?
Arg,positive,todo this does not work  but should collection elements model getfacade getrootelements model getumlhelper deletecollection  elements  elements model getfacade getrootelements asserttrue  failed to create clean environment  elements isempty
Arg,positive,todo issue  it is proposed to allow any paclage to return as a potential namespace commenting out until this is reviewed and clearly accepted by all
Arg,positive,todo something might go wrong during processing we do not really want to create the model element until the user releases the mouse in the place expected
Arg,positive,strange  but the link getconnection returns a collection  not a list  this is a bug  compared to the uml standard  imho  mvw  hence  the linkend is added to the end instead
Arg,positive,todo synchronized is required here as there can be some concurrent modification problems when drawing a call message and having that automatically draw the reply maybe fixing the todo below will resolve this and the synch can go
Arg,positive,these next lines for the case that the current namespace is not a valid one which of course should not happen  but it does see the project attached to issue 
Arg,positive,todo in uml x event has no parameters todo treat objectflowstate  this does not exist anymore in uml  and classifier
Arg,positive,todo if this is an ordered list  then you have to add in the right location
Arg,positive,appears to be gone from uml  x
Arg,positive,todo this does not work no event arrives
Arg,positive,todo this is only checking immediate siblings when it needs to be checking all imported elements both here and by our parents and also taking into account visibility
Arg,positive,this does not work  anymore yet ? since we never have a figtext here
Arg,positive,utility function to localize the given string with help text  and show it in the status bar of the argouml window this function is used in favour of the inline call to enable later improvements e g it would be possible to show a help balloon p todo work this out one matter to possibly improve show multiple lines param s the given string to be localized and shown
Arg,positive,todo monitor is getting dismissed before layout is complete
Arg,positive,todo we currently do not support per fig settings for most stuff  so we can just use the defaults that we were given settings new diagramsettings  rendersettings
Arg,positive,todo not yet working for uml
Arg,positive,this triggers some warnings  in logs  because some elements are created without an owner  and eresource is null  todo fix this the warning log  if we would not add the eobject to a resource  would looks like this warn awt eventqueue  encountered deleted object during delete of
Arg,positive,todo should not we throw an exception here ?  ?
Arg,positive,todo algorithm is n  in number of nodes
Arg,positive,update attached node figures todo presumably this should only happen on a add or remove event
Arg,positive,fixme depends on internal behavior of xmireaderimpl needed for solving issue 
Arg,positive,todo allow adding models to a diagram issue 
Arg,positive,todo update the old and new node above this  this is issue  the old and new uml namespaces are in the event  but how do we know which nodes to refresh ? and how to refresh ? not necessarily the namespaces  depending on the perspective
Arg,positive,todo this should only be building list up to 'index'
Arg,positive,todo the following can be removed if selectall gets fixed
Arg,positive,fixme boundary condition at end of image for non integral multiples of buffer height
Arg,positive,todo not in uml 
Arg,positive,todo we ca not have a global current language notationproviderfactory setcurrentlanguage  oldlanguage
Arg,positive,xxx this seems to be a bug of the parser  it always requires a context
Arg,positive,todo use model getmodelmanagementhelper getpathlist  modelelement  todo this will fail with nested models
Arg,positive,if we are not visible most likely we 're being deleted todo this indicates a more fundamental problem that should be investigated tfm 
Arg,positive,todo we should have all the information that is required in the notationsettings object
Arg,positive,parse a transition description line of the form pre event signature guard condition action expression pre a is not interpreted as having any special meaning p the event signature may be one of the  formats ul li changeevent when  condition  li timeevent after  duration  li callevent a  parameter list  li signalevent any string without ul remark the uml standard does not make a distinction between the syntax of a callevent and signalevent both may have parameters between for simplicity and user friendliness  we chose for this distinction if a user wants parameters for a signalevent  then he may add them in the properties panels  but not on the diagram p an alternative solution would be to create a callevent by default  and when editing an existing event  do not change the type p todo this function fails when the event signature contains a or a see issue  for other cases that were a problem in the past param trans the transition object to which this string applies param s the string to be parsed return the transition object throws parseexception when no matching are found
Arg,positive,todo this whole block can be deleted when issue  is resolved
Arg,positive,todo not in uml 
Arg,positive,dirty fix for issue needs to be amended when we start supporting parameters
Arg,positive,todo not in uml 
Arg,positive,todo this does not work mvw  model getfacade setbody  expr  guard  model getfacade setexpression  g  expr
Arg,positive,todo not in uml 
Arg,positive,todo in this case  the properties panel is not updated with the changed expression
Arg,positive,todo not in uml 
Arg,positive,warning the outputstream version of this does not work  tfm
Arg,positive,else if the y coordinate is outside of the classifier role  we fix the y in the max y of the classifier role fixme we should increase the height of the classifier role  do not ? ? ?
Arg,positive,warning the gef implementation of the outputstream version of this method does not work tfm 
Arg,positive,todo do tests for allinstances even though it is not yet supported
Arg,positive,todo not implemented by euml
Arg,positive,todo this only works if the item is visible  all its parents are expanded  getexpandeddescendants  makevisible
Arg,positive,this will have problems if the smallest possible data segment is smaller than the size of the buffer needed for regex matching
Arg,positive,todo not in uml 
Arg,positive,todo why is this throwing a generic runtime exception ?  ?
Arg,positive,todo this exception will be thrown during autoscrolling when the edge of the canvas is reached causing either the width or height to be adjusted to a negative value
Arg,positive,disabled since it gives various problems e g the toolbar icons get too wide also the default does not give the new java looks component tree projectbrowser getinstance swingutilities updatecomponenttreeui  swingutilities getrootpane  tree
Arg,positive,if this is a feature get the owner of that feature todo does anything actually make use of this ? it can cause unexpected behaviour
Arg,positive,todo this error needs to be reported
Arg,positive,todo not in uml 
Arg,positive,todo we should be giving the user more direct feedback
Arg,positive,todo this should be using internalgetallrealizedinterfaces
Arg,positive,many many of these events this slows things down
Arg,positive,todo this does not perform well enough with large models to have it enabled by default if the performance ca not be improved  perhaps we can introduce a manual find in explorer tree action selectall  targets
Arg,positive,really ought to have a criticexception to throw here
Arg,positive,todo considering all delete events to be valid like below is going to cause lots of unecessary work and some problems
Arg,positive,todo this is never executed as ludos di work was never finished
Arg,positive,todo when the attribute is not in the diagram  for exemple select attribut by explorer then  the refresh is not auto we had to click
Arg,positive,todo this is probably an undesirable side effect unless the user confirms it placing an element on a second diagram is going to potentially change its namespace tfm 
Arg,positive,todo the below is not strictly correct  but should cover the case we deal with using a real xml parser would be better look for xml document has just a single root element
Arg,positive,todo assumes public todo this is probably an undesirable side effect unless the user confirms it placing an element on a second diagram is going to potentially change its namespace tfm 
Arg,positive,todo uncomment the following to get the failure assertloadmodel  issue base dir zipped uml andromda profile datatype andromda profile datatype xml zip  null  testreadcompressedandromdaprofilefileissue
Arg,positive,status as of nov  figs created  property panels exist  more work required on explorer and assumptions about models not being nested tfm
Arg,positive,if we have anything or multiple elements selected  we do not do anything todo we need to support multiple selection see issue  http argouml tigris org issues show bug cgi ? id 
Arg,positive,todo make setbounds  calcbounds and updatebounds consistent
Arg,positive,set the child components to the heights in the array list calculating the height of any proportional component on the fly fixme this assumes that the jlabel and the component it labels have been added to the parent component consecutively
Arg,positive,a mode to interpret user input while creating a permission edge the permission can connect any model elements including those represented by edges as well as nodes p todo in uml  x  permission becomes packageimport and the class hierarchy has changed so that it is no longer a subtype of dependency  so this may need to be refactored to work correctly
Arg,positive,todo considering all delete events to be valid like below is going to cause lots of unecessary work and some problems
Arg,positive,todo the size of text figs  which is what we care about most  is not computed correctly by gef if we got ambitious  we could recompute a proper size ourselves
Arg,positive,a critic to detect when a classifier has to many operations  p todo exclude getter and setter operations from count
Arg,positive,todo why is not this calculation for location working ?
Arg,positive,todo this code does not look like it will get reached because any abstraction realization is going to take the isaabstraction leg of the if before it gets to this more general case tfm 
Arg,positive,todo this should probably only update the project when the user presses return or focus is lost
Arg,positive,the next line does not work
Arg,positive,todo if actioncopy is no longer a singleton  how shall this work ?
Arg,positive,todo huge side effect hoist out of parse tfm let is load the project
Arg,positive,todo support navigability the code below causes and exception in figassociationendannotation
Arg,positive,todo we do not really want to do the following  but i'm not sure what depends on it tfm 
Arg,positive,todo why is this clearing the name ?  ?  tfm
Arg,positive,offset in x y for depth perspective lines of cube todo this is the same value as the member 'd'in link org tigris gef presentation figcube  but there is nothing enforcing that correspondence things will probably break if they do not match
Arg,positive,todo the code implementing this method is from see issue mechanically integrated by tfmorris in may  needs to be reviewed updated author decki  endi  yayan  politechnic of bandung computer departement method for changing text of message param newowner param parameter
Arg,positive,todo this exception will be thrown during autoscrolling when the edge of the canvas is reached causing either the width or height to be adjusted to a negative value
Arg,positive,todo make the tree refresh and expand really work in all cases
Arg,positive,todo the code implementing this method is from see issue mechanically integrated by tfmorris in may  needs to be reviewed updated author decki  endi  yayan  politechnic of bandung computer departement method for changing text of message param newowner model element which should now be listened to
Arg,positive,todo should save and restore the last positions of the toolbars
Arg,positive,todo does anyone use command line ? if so  localization is needed tfm
Arg,positive,todo the following rather than the above is probably the correct way to search stereo findstereotype  obj  null  name
Arg,positive,really ought to have a criticexception to throw here
Arg,positive,there is a possibility that the next step forward takes another path in this wizard to allow for this we must destroy the path already traveled by p todo i  linus  would say that this is really a problem with the wizard implementation since i believe it should be possible to explore a path in the wizard and then go back inheritdoc
Arg,positive,builds a message within some interaction related to some assocationrole the message is added as the last in the interaction sequence furthermore  the message is added as the last to the list of messages already attached to the role effectively  the already attached messages become predecessors of this message todo this sets the activator as a side effect however it is impossible to determine the activator at this stage as we do not yet know what the action will be of the message we 're creating see issue  param inter the interaction param role the association role return the newly created message
Arg,positive,todo name is not expanded for diagram objects
Arg,positive,todo name is not expanded for diagram objects
Arg,positive,todo mvw why is this not done in gef ?
Arg,positive,todo this is a temporary crutch to use until all figs are updated to use the constructor that accepts a diagramsettings object
Arg,positive,todo there is a cyclic dependency between selectionrerouteedge and figedgemodelelement
Arg,positive,todo we need to rethrow this as some other exception type but that is too much change for the moment
Arg,positive,todo it is probably worthwhile to abstract and factor this chooser and directory stuff more file handling is coming  i'm sure
Arg,positive,todo complete this implementation tfm
Arg,positive,todo this will vary based on the type of the tagdefinition
Arg,positive,setfontfamily  dialog  todo is this needed ?
Arg,positive,todo move this into the toolbar project
Arg,positive,todo this is a temporary method of making sure the model is updated on loss of focus of a combo box in the long term we should attempt to update the model on each keypress see java awt event focuslistener focuslost  java awt event focusevent
Arg,positive,these methods are based on the graphevents these need replacing by more specic meaningful requests of the diagram interface model
Arg,positive,todo all super constrcutors should take a graphmodel
Arg,positive,workaround for missing ability to parse
Arg,positive,todo needs to be tidied up after stable release graph model should be created in constructor
Arg,positive,this is wrongly called with a null handle  as a workaround we return an empty collection
Arg,positive,todo not navigable this direction ? tfm
Arg,positive,todo this does not look right review tfm
Arg,positive,return the statemachine todo if this method is called by any of the figs  it will introduce a dependency cycle it would be much better if they could just use link org argouml uml diagram argodiagram getowner which does the same thing
Arg,positive,todo need to clean up objecttoid  can we do it based on modelelement delete notifications ?
Arg,positive,the constructor todo why does this method not handle all settings  key default shadow width is missing  ?
Arg,positive,todo performance critical method
Arg,positive,todo needs work must determine which figs enclosed in the pool are within the bounds of this fig and translate those
Arg,positive,todo optimize for root model case ? tfm
Arg,positive,todo do we really need to do this ? carried over from old behavior
Arg,positive,todo elementownership is not in modelsubsys
Arg,positive,todo this seems like a brute force workaround  and a very indirect one at that  it appears to be needed though until we fix the problem properly tfm 
Arg,positive,todo is this really needed ?
Arg,positive,todo uml spec requires both client and supplier to be in the same model tfm
Arg,positive,todo unused ?
Arg,positive,these may not actually make any difference at present  the code behind addtrigger needs more work
Arg,positive,todo temporary let tree expand implicitly tfm
Arg,positive,todo split into an inherited attr critic and a local attr critic
Arg,positive,todo should throw if the string is not good ?
Arg,positive,these may not actually make any difference at present  the code behind addtrigger needs more work
Arg,positive,todo handle multiple top level packages
Arg,positive,a wizard which adjust the threshold for critics p todo make the treshold setting adjustable without using the wizard  and make it persistent maybe by using the configure button on the browse critics dialog see org argouml uml cognitive critics abstractcrtoomany author mkl
Arg,positive,todo better if we wrap in a profileexception and throw that
Arg,positive,create our bandbuffer which is just a small slice of the image todo we used a fixed height buffer now  but we could be smarter and compute a height which would fit in some memory budget  allowing us to use taller buffers with narrower images  minimizing the overhead of multiple rendering passes
Arg,positive,todo support iterate declarator
Arg,positive,return returns the default stereotype view todo enumeration here ?
Arg,positive,todo how about figassociationclass ?
Arg,positive,todo this should not depend on the current project  but for now just make sure it is defined and that we have an undo manager
Arg,positive,remove this diagram from existence todo move to gef
Arg,positive,todo this needs to be managing undo on a per project basis instead of using gef is global undo manager
Arg,positive,todo define constants for magic numbers
Arg,positive,this class gives critics access to parts of the uml model of the design it defines a gen function that returns the children of any given part of the uml model basically  it goes from project  to models  to modelelements argo is critic agency uses this to apply critics where appropriate todo this thinks it knows all the composition associations of the the uml metamodel  but it is a  incomplete and b  not updated for uml this should be done using information from the metamodel rather than hardwired code tfm  see org argouml cognitive agency see org argouml cognitive designer author jrobbins
Arg,positive,todo define constants for magic numbers
Arg,positive,todo consider inherited associations ? todo self loops are double counted
Arg,positive,todo multiple associations between the same pair of elements need to be special cased so that they do not overlap tfm 
Arg,positive,gets the current threshold todo should this be protected ? return the current threshold
Arg,positive,todo there is a cyclic dependency between this class and figconcurrentregion
Arg,positive,todo move to mmutil or some other common place and merge with umlcomboboxentry findnamespace
Arg,positive,needs more work sending and receiving icons
Arg,positive,an object tagged as being the owner of a figedgenote has knowledge about the source and destination of the figedgenote p the source and destination are modelelements at least one of them is a comment but they may be both comments todo there is tons of special case code scattered around argouml for this one class since it is the only owner of a figedgemodelelement which is not a uml element we should find a way to generalize this p todo issue  requires this class to be replaced by a similar mechanism as the n ary association class the node and the edges shall all have the same owner  i e the uml comment object since jul  author jaap branderhorst xsall nl
Arg,positive,todo offenders need to be more strongly typed tfm 
Arg,positive,if expression implements one of the combobox  select it todo ? do it in euml module project ?
Arg,positive,return the set of offenders todo the return value needs to be more strongly typed tfm 
Arg,positive,todo do all these classes need to be in their own files ? public ?
Arg,positive,must be overridden to make sense  i did not want to make it abstract because it might not be required
Arg,positive,todo should fire its own event and projectbrowser should register a listener
Arg,positive,todo use default value of appropriate type for td
Arg,positive,todo should fire its own event and projectbrowser should register a listener
Arg,positive,our superclass no longer has this method  so perhaps this whole thing should be removed ? tfm super updatelisteners  newowner
