Arg,positive,todo this is a linear search of a list that contain many thousands of items  one for every fig in the entire project
Arg,positive,todo check this
Arg,positive,todo no test coverage for this or createproppanel ? tfm
Arg,positive,todo do tests for infix operators even though it is not yet supported
Arg,positive,the uml  metamodel is a mof cmof model  so we want nodes with tag ownedmember  attribute xmi type cmof class todo this code is untested tfm
Arg,positive,for modules  it would be usefule to be able to remove their factories p todo the effect of this method is not yet tested  param factory the factory to remove
Arg,positive,todo should not be using assert here but i do not want to change to illegalstateexception at lead up to a release as i do not know how much testing is done with assert on
Arg,positive,test the constructor used for loading a profile from a jar file todo test fignode  throws exception if something goes wrong
Arg,positive,modelelement is abstract  so no create tests todo add any other relevant tests
Arg,positive,do we need to add tests for the following ? aggregationkind changeablekind messagedirectionkind orderingkind parameterdirectionkind pseudostatekind scopekind visibilitykind
Arg,positive,todo test if the generated string is correct
Arg,positive,tests if the list with namespaces defined in getvalidnamespaceclasses contains only valid namespaces todo this test does not test anything  really
Arg,positive,cleanallextentsbut  model  todo why is this causing a crash ?  ?
Arg,positive,todo this needs more work test e g creation when an operation is selected author jaap branderhorst xsall nl since jan 
Arg,positive,todo this requires that the tests be run with assertions enabled which is not guaranteed in all environments
Arg,positive,for some reason listset equals allocates a lot of memory  well some memory at least lets try to avoid that when not needed by invoking this test only when the two previous tests are not decisive
Arg,positive,tests for the diagramsettings todo test chaining of settings author tom morris  based on testprojectsettings by michiel
Arg,positive,todo should not be using assert here but i do not want to change to illegalstateexception at lead up to a release as i do not know how much testing is done with assert on
Arg,positive,todo fix this so that new sequence diagrams are tested
Arg,positive,todo rewrite this test using reflection against uml class this code has been commented out since september 
Arg,positive,test creation of collaboration diagrams todo test creating on an operation author jaap branderhorst xsall nl since jan 
Arg,positive,test a uml xmi file to make sure that it gets converted properly p todo our uml converter currently only handles xmi throws filenotfoundexception indicates a test configuration problem throws umlexception if it fails to open the file
Arg,positive,tests if the list with namespaces defined in getvalidnamespaceclasses contains only valid namespaces todo this test does not test anything  really
Arg,positive,the application should have checked for availability at startup for tests we would expect unix developers to be correctly configured replace with an assert when we are jre 
Arg,positive,todo this should fail  but it does not
Arg,positive,todo write test for enumerations  although they are not yet supported
Arg,positive,test read compressed models  mainly to verify the correct reading of andromda profiles todo move this test into argouml base when we will want to read also zip file author lmaitre
Arg,positive,todo do tests for navigation to association classes even though it is not yet supported
Arg,positive,we tested this above do we need to test again ?
Arg,positive,todo do tests for type conformance even though it is not yet supported
Arg,positive,testing does not fire conflict with crnameconflict
Arg,positive,todo should it remove the leftovers from other tests ? cleanallextents assert getfacade getrootelements size 
Arg,positive,entered in  prove that the test below is not needed
Arg,positive,todo this requires that the tests be run with assertions enabled which is not guaranteed in all environments
Arg,positive,todo why does it fail for changing the name of an associationend ? why should it pass ?
Arg,positive,for modules  it would be useful to be able to remove their factories p todo the effect of this method is not yet tested  param factory the factory to remove
Arg,positive,todo test this
Arg,positive,todo test if the generated string is correct
Arg,positive,todo do tests for ranges in collection definition even though it is not yet supported
Arg,positive,todo do tests for collections of collections even though it is not yet supported question should this happen with all collections or only the constructed ones ?
Arg,positive,test creation of metatypes todo we could add tests here to make sure that we can not create abstract types
Arg,positive,listening only to remove events does not work todo check if this works now with new event pump tfm
Arg,positive,todo we need some way of driving this from panel xml rather than hard coded test
Arg,positive,todo prove that this works the testumlassociationrolebasecomboboxmodel does not cut it see org argouml uml ui umlcomboboxmodel addothermodeleventlisteners  java lang object
Arg,positive,todo presumably this is only relevant if obj is actually a model or profile an added test of isamodel  obj  or isaprofile  obj  would clarify what is going on here
Arg,positive,all events going to the explorer must pass through here first  p most will come from the uml model via the eventadapter interface p todo in some cases  test cases  this object is created without setting the treemodel i  linus  will add tests for this now it would be better if this is created only when the explorer is created p todo the explorertreenode also listens to some events  from diagrams so it does not follow the rule above since created on  september author alexb
Arg,negative,add figs to the fignode in back to front order
Arg,negative,see org tigris gef graph graphfactory makenode
Arg,negative,make port invisible unless mouse enters
Arg,negative,see javax swing plaf metal metaltheme getprimary
Arg,negative,event handlers mouselistener implementation
Arg,negative,firenoderemoved  node
Arg,negative,the following does not seem to work centered the fig instead getnamefig setjustificationbyname  center
Arg,negative,only show actions for associations not already on diagram
Arg,negative,get the widest of all textfigs calculate the total height
Arg,negative,  generalization
Arg,negative,create the new figassociation edge to replace the node
Arg,negative,make sure we do not try to set things smaller than the minimum
Arg,negative,center the namefig  since center justification does not seem to work
Arg,negative,only show actions for associations not already on diagram
Arg,negative,non nls 
Arg,negative,see javax swing plaf metal metaltheme getprimary
Arg,negative,do nothing  this rect will always be transparent
Arg,negative,if we 're about to upgrade the file lets take an archive of it first
Arg,negative,see java beans vetoablechangelistener vetoablechange  java beans propertychangeevent
Arg,negative,actions specific to the use case diagram toolbar
Arg,negative,update any text  colors  fonts  etc
Arg,negative,only show actions for associations not already on diagram
Arg,negative,update the relative sizes and positions of internel figs
Arg,negative,see org argouml uml diagram layout layouter layout
Arg,negative,popupaddoffset should be equal to the number of items added here
Arg,negative,loop through the associations  counting the ends with aggregations
Arg,negative,add stereotypes submenu
Arg,negative,the fix
Arg,negative,we handle and consume editing events
Arg,negative,only show actions for associations not already on diagram
Arg,negative,now we can remove ourself  which will also remove the attached association ends edges
Arg,negative,mmessage
Arg,negative,list of model element listeners we 've registered
Arg,negative,we want to maintain a minimum width for the fig also  add the border dimensions to the minimum space required for its contents
Arg,negative,added this part to load the extra menu content
Arg,negative,and the stereotypes of its features
Arg,negative,owner related todo items
Arg,negative,a binary association is not a node so reject
Arg,negative,fig related todo items
Arg,negative,intentional if there is nonsense in the field  we do not set the value
Arg,negative,parse the text that was edited
Arg,negative,intentional if there is nonsense in the field  we return false
Arg,negative,pass everything except editing events to superclass
Arg,negative,stereotype fig covers the name fig
Arg,negative,if the source of the event is an uml object  then the uml model has been changed
Arg,negative,lazily create the event
Arg,negative,default implementation is to do nothing
Arg,negative,the source of an association end should not be the classifier if it is the user has drawn the wrong way round so we swap here
Arg,negative,default implementation is to do nothing
Arg,negative,see java lang object equals  java lang object
Arg,negative,todo update setting
Arg,negative,end class crunnavigableassoc
Arg,negative,accessors
Arg,negative,the extend label it is not a true stereotype  so do not use the stereotype support int y getnamefig getbounds height
Arg,negative,set the tooltip string
Arg,negative,see org tigris gef persistence pgml pgmlstackparser setattrs  org tigris gef presentation fig  org xml sax attributes
Arg,negative,default implementation is to do nothing
Arg,negative,since body ever looks at the type of the diagram appearance event  we can simplify from sending every existing event to one event only but since there is no catch all event defined  we just use one rationale reduce the number of total refreshes of the drawing
Arg,negative,default implementation is to do nothing
Arg,negative,note that multiplicity is what is the notation is listening for in uml  uppervalue are listened to in uml it is not currently why it is not required to register for lowervalue also
Arg,negative,default implementation is to do nothing
Arg,negative,a use case has an external separator external means external to the compartment box this horizontal line sticks out of the box  and touches the ellipse edge
Arg,negative,default implementation is to do nothing
Arg,negative,fail silently as we expect users to accidentally drop on to wrong component
Arg,negative,required for mouselistener interface  but we only care about clicks
Arg,negative,the diagram are always owned by the model in this first implementation
Arg,negative,required for mouselistener interface  but we only care about clicks
Arg,negative,see java lang object equals  java lang object
Arg,negative,required for mouselistener interface  but we only care about clicks
Arg,negative,see org argouml uml ui umlcombobox umlcombobox  umlcomboboxmodel  action
Arg,negative,required for mouselistener interface  but we only care about clicks
Arg,negative, make sure the only figgroups on a diagram are also fignodes the report
Arg,negative,no need to update if model element went away
Arg,negative,see org tigris gef graph mutablegraphmodel addnoderelatededges  java lang object
Arg,negative,required for keylistener interface  but not used
Arg,negative,private utility routine to work out the  positive  x coordinate of a point on an oval  given the radii and y coordinate p todo use this to calculate the separator lines  param a radius in x direction param b radius in y direction param y y coordinate return positive x coordinate for the given y coordinate
Arg,negative,both ends must be defined and nodes that are on the graph already
Arg,negative,link the new include relationship in to the ends
Arg,negative,internal methods
Arg,negative,figassociationrole figassociationrole new figassociationrole
Arg,negative,newfc content
Arg,negative,number of goals should now be 
Arg,negative,gef sets a different fig than the one that we had at construction time  so we need to set its color and width
Arg,negative,mark this as newly created this is to get round the problem with creating figs for loaded comments that had stereotypes they are saved with their dimensions including the stereotype  but since we pretend the stereotype is not visible  we add height the first time we render such a comment this is a complete fudge  and really we ought to address how comment objects with stereotypes are saved but that will be hard work
Arg,negative,place the edge on the layer and update the diagram
Arg,negative,update the priority of the critic to be the same priority as the decision
Arg,negative,end computeroute
Arg,negative,see org argouml uml diagram ui fignodemodelelement renderingchanged
Arg,negative,todo does this help ?
Arg,negative,snooze and verify its been enabled
Arg,negative,if this is not a circle to circle edge we default to let gef calculate edge route
Arg,negative,test with a class and class diagram
Arg,negative,? two iterations of refinement  maybe should be a for loop
Arg,negative,recursively place all nodes pointed to by outgoing transitions because of the recursive algorithm multiple outgoing transitions will end up very lopsided because one entire subgraph will be done before dealing with the other transition  s  param seen set of nodes seen so far param node the node to collect neighbors for
Arg,negative,get the two ends of any valid edge
Arg,negative,see org argouml uml diagram ui fignodemodelelement clone
Arg,negative,only allow binary associations
Arg,negative,see org argouml uml diagram ui fignodemodelelement updatenametext
Arg,negative,set the drop location in the case of d d
Arg,negative,see org argouml uml diagram ui fignodemodelelement texteditstarted  org tigris gef presentation figtext
Arg,negative,todo assumes public
Arg,negative,see org argouml uml diagram ui fignodemodelelement updatelisteners  java lang object
Arg,negative,melementimport
Arg,negative,see guisettingstabinterface gettabkey
Arg,negative,modifiers
Arg,negative,see java util collection remove  java lang object
Arg,negative,this sets the linewidth of all in the group
Arg,negative,see org argouml uml diagram ui umldiagram relocate  java lang object
Arg,negative,if the line angle is less than  degrees then snap the line straight
Arg,negative,todo associationrole
Arg,negative,a dependency potentially has many clients and suppliers we only consider the first of each  not clear that we should really accept the case where there is more than one of either
Arg,negative,a binary association is not a node so reject
Arg,negative,add the node  check that it is an actor or use case and add it to the model namespace
Arg,negative,see org argouml uml diagram state ui figstatevertex makeselection
Arg,negative,tell gef its changed
Arg,negative,see org argouml ui tabtarget settarget  java lang object
Arg,negative,add the element and place it in the namespace of the model
Arg,negative,see org argouml uml diagram activity ui figactionstate getnotationprovidertype
Arg,negative,tell gef
Arg,negative,todo settings
Arg,negative,everything else is ok
Arg,negative,see javax swing table tablemodel getcolumnclass  int
Arg,negative,remove a node
Arg,negative,see org argouml uml diagram layout layouter getobject  int
Arg,negative,remove an edge
Arg,negative,make port invisible unless mouse enters
Arg,negative,something was added nothing for us to worry about
Arg,negative,if it is concurrent and contains concurrent regions  the bottom region has a minimum height
Arg,negative,invoke the parent constructor first
Arg,negative,this makes dragging connected edges very smooth see org tigris gef presentation fig getclosestpoint  java awt point
Arg,negative,invoke the parent refresh first
Arg,negative,give up if the assocation ends do not have a type defined
Arg,negative,end class stylepanelfigusecase
Arg,negative,the vertex was dropped onto the diagram get the region as the first region in the statemachine if there is no region in the statemachine then create one
Arg,negative,initialize any other figs here
Arg,negative,see java awt event mouselistener mousepressed  java awt event mouseevent
Arg,negative,only the head should be filled  not the text
Arg,negative,notation settings are different since  we know that  at a minimum  the isshowpath setting can change because with implement pathcontainer  so we make sure that we have a private copy of the notation settings
Arg,negative,name updating
Arg,negative,make all the parts match the main fig
Arg,negative,text fig to hold the include label
Arg,negative, the profile configuration  holding noneditable applied profiles
Arg,negative,the include label it is not a true stereotype  so do not use the stereotype support
Arg,negative,do nothing
Arg,negative,try some action errors
Arg,negative,a binary association is not a node so reject
Arg,negative,add figs to the fignode in back to front order
Arg,negative,non nls 
Arg,negative,set the drop location in the case of d d
Arg,negative,the text will be set later
Arg,negative,check if multiple items are selected
Arg,negative,only show actions for associations not already on diagram
Arg,negative,make all the parts match the main fig
Arg,negative,only show actions for associations not already on diagram
Arg,negative,if the element import is in the old owned  it means it must have been removed make sure the associated model element is removed
Arg,negative,todo use per project undo manager  not global
Arg,negative,by default we do not show the attribute check box mark this object as a listener for the check box
Arg,negative,verify the name property was correctly updated
Arg,negative,add figs to the fignode in back to front order put this rectangle behind the rest  so it goes first
Arg,negative,todo we should be able to just call renderingchanged on the child figs here instead of doing an updateoperations
Arg,negative,make the line dashed
Arg,negative,list of objects note this methods which read write this do not appear to be used
Arg,negative,add an arrow with an open arrow head
Arg,negative,this module will still register as enabled for uml  but it wo not actually do anything
Arg,negative,make the edge go between nearest points
Arg,negative,see org tigris gef presentation fig setlinecolor  java awt color
Arg,negative,create a new version of the relevant fig
Arg,negative,if default namespace is not already set
Arg,negative,the nodes at the two ends
Arg,negative,the next if clause is important for the deployment diagram it detects if the enclosing fig is a component  in this case the container will be set for the owning interface
Arg,negative,the figs for the two end nodes
Arg,negative,see org tigris gef graph mutablegraphmodel canaddnode  java lang object
Arg,negative,link the new dependency in to the ends
Arg,negative,see org argouml uml diagram ui umldiagram getlabelname
Arg,negative,side effect this creates the fig
Arg,negative,see org argouml uml ui umlmodelelementlistmodel isvalidelement  object
Arg,negative,by default  do not show extension points
Arg,negative,see org tigris gef presentation fig getlinewidth
Arg,negative,use arbitrary dimensions for now
Arg,negative,now we are sure dm is a state
Arg,negative,get the parent vector first
Arg,negative,see tudresden ocl check types type conformsto  tudresden ocl check types type
Arg,negative,formula for a is described in the overall class description
Arg,negative,massociationend
Arg,negative,for an ellipse  we can put the box in the middle
Arg,negative,if dm is the top state of the statemachine  then it is not supposed to have incoming transitions
Arg,negative,see org tigris gef presentation fig paint  java awt graphics
Arg,negative,super returns  if any of gefs buttons was hit  but maybe one of the not gef buttons
Arg,negative,make the edge go between nearest points
Arg,negative,now we 're into processing each specific path item strategy at the moment  we only know pathitemplacement
Arg,negative,add menu to add an extension point or note placed one before last  so the properties entry is always last
Arg,negative,see javax swing table tablemodel getcolumnclass  int
Arg,negative,modifier menu placed one before last  so the properties entry is always last
Arg,negative,mutators hold write lock will deadlock if use is not thread safe
Arg,negative,work out the radii of the ellipse  a and b the top right corner of the ellipse  cartesian coordinates  centered on the origin  will be at  x  y
Arg,negative,now we are sure dm is a statevertex
Arg,negative,result as integers  rounded up we ensure that the radii are integers for convenience
Arg,negative,only for associations
Arg,negative,use the code from the figcircle  not the one from fig
Arg,negative,end class crinstancewithoutclassifier
Arg,negative,let is register for events from all modelelements that change the name or body text
Arg,negative,required for keylistener interface  but not used
Arg,negative,register for name changes  added extensionpoints and abstract makes the text italic all figs need to listen to remove  too
Arg,negative,now we are sure dm is a composite state
Arg,negative,register for extension points
Arg,negative,massociation
Arg,negative,set bounds will be called from our superclass constructor before our constructor has run  so make sure this gets set up if needed
Arg,negative,in deploymentdiagrams the situation is not the same as in other diagrams only classes  interfaces and objects can intersect each other while they are not the enclosingfig  so you have to prouve only these elements
Arg,negative,set up figtext to hold the condition
Arg,negative,distribute the extra height over the visible compartments
Arg,negative,join all into a group
Arg,negative,new style importers do not create diagrams  so we will do it based on the list of newelements that they created
Arg,negative,uml spec for extend does not call for name nor stereotype
Arg,negative,see javax swing jcomponent setvisible  boolean
Arg,negative,make sure the line is dashed
Arg,negative,see junit framework testcase setup
Arg,negative,set up the property panels for use case diagrams
Arg,negative,if we 're using a fixed offset  just add it and return no collision detection is done in this case
Arg,negative,the renderer should be a singleton
Arg,negative,see org argouml uml diagram activity ui selectionactionstate getnewnodetype  int
Arg,negative,allow all packages and classifiers
Arg,negative,two points for line segment used to compute slope of path here note that this is the average slope  not instantaneous  so it will give screwy results near bends in the path
Arg,negative,try the predecessors
Arg,negative,mcompositestate
Arg,negative,private constructor to enforce singleton
Arg,negative,end class crnavfrominterface
Arg,negative,todo this is using the default platform character encoding specifying an encoding will produce more predictable results
Arg,negative,cp is often the default  but windows  is the name listed by charset availablecharsets
Arg,negative,let the group recalculate its bounds and then tell gef we 've finished
Arg,negative,the clone method that should clone the jgraph with it is contents and the toolbar with it is contents since both jgraph as the toolbar are coming from the gef framework  cloning them will be hard work and should actually not be placed here but in a clone method of the jgraph and the toolbar see java lang object clone
Arg,negative,we accept a package  but not a model or a subsystem
Arg,negative,non nls 
Arg,negative,if we do not exclude a model here  then dropping the model on a usecase diagram causes a package to be drawn
Arg,negative,non nls  non nls  non nls 
Arg,negative,empty list
Arg,negative,see targetlistener targetset  targetevent
Arg,negative,private constructor to enforce singleton
Arg,negative,although we register for notification of diagrams being deleted  we currently depend on the targetmanager to assign a new target when this happens when we implement mdi and have our own list of open diagrams we can ressurect the use of this
Arg,negative,some convenience methods
Arg,negative,optimize for the normal case to minimize target changes
Arg,negative,read until the end section is found  discard generated content
Arg,negative,non nls 
Arg,negative,class table
Arg,negative,see org argouml uml ui umlcomboboxmodel isvalidelement  object
Arg,negative,select buttons
Arg,negative,the next associationend
Arg,negative,output directory
Arg,negative,no further listeners required in this case the rest is handled by the notationprovider and sub figs
Arg,negative,compile checkbox
Arg,negative,non nls 
Arg,negative,todo the last argument  recursive flag  should be a selectable option
Arg,negative,non nls 
Arg,negative,skip backup files this is actually a workaround for the cpp generator  which always creates backup files  it is a bug
Arg,negative,todo the following is carried over from setowner  but probably is not needed renderingchanged it does the following  add as needed  updatenametext updatestereotypetext updatestereotypeicon updatebounds damage
Arg,negative,todo this is using the default platform character encoding specifying an encoding will produce more predictable results
Arg,negative,non nls 
Arg,negative,todo get saved default directory outputdirectorycombobox getmodel setselecteditem  saveddir
Arg,negative,non nls 
Arg,negative,generate button
Arg,negative,iterate over all the associationends we only have a problem if there is an end connected to an interface and an end other than that end is navigable
Arg,negative,remove trailing
Arg,negative,container state composite state
Arg,negative,classify nodes by base path
Arg,negative,end at an interface ? navigable other end ?
Arg,negative,else ignore
Arg,negative,the following is a possible future improvement of the modelchanged function michiel propose not to do this to keep architecture stable
