Arg,negative,should be element not eobject really
Arg,negative,see org argouml kernel delayedvchangelistener delayedvetoablechange  java beans propertychangeevent
Arg,negative,classifier powertype
Arg,negative,see javax swing table tablemodel setvalueat  java lang object  int  int
Arg,negative,todo signal receptions association not navigable in this direction
Arg,negative,see java beans propertychangelistener propertychange  java beans propertychangeevent
Arg,negative,usage differs from uml
Arg,negative,see javax swing abstractlistmodel firecontentschanged  object  int  int
Arg,negative,usage differs from uml
Arg,negative,see java awt event actionlistener actionperformed  java awt event actionevent
Arg,negative,transitions can have multiple triggers now
Arg,negative,see java awt event actionlistener actionperformed  java awt event actionevent
Arg,negative,gone in uml  x
Arg,negative,see javax swing tree treecellrenderer gettreecellrenderercomponent  javax swing jtree  java lang object  boolean  boolean  boolean  int  boolean
Arg,negative,actionstate  callstate  and subactivitystate have been replaced in uml by explicitly modeled actions
Arg,negative,see java awt event actionlistener actionperformed  java awt event actionevent
Arg,negative,todo double check tfm
Arg,negative,this method is overridden in order to ignore change of the y coordinate during dragging see org tigris gef presentation fignode supertranslate  int  int
Arg,negative,todo gone in uml 
Arg,negative,see propertychangelistener propertychange  propertychangeevent
Arg,negative,todo gone in uml 
Arg,negative,we have already confirmed the connection is valid
Arg,negative,todo double check tfm
Arg,negative,mdr classes may have a uml or uml prefix which should be removed
Arg,negative,todo double check tfm
Arg,negative,see junit framework testcase setup
Arg,negative,below for uml compatibility
Arg,negative,see junit framework testcase setup
Arg,negative,todo double check tfm
Arg,negative,see junit framework testcase setup
Arg,negative,todo gone in uml 
Arg,negative,see junit framework testcase setup
Arg,negative,todo changed for uml  x
Arg,negative,see junit framework testcase setup
Arg,negative,has subsystem stereotype
Arg,negative,see junit framework testcase setup
Arg,negative,action  handle  get
Arg,negative,here we are actually violating the test independance since we keep the detailspane from test to test the reason to do this is to make it possible to run the tests with less memory requirements hopefully someone might eventually fix the detailspane so that it is garbage collected properly and this is no longer needed see junit framework testcase setup
Arg,negative,not in uml
Arg,negative,ok  so that did not work out just ignore any problems and do not set the name in the constraint body better had log it
Arg,negative,non nls  non nls 
Arg,negative,see org tigris gef graph mutablegraphmodel canaddedge  java lang object
Arg,negative,even though this is not relevant for uml we have code calling this that expects it for uml  and we must handle it gracefully
Arg,negative,see junit framework testcase setup
Arg,negative,non nls  non nls 
Arg,negative,see abstracttestactionadddiagram getvalidnamespaceclasses
Arg,negative,return redefinableelement  handle  isroot todo one part of uml  spec says that this is as above  but it appears to be gone tfm
Arg,negative,all of the applicationlistener methods are void return null regardless of what happens
Arg,negative,non nls 
Arg,negative,see org argouml cognitive critics critic todoitem  java lang object  org argouml cognitive designer
Arg,negative,non nls 
Arg,negative,place in the middle of the line and ensure the line is dashed add an arrow with an open arrow head remember that for an extends relationship  the arrow points to the base use case  but because of the way we draw it  that is still the destination end
Arg,negative,lifeline setrepresents  prop
Arg,negative,calling connect will add the edge to the graphmodel and any layerpersectives on that graphmodel will get a edgeadded event and will add an appropriate figedge  determined by the graphedgerenderer
Arg,negative,non nls 
Arg,negative,see org argouml uml cognitive critics cruml getcriticizeddesignmaterials
Arg,negative,non nls 
Arg,negative,see org argouml cognitive critics critic initwizard  org argouml cognitive ui wizard
Arg,negative,an associationend is now a property owned by an association
Arg,negative,see org argouml uml ui umlcomboboxmodel addelement  java lang object
Arg,negative,throw new notimplementedexception  this is not a uml element  non nls 
Arg,negative,see java awt dnd droptargetlistener drop  java awt dnd droptargetdropevent
Arg,negative,non nls  non nls 
Arg,negative,jmenuitem cutitem edit add  actioncut getinstance  setmnemonic  cutitem  cut  setaccelerator  cutitem  ctrlx  jmenuitem copyitem edit add  actioncopy getinstance  setmnemonic  copyitem  copy  setaccelerator  copyitem  ctrlc  jmenuitem pasteitem edit add  actionpaste getinstance  setmnemonic  pasteitem  paste  setaccelerator  pasteitem  ctrlv  edit addseparator
Arg,negative,non nls  non nls 
Arg,negative,see org tigris gef presentation fig getclosestpoint  java awt point
Arg,negative,todo exception has been removed for uml  x just return signal for now tfm
Arg,negative,see java beans vetoablechangelistener vetoablechange  java beans propertychangeevent
Arg,negative,gone in uml  x just classifier now
Arg,negative,only association end has an aggregation option box
Arg,negative,todo not really the same thing  but close
Arg,negative,delete collaborationinstancesets where this is the last participatinginstance
Arg,negative,the name of the meta type is the class name  after the last  and before the impl or end of class name
Arg,negative,see org tigris gef presentation fig getlinewidth
Arg,negative,todo gone in uml  x return place holder for now
Arg,negative,the source of the transition is a choice
Arg,negative,todo no separate syncstate in uml tfm
Arg,negative,see org argouml ui clarifier settodoitem  org argouml cognitive todoitem
Arg,negative,actionsequence class
Arg,negative,comment out when we are ready to release undo redo jmenuitem undoitem edit add  projectactions getinstance getundoaction  setmnemonic  undoitem  undo  shortcutmgr assignaccelerator  undoitem  shortcutmgr action undo  jmenuitem redoitem edit add  projectactions getinstance getredoaction  setmnemonic  redoitem  redo  shortcutmgr assignaccelerator  redoitem  shortcutmgr action redo  edit addseparator
Arg,negative,classifierinstate class
Arg,negative,find the target in the project browser we can only do anything if its a use case
Arg,negative,argument class
Arg,negative,the close window shortcut  alt f  actually ca not be registered as a shortcut  because it closes the configuration dialog
Arg,negative,attributelink class
Arg,negative,see javax management notificationbroadcaster addnotificationlistener  javax management notificationlistener  javax management notificationfilter  java lang object
Arg,negative,access should be fast
Arg,negative,detach any edges  such as comment edges  already attached to the figassociation before the figassociation is removed they will later be re attached to the new fignodeassociation
Arg,negative,iteration should be fast
Arg,negative,see org tigris gef presentation fig setlinewidth  int
Arg,negative,literalspecification
Arg,negative,only reset the text if the two are not the same  i e the fig has moved  rather than we 've just edited the text  when settargetbbox will have made them the same  note that stylebounds could be null  so we do the test this way round
Arg,negative,
Arg,negative,see org tigris gef presentation fig getfillcolor
Arg,negative,i e eventtype notification remove
Arg,negative,begin andromda code
Arg,negative,implements commandstack
Arg,negative,not in uml  x  or metatypes  type additem  predicatemtype create  model getmetatypes getactivitygraph
Arg,negative,list add  opaqueexpression
Arg,negative,subtract the the offset of the click  to take account of user having not initially clicked in the centre
Arg,negative,literalspecification list add  literalnull  when other ok
Arg,negative,if a default action was voided then we have to save it
Arg,negative,list add  literalinteger  when other ok
Arg,negative,if the edge is from a circle to a circle  e g between use cases  we have our own implementation overriding gef which attempts to keep the edges perpendicular if the edge is already close to perpendicular
Arg,negative,list add  literalunlimitednatural  when other ok
Arg,negative,see org tigris gef presentation fig setlinecolor  java awt color
Arg,negative,list add  instancevalue
Arg,negative,return the node or edge that owns the given port see org tigris gef graph basegraphmodel getowner  java lang object
Arg,negative,todo else exception
Arg,negative,delete messages which have this as sender or receiver
Arg,negative,ca not be changed
Arg,negative,non nls 
Arg,negative,rewrite it after change setexpression ?
Arg,negative,see java awt event actionlistener actionperformed  java awt event actionevent
Arg,negative,as write in uml specification  we have size  bodies  size  langs  we must have tabvalues length  
Arg,negative,see java lang object clone
Arg,negative,literalspecification
Arg,negative,see javax swing table tablemodel getrowcount
Arg,negative,ca not be set
Arg,negative,see org netbeans lib jmi xmi xmicontext getreference  java lang string  java lang string
Arg,negative,rewrite it after change setexpression ?
Arg,negative,suggest that actors may not connect  see javadoc comment about this
Arg,negative,a link is an assocation in uml x
Arg,negative,non nls 
Arg,negative,we need a method  operation implementation  to store the method body
Arg,negative,the  arg version of this method depends on this ordering do not change it
Arg,negative,maybe this operation already has a method  that fits our purpose ? in this case  try to reuse it  instead of creating a new implementation
Arg,negative,checkstyle off ignore too many parameters since api is fixed by mdr
Arg,negative,check  if we have to create a new implementation
Arg,negative,see org tigris gef presentation fig setbounds  int  int  int  int
Arg,negative,create a new implementation
Arg,negative,this will contain the figs that we do not need anymore
Arg,negative,and set the specification to the current operation
Arg,negative,non nls 
Arg,negative,add it to the operation is methods
Arg,negative,see java lang runnable run
Arg,negative,look  if there is already a java implementation
Arg,negative,see org tigris gef presentation fig getminimumsize
Arg,negative,job done
Arg,negative,todo get default output directory from user settings project p projectmanager getmanager getcurrentproject p getprojectsettings setgenerationoutputdir  path
Arg,negative,it seems  there was no implementation of our current target language  so we just add one
Arg,negative,compare path of two elements in reverse order  inner to outer  using a primary strength text collator this will collate e  e together  but not eliminate non identical strings which collate in the same place return equivalent of list compareto  list
Arg,negative,we cannot set the body of this model element type
Arg,negative,see javax swing table tablemodel getcolumnname  int
Arg,negative,removed from uml  x
Arg,negative,see guisettingstabinterface handlesettingstabrefresh
Arg,negative,also parse  or  n etc
Arg,negative,mmessage
Arg,negative,warning this has containment side effects  eclipse uml will move the property from the classifier to the association when the navigability is changed
Arg,negative,do nothing
Arg,negative,
Arg,negative,param item the todo item param reason the reason todo use it  return code true code if the argument was a component of this list code false code otherwise throws unresolvableexception unable to resolve
Arg,negative,non nls  non nls 
Arg,negative,accessors
Arg,negative,uml  x only
Arg,negative,the machine state has got a new name
Arg,negative,non nls  non nls 
Arg,negative,where there is more than one supplier or client  take the first element in each case there really ought to be a check that there are some here for safety
Arg,negative,non nls  non nls 
Arg,negative,accessors
Arg,negative,for other xmi files with further namespaces
Arg,negative,the boundary box as held in the target fig  and as listed in the boundary box style field  null if we do not have anything valid
Arg,negative,eclipse namespaces
Arg,negative,see org tigris gef presentation fig getlinecolor
Arg,negative,for the uml files in the eclipse jar files  we need this
Arg,negative,only add mof elements  not primitive datatypes
Arg,negative,non nls  non nls 
Arg,negative,todo verify this iiuc  then this triggers the compountstatefig to draw itself correctly hence  there was a reason to wait this long to make the state concurrent
Arg,negative,non nls  non nls 
Arg,negative,see org tigris gef presentation fig makeselection
Arg,negative,non nls 
Arg,negative,see java lang object clone
Arg,negative,non nls 
Arg,negative,notation events are likely to cause gef swing operations  so we dispatch them on the swing event thread as a convenience so that the receiving notationchanged methods do not need to deal with it
Arg,negative,non nls 
Arg,negative,we clear the save required flag on the swing event thread in the hopes that it gets done after any other background work  listener updates  that is being done there
Arg,negative,not needed currently for uml 
Arg,negative,make the result inmediately visible in case of apply
Arg,negative,non nls  non nls 
Arg,negative,an error that can be corrected by the user  so no stack trace  but instead an explanation and a hint how to fix
Arg,negative,non nls  non nls 
Arg,negative,see org tigris gef presentation fig getclosestpoint  java awt point
Arg,negative,non nls 
Arg,negative,create a proxy object around this handler that can be reflectively added as an apple applicationlistener
Arg,negative,non nls 
Arg,negative,see javax swing table tablemodel getvalueat  int  int
Arg,negative,non nls  non nls 
Arg,negative,process the listeners last to first  notifying those that are interested in this event
Arg,negative,non nls  non nls 
Arg,negative,see org argouml uml cognitive critics cruml getcriticizeddesignmaterials
Arg,negative,non nls 
Arg,negative,there are various details panes all of which could hold different tabs pages according to users settings place each pane in the required border area
Arg,negative,final object scope
Arg,negative,see javax swing table tablemodel getcolumnname  int
Arg,negative,non nls  non nls 
Arg,negative,see org argouml uml ui umlexpressionmodel setexpression  java lang object
Arg,negative,non nls  non nls 
Arg,negative,remove the old project first it is wasteful to create a temp empty project  but too much of argouml depends on having a current project
Arg,negative,non nls 
Arg,negative,targetlistener methods implemented so notified when selected diagram changes used to update the window title
Arg,negative,nothing to do
Arg,negative,mvw indeed the intention of the constructor parameter is to prove that there is a valid uml object to bind the notation to so  the next statement should fail on a null parameter  and on anything that is not an object of which we can retrieve the multiplicity
Arg,negative,see org argouml model umlhelper getsource  java lang object
Arg,negative,although not generally true for gef  for argo we know that the layer is a layerperspective which knows the associated diagram
Arg,negative,non nls  non nls 
Arg,negative,prptodo createproperty  label todo pane  positions  tabtodo class  prpproperties createproperty  label properties pane  positions  tabprops class  prpdocumentation createproperty  label documentation pane  positions  tabdocumentation class  prpstyle createproperty  label style pane  positions  tabstyle class  prpsource createproperty  label source pane  positions  tabsrc class  prpconstraints createproperty  label constraints pane  positions  tabconstraints class  prptaggedvalues createproperty  label tagged values pane  positions  tabtaggedvalues class  property propertylist new property prptodo  prpproperties  prpdocumentation  prpstyle  prpsource  prpconstraints  prptaggedvalues  arrays sort  propertylist  top add  new jscrollpane  new propertytable  propertylist  panecolumnheader  positioncolumnheader  borderlayout center
Arg,negative,non nls  non nls 
Arg,negative,initialize the module loader at least the plug ins that provide profiles need to be initialized before the project is loaded  because some of these profile may have been set as default profiles and need to be applied to the project as soon as it has been created or loaded the first instance of a project is needed during the gui initialization
Arg,negative,non nls  non nls 
Arg,negative,create an anonymous class as a kind of adaptor for the cognitive system to provide proper translation in
Arg,negative,non nls  non nls 
Arg,negative,see org tigris gef presentation fig getlinewidth
Arg,negative,in uml  we model a method as a behavior  initially opaquebehavior
Arg,negative,see org argouml ui explorer rules perspectiverule getrulename
Arg,negative,extent ignored for euml implementation  required for netbeans mdr
Arg,negative,add listener to get notified when active diagram changes
Arg,negative,see org argouml model umlhelper move  java lang object  org argouml model umlhelper direction
Arg,negative,we need to verify that ns is a package  if not find its parent package  otherwise this causes an exception when creating a sequence diagram for a classifierrole
Arg,negative,see org argouml model extensionmechanismshelper getcommontaggedvaluetypes
Arg,negative,see java beans propertychangelistener propertychange  java beans propertychangeevent
Arg,negative,cmd setobjects  run getparams get  
Arg,negative,process the listeners last to first  notifying those that are interested in this event
Arg,negative,non nls 
Arg,negative,see org tigris gef presentation fig setfillcolor  java awt color
Arg,negative,also apply subprofiles
Arg,negative,see org argouml profile internal ocl modelinterpreter invokefeature  java util map  java lang object  java lang string  java lang string  java lang object
Arg,negative,non nls 
Arg,negative,eliminate classifiers which already have an unnamed role
Arg,negative,non nls 
Arg,negative,see java awt event actionlistener actionperformed  java awt event actionevent
Arg,negative,non nls 
Arg,negative,this needs to iterate to fill entire output raster if implemented return image copydata  outraster
Arg,negative,non nls 
Arg,negative,now let is check if the new line is already present in the old list of internal transitions if it is  then mark the old one to be retained  i e do not create a new one if it is not  continue with parsing
Arg,negative,non nls 
Arg,negative,we only need to add the classloader once and if and only if there is at least a profile in the jar
Arg,negative,commontaggedvaluetypes add  org eclipse uml uml resource umlresource
Arg,negative,see org tigris gef presentation fig getlinecolor
Arg,negative,remove base class by destroying the extension
Arg,negative,process the listeners last to first  notifying those that are interested in this event
Arg,negative,consider the property multiplicity
Arg,negative,no state with the given name is found  so we have to reject the complete user is input
Arg,negative,or getdefaultvaluefor  prop  ?
Arg,negative,search all attributes found to those expected if any do not match then turn off the found flag so that we search for the next matching tag
Arg,negative,too bad  we choose to take the first value
Arg,negative,if save did not raise an exception and name exists move name to name this is the correct backup file
Arg,negative,ready to set the value finally
Arg,negative,todo isstatic in uml  x
Arg,negative,in case of a tagged value  the type should not be set here
Arg,negative,see org tigris gef presentation fig setlinecolor  java awt color
Arg,negative,also unapply subprofiles
Arg,negative,see java awt event keylistener keytyped  java awt event keyevent
Arg,negative,also define subprofiles
Arg,negative,see org tigris gef presentation fig paint  java awt graphics
Arg,negative,associationrole class  classifierrole class
Arg,negative,  constraint
Arg,negative,non nls 
Arg,negative,see org tigris gef presentation fig getfillcolor
Arg,negative,non nls 
Arg,negative,see org tigris gef presentation fig setfillcolor  java awt color
Arg,negative,non nls 
Arg,negative,because we 're listening for stereotypes being added and removed but we 're really interested in their owned tag definitions  the default implementation wo not work for us
Arg,negative,link class  instance class transition class  statevertex class
Arg,negative,do not set buildingmodel false here  otherwise the action for selection is performed
Arg,negative,message class  classifierrole class
Arg,negative,end class startcritics
Arg,negative,note for uml the aggregation ends are swapped
Arg,negative,see org tigris gef presentation fig getfillcolor
Arg,negative,in uml subsystem is a component with subsystem stereotype so this must occur after the metatypes getcomponent case
Arg,negative,initialized in static initializer block below
Arg,negative,find the passed in container in validcontainmentmap
Arg,negative,see org argouml cognitive critics critic todoitem  java lang object  org argouml cognitive designer
Arg,negative,determine if metatype is a valid element for container
Arg,negative,this double 'for' loop may be optimised as follows use arrays in stead of a set for bases have the second loop start from the element after base but i chose not to do this  since the gain is small  and this is only used for a lazily filled combo btw this is also used by notation
Arg,negative,specifies valid elements for a region to contain
Arg,negative,see org tigris gef graph graphfactory makeedge
Arg,negative,specifies valid elements for a region to contain
Arg,negative,see org tigris gef presentation fig setfillcolor  java awt color
Arg,negative,specifies valid elements for a package to contain
Arg,negative,this class represents all diagrams within argouml it is based upon the gef diagram p it adds a namespace  and the capability to delete itself when its namespace is deleted p todo mvw i am not sure of the following p the namespace of the diagram is e g used when creating new elements that are shown on the diagram they will have their namespace set according this it is not necessarily equal to the owner p mvw i doubt all following the namespace of the diagram is e g used to register a listener to the uml model  to be notified if this element is removed which will imply that this diagram has to be deleted  too p hence the namespace of e g a collaboration diagram should be the represented classifier or  in case of a represented operation  the classifier that owns this operation and the namespace of the statechart diagram should be the namespace of its statemachine
Arg,negative,specifies valid elements for a package to contain
Arg,negative,constructor for a link figclass during file load p parent link org argouml uml diagram ui fignodemodelelement will have created the main box link getbigport and its name link getnamefig and stereotype  link getstereotypefig this constructor creates a box for the attributes and operations p the properties of all these graphic elements are adjusted appropriately the main boxes are all filled and have outlines todo which is wrong  since the bigport is filled  too param element model element to be represented by this fig param bounds rectangle describing bounds param settings rendering settings
Arg,negative,valid elements for a profile to contain
Arg,negative,see org tigris gef base selection draghandle  int  int  int  int  org tigris gef presentation handle
Arg,negative,specifies valid elements for a class to contain
Arg,negative,see org tigris gef graph graphfactory makenode
Arg,negative,specifies valid elements for a classifier to contain
Arg,negative,makes sure that the edges stick to the outline of the fig see org tigris gef presentation fig getgravitypoints
Arg,negative,specifies valid elements for a signal to contain
Arg,negative,see java awt event mouselistener mousereleased  java awt event mouseevent
Arg,negative,specifies valid elements for an actor to contain
Arg,negative,see org tigris gef presentation fig setfillcolor  java awt color
Arg,negative,specifies valid elements for a use case to contain
Arg,negative,see java awt event mouselistener mousereleased  java awt event mouseevent
Arg,negative,specifies valid elements for a component to contain
Arg,negative,see org tigris gef presentation fig removefromdiagram
Arg,negative,specifies valid elements for a node to contain
Arg,negative,test case for the above code draw a class create a stereotype for it by clicking on the prop panel tool  and name it remove the class from the diagram drag the class from the explorer on the diagram select the stereotype in the explorer  and change its name in the prop panel to something longer the longer name does not make the class fig wider unless the above code is added
Arg,negative,non nls  non nls 
Arg,negative,see java awt event keylistener keytyped  java awt event keyevent
Arg,negative,if there is not a rd column then this represents a connection of elements of the same type
Arg,negative,see java awt event keylistener keypressed  java awt event keyevent
Arg,negative,if there is a rd column then this represents a connection of between  different types of element
Arg,negative,see org tigris gef presentation fig damage
Arg,negative,if the array has not been flagged to indicate otherwise swap elements the elemnts and add again
Arg,negative,see org tigris gef presentation fig setfillcolor  java awt color
Arg,negative,specifies valid elements for a datatype to contain
