EMF,negative,non javadoc see org eclipse emf codegen merge java facade facadehelper addchild org eclipse emf codegen merge java facade jnode org eclipse emf codegen merge java facade jnode
EMF,negative,match against every other operation but this one
EMF,negative,check the type of the specified child object and return the proper feature to use for adding see link addcommand it as a child
EMF,negative,javadoc copied from base class
EMF,negative,non javadoc see org eclipse jface dialogs dialog createbuttonsforbuttonbar org eclipse swt widgets composite
EMF,negative,ignore it if it is not a class not being a class is diagnosed for the generic type itself
EMF,negative,non nls 
EMF,negative,the cipheroutputstream shoudl not close the underlying stream
EMF,negative,class setgenfeature annotations insert javajetinc
EMF,negative,ensure that the class loader for this class will be used downstream
EMF,negative,two slashes means we may have authority but definitely means we  re either matching net path or abs path these two productions are ambiguous in that every net path except those containing an ipv reference is an abs path rfc resolves this ambiguity by applying a greedy left most matching rule try matching net path first and if that fails we do not have authority so then attempt to match abs path net path authority abs path abs path path segments
EMF,negative,do not bother complaining about things with no name since there are constraints for that problem
EMF,negative,non javadoc see org eclipse emf codegen merge java facade ast astjnode insertsibling org eclipse emf codegen merge java facade ast astjnode org eclipse emf codegen merge java facade ast astjnode boolean
EMF,negative,ecoreswitch
EMF,negative,eatm getdecoratedadapterfactory
EMF,negative,a document root can have multiple id attributes because there can be multiple global element or attribute declarations of type id and these will be the id in the complex types that reference them i e they are not really the id of the document root
EMF,negative,non nls 
EMF,negative,for performance skip matching all the features of the first super type
EMF,negative,action bar
EMF,negative,note that the copied tree should not be modified by wrapped astjfield the copied tree will have source ranges for all nodes in the source file hence the get methods in the new astjfield will not return the right contents
EMF,negative,non nls 
EMF,negative,remember the static instance
EMF,negative,two slashes means we may have authority but definitely means we  re either matching net path or abs path these two productions are ambiguous in that every net path except those containing an ipv reference is an abs path rfc resolves this ambiguity by applying a greedy left most matching rule try matching net path first and if that fails we do not have authority so then attempt to match abs path net path authority abs path abs path path segments
EMF,negative,get the adapter from the factory
EMF,negative,non nls 
EMF,negative,checks whether the string contains any more segments after the one that starts at position i
EMF,negative,preload
EMF,negative,javadoc copied from base class
EMF,negative,non javadoc see org eclipse emf ecore xmi xmlresource xmlmap add org eclipse emf ecore enamedelement org eclipse emf ecore xmi xmlresource xmlinfo
EMF,negative,get the adapter from the factory
EMF,negative,non javadoc see org eclipse emf codegen merge java facade ast astjnode remove org eclipse emf codegen merge java facade ast astjnode
EMF,negative,javadoc copied from interface
EMF,negative,if we get to this point we need to resolve relative path rfc 
EMF,negative,create the key from the key bytes
EMF,negative,begin user doc the b adapter factory b for the model it provides an adapter code createxxx code method for each class of the model end user doc see org eclipse emf codegen ecore genmodel genmodelpackage generated
EMF,negative,list sublist estructuralfeature feature int from int to elist list estructuralfeature feature
EMF,negative,class eisset override javajetinc
EMF,negative,this must have no fewer segments than the prefix since the prefix is not the root absolute path its last segment is empty all others must match
EMF,negative,non nls 
EMF,negative,create new field and replace it all by original contents
EMF,negative,javadoc copied from base class
EMF,negative,fill of value byte fill of value byte fill of value byte 
EMF,negative,non nls 
EMF,negative,if this is a hierarchical uri reference and prefix is a prefix of it returns the portion of the path remaining after that prefix has been trimmed null otherwise
EMF,negative,do nothing
EMF,negative,encodes a complete uri optionally leaving characters unescaped when beginning a valid three character escape sequence we can either treat the first or as a fragment separator or encode them all
EMF,negative,non nls 
EMF,negative,get the adapter from the factory
EMF,negative,non nls 
EMF,negative,returns the character encoded by followed by the two given hex digits which is always xff or less so can safely be casted to a byte if either character is not a hex digit a bogus result will be returned
EMF,negative,colormap put clr grad start clr 
EMF,negative,check for scheme rfc if we found a scheme it means absolute uri so we  re done
EMF,negative,non javadoc see org eclipse emf codegen merge java facade abstractjnode computequalifiedname
EMF,negative,get the adapter from the factory
EMF,negative,if the scheme specific part is opaque it can contain and uric no slash was not modified by rfc which i  ve interpreted as an error in the spec since the production should be equivalent to uric and uric contains and mrglavas
EMF,negative,returns the shortest relative path between the the non relative path of the given base and this absolute path if the base has no path it is treated as the root absolute path
EMF,negative,non nls 
EMF,negative,validates all of the uri components factory methods should call this before using the constructor though they must ensure that the inter component requirements described in their own javadocs are all satisfied themselves if a new uri is being constructed out of an existing uri this need not be called instead just the new components may be validated individually
EMF,negative,if the scheme specific part is opaque it can contain and uric no slash was not modified by rfc which i  ve interpreted as an error in the spec since the production should be equivalent to uric and uric contains and mrglavas
EMF,negative,there is no match if the types are different and they do not each specify the same non null instance class name
EMF,negative,interpret it as part of the name
EMF,negative,the string must contain inappropriate whitespace so find the index for the first difference
EMF,negative,system err println logged throwable throwable printstacktrace
EMF,negative,when used as a generic super type there must be a classifier that refers to a class
EMF,negative,we do not want to diagnose any errors that have already been diagnosed by a super type although we ignore all the first super is features there may be mixin classes that still would result in duplicates
EMF,negative,do not complain about the literals if they are the same as the names and the names collide
EMF,negative,encodingmap is a convenience class which handles conversions between iana encoding names and java encoding names and vice versa the encoding names used in xml instance documents strong must strong be the iana encoding names specified or one of the aliases for those names which iana defines p table border width tr td width p align center b common name b td td width p align center b use this name in xml files b td td width p align center b name type b td td width p align center b xerces converts to this java encoder name b td tr tr td width bit unicode td td width p align center utf td td width p align center iana td td width p align center utf td tr tr td width iso latin td td width p align center iso td td width p align center mime td td width p align center iso td tr tr td width iso latin td td width p align center iso td td width p align center mime td td width p align center iso td tr tr td width iso latin td td width p align center iso td td width p align center mime td td width p align center iso td tr tr td width iso latin td td width p align center iso td td width p align center mime td td width p align center iso td tr tr td width iso latin cyrillic td td width p align center iso td td width p align center mime td td width p align center iso td tr tr td width iso latin arabic td td width p align center iso td td width p align center mime td td width p align center iso td tr tr td width iso latin greek td td width p align center iso td td width p align center mime td td width p align center iso td tr tr td width iso latin hebrew td td width p align center iso td td width p align center mime td td width p align center iso td tr tr td width iso latin td td width p align center iso td td width p align center mime td td width p align center iso td tr tr td width ebcdic us td td width p align center ebcdic cp us td td width p align center iana td td width p align center cp td tr tr td width ebcdic canada td td width p align center ebcdic cp ca td td width p align center iana td td width p align center cp td tr tr td width ebcdic netherlands td td width p align center ebcdic cp nl td td width p align center iana td td width p align center cp td tr tr td width ebcdic denmark td td width p align center ebcdic cp dk td td width p align center iana td td width p align center cp td tr tr td width ebcdic norway td td width p align center ebcdic cp no td td width p align center iana td td width p align center cp td tr tr td width ebcdic finland td td width p align center ebcdic cp fi td td width p align center iana td td width p align center cp td tr tr td width ebcdic sweden td td width p align center ebcdic cp se td td width p align center iana td td width p align center cp td tr tr td width ebcdic italy td td width p align center ebcdic cp it td td width p align center iana td td width p align center cp td tr tr td width ebcdic spain latin america td td width p align center ebcdic cp es td td width p align center iana td td width p align center cp td tr tr td width ebcdic great britain td td width p align center ebcdic cp gb td td width p align center iana td td width p align center cp td tr tr td width ebcdic france td td width p align center ebcdic cp fr td td width p align center iana td td width p align center cp td tr tr td width ebcdic arabic td td width p align center ebcdic cp ar td td width p align center iana td td width p align center cp td tr tr td width ebcdic hebrew td td width p align center ebcdic cp he td td width p align center iana td td width p align center cp td tr tr td width ebcdic switzerland td td width p align center ebcdic cp ch td td width p align center iana td td width p align center cp td tr tr td width ebcdic roece td td width p align center ebcdic cp roece td td width p align center iana td td width p align center cp td tr tr td width ebcdic yugoslavia td td width p align center ebcdic cp yu td td width p align center iana td td width p align center cp td tr tr td width ebcdic iceland td td width p align center ebcdic cp is td td width p align center iana td td width p align center cp td tr tr td width ebcdic urdu td td width p align center ebcdic cp ar td td width p align center iana td td width p align center cp td tr tr td width chinese for prc mixed byte td td width p align center gb td td width p align center mime td td width p align center gb td tr tr td width extended unix code packed for japanese td td width p align center euc jp td td width p align center mime td td width p align center eucjis td tr tr td width japanese iso jp td td width p align center iso jp td td width p align center mime td td width p align center jis td tr tr td width japanese shift jis td td width p align center shift jis td td width p align center mime td td width p align center sjis td tr tr td width chinese big td td width p align center big td td width p align center mime td td width p align center big td tr tr td width extended unix code packed for korean td td width p align center euc kr td td width p align center mime td td width p align center iso kr td tr tr td width cyrillic td td width p align center koi r td td width p align center mime td td width p align center koi r td tr table author tamura kent ibm author andy clark ibm
EMF,negative,ca not have both a classifier and a type parameter
EMF,negative,non javadoc see org eclipse emf codegen merge java facade ast astjnode addchild org eclipse emf codegen merge java facade jnode
EMF,negative,add userinfo characters
EMF,negative,non nls 
EMF,negative,the type parameter must be in scope and must not be a forward reference
EMF,negative,javadoc copied from interface
EMF,negative,ignore trailing whitespace
EMF,negative,non nls 
EMF,negative,incorrect number of type arguments
EMF,negative,non nls 
EMF,negative,have no arguments when they are allowed is only a warning
EMF,negative,non nls 
EMF,negative,ca not have both an upper and lower bound
EMF,negative,non javadoc see org eclipse emf ecore xmi xmlresource xmlmap getclassifier java lang string java lang string
EMF,negative,wildcards are only allowed in type arguments
EMF,negative,non javadoc see org eclipse emf ecore xmi xmlresource xmlmap getfeature org eclipse emf ecore eclass java lang string java lang string
EMF,negative,ca not have type arguments unless there is a classifier
EMF,negative,non nls 
EMF,negative,ca not have a classifier or a type parameter as well as bounds
EMF,negative,non nls 
EMF,negative,can only have bounds when used as a type argument
EMF,negative,remove add the action bar from the view so to avoid having an empty action bar participating in the view is layout calculation and maybe causing an empty bar to appear
EMF,negative,if the type also specifies a classifier
EMF,negative,mappingpackage epackage complextypeconverter msg getnotifier epackagemapping
EMF,negative,we test their relationship either via them both being classes
EMF,negative,when the pane or any child gains focus notify the workbench
EMF,negative,if the are the same then it is bounded properly
EMF,negative,non nls 
EMF,negative,namespace context
EMF,negative,calls code casexxx code for each class of the model until one returns a non null result it yields that result begin user doc end user doc return the first non null result returned by a code casexxx code call generated
EMF,negative,this is for the topdown feature
EMF,negative,non nls 
EMF,negative,the arguments type parameters lower bounds and upper bounds must be equal type arguments
EMF,negative,calls code casexxx code for each class of the model until one returns a non null result it yields that result begin user doc end user doc return the first non null result returned by a code casexxx code call generated
EMF,negative,set up the substitutions of any type parameters this class has with respect to the type arguments for them
EMF,negative,non nls 
EMF,negative,ignore leading whitespace
EMF,negative,non nls 
EMF,negative,determine if there is a bounding generic super type
EMF,negative,non nls 
EMF,negative,if there is a upper bound the bound must bound it
EMF,negative,create a new array
EMF,negative,test if there are type parameters that might require substitution
EMF,negative,new declaration will not have fragments until performsplit is called
EMF,negative,if there is a type parameter one of its bounds must be bounded by the bound
EMF,negative,add leading comments
EMF,negative,if the generic type is a wildcard it ca not be bounded by another wildcard
EMF,negative,do nothing
EMF,negative,failing all those cases there must be an lower bound that bounds it
EMF,negative,ignore
EMF,negative,if there is an lower bound the type argument must bound it
EMF,negative,starting traverse file and build unit tree and table info
EMF,negative,if one is null but the other is not then they ca not be equal
EMF,negative,ignore
EMF,negative,if they both are not null
EMF,negative,non nls 
EMF,negative,i e the classifiers are considered equal if they wrap the same non null type
EMF,negative,non nls 
EMF,negative,consider the instance type names they wrap to see if they are non null and equal
EMF,negative,create ok and details buttons
EMF,negative,if they are the same classifier they are of course equal
EMF,negative,non nls 
EMF,negative,if one is null but the other is not then they are not equal
EMF,negative,new template container label
EMF,negative,if they are the same instance they are equal
EMF,negative,non nls 
EMF,negative,go through the commands of the list
EMF,negative,ignore
EMF,negative,index should be 
EMF,negative,define a class loader that looks up classes using the urls or the parent class loader and failing those tries to look up the class in each bundle in the running jvm
EMF,negative,ecoreadapterfactory
EMF,negative,ignore
EMF,negative,add the key value pairs to the output string
EMF,negative,update the containing map if necessary
EMF,negative,public list sublist int from int to return featuremap sublist getestructuralfeature from to
EMF,negative,non nls 
EMF,negative,for the extended meta data to be created
EMF,negative,log the error ignore the change and continue
EMF,negative,reverse the test
EMF,negative,iterate over the mappings in the tree
EMF,negative,entrycursor
EMF,negative,do nothing
EMF,negative,do not cache this one as it will cause leaks because to dynamic demand created document roots and demand created eclasses
EMF,negative,begin user doc the b adapter factory b for the model it provides an adapter code createxxx code method for each class of the model end user doc see org eclipse emf mapping mappingpackage generated
EMF,negative,we can also optimize single valued reverse
EMF,negative,reset text edits since this node is processed successfully there is no need to revert these changes
EMF,negative,eenumimpl overrides this to do nothing the only case that is special is when a more specific instance of abstractenumerator is generated reused
EMF,negative,do nothing
EMF,negative,this forces the feature ids to be assigned
EMF,negative,do nothing
EMF,negative,interprets escaped characters within the string according to java literal rules with two exceptions an unescaped does not terminate the string and a not followed by b t n f r   u or an octal digit is taken literally not as an error
EMF,negative,non nls 
EMF,negative,we can use for eobjects and enumliterals
EMF,negative,a standalone base is a valid uri according to spec
EMF,negative,this is needed for internal bootstrapping of egenerictype is default value for erawtype it is simply not available before ecore is constructed so we make it available and then patch what is missing
EMF,negative,replace some arguments by another field names constants
EMF,negative,public
EMF,negative,continue with the unresolved uri
EMF,negative,all implementations of java should support aes
EMF,negative,jetnature setjavasourcecontainer newjavasourcecontainer
EMF,negative,and delegate the call
EMF,negative,for enum constants insert line break after the comma if there is anything after the comma
EMF,negative,non nls non nls non nls non nls non nls non nls non nls 
EMF,negative,insert new line at the end of previous constant
EMF,negative, 
EMF,negative,update the containing map if necessary
EMF,negative,remember the static instance
EMF,negative,if needed comment out a comma of the previous enum constant
EMF,negative,check the type of the specified child object and return the proper feature to use for adding see link addcommand it as a child
EMF,negative,removejava ianamapping
EMF,negative,and delegate the call
EMF,negative,make sure that we see only digits and dot separators that any dot separator is preceded and followed by a digit and that we find dots rfc amended rfc by replacing the definition of ipv address with the one defined by rfc mrglavas ipv address digit digit digit digit one to three digits must be in each segment
EMF,negative,create map of public static final field initializers to fields
EMF,negative,check the type of the specified child object and return the proper feature to use for adding see link addcommand it as a child
EMF,negative,this should be the same as the logic in resourceimpl geteobject string
EMF,negative,non nls non nls 
EMF,negative,non nls non nls non nls 
EMF,negative,query starts with ? and up to fragment or end
EMF,negative,non nls non nls 
EMF,negative,check the type of the specified child object and return the proper feature to use for adding see link addcommand it as a child
EMF,negative,caches the list value
EMF,negative,if there is a comment with start position rangestartpos
EMF,negative,prepare for createchild item addition or removal non nls non nls 
EMF,negative,iterate over the owner list twice first matching objects from the collection by identity then matching objects by value equality equals the positions of matched objects in the owner list are recorded and the objects are stored in the same order the lists are then merged to form a final in order list of objects and corresponding indices in ownerlist this is very important for undo to interpret the indices correctly also this yields exactly one object removed for each object in the collection with preference given to identity over value equality
EMF,negative,the next line leaves objectsbeforeapply with all the objects that were added during the last recording
EMF,negative,closing the detail area
EMF,negative,we can use for eobjects and enumliterals
EMF,negative,define gradient blue to widget background color
EMF,negative,lastcursor prepared 
EMF,negative,callers that plan to use this name without appending a suffix should call f safename f getname to make sure its not a keyword this is a safe guaranteed uncapitalized form of the name the safe name and cast to eobject if necessary
EMF,negative,create the editing domain with a special command stack
EMF,negative,update the containing map if necessary
EMF,negative,validate now since the call we make after will skip validating
EMF,negative,count up the objects that will be removed the objects are exchanged to produce this list is order
EMF,negative,for field declarations use variable declaration fragments instead
EMF,negative,convert only public static final fields
EMF,negative,give it all back to the garbage collector
EMF,negative,check the type of the specified child object and return the proper feature to use for adding see link addcommand it as a child
EMF,negative,and delegate the call
EMF,negative,the container class must be null for the open content features of the document root to ensure that they are looked up in the actual eclass rather than assumed to be a feature with a feature id relative to the actual class otherwise it is good to have this optimization
EMF,negative,if the plugin properties is not within the root of the archive create a new uri for the folder location of the archive so we can look in the folder that contains it
EMF,negative,fill of value byte 
EMF,negative,we do not create an iterator stack until the root mapping itself has been returned by next once after that the stack should be non empty and the top iterator should yield true for hasnext
EMF,negative,calls code casexxx code for each class of the model until one returns a non null result it yields that result begin user doc end user doc return the first non null result returned by a code casexxx code call generated
EMF,negative,non nls non nls non nls non nls 
EMF,negative,calls code casexxx code for each class of the model until one returns a non null result it yields that result begin user doc end user doc return the first non null result returned by a code casexxx code call generated
EMF,negative,for demand created created packages we allow the list of classifiers to grow so this should handle those additional instances
EMF,negative,ensure that this is a touch notification so to resource are not marked as dirty
EMF,negative,index should be 
EMF,negative,calls code casexxx code for each class of the model until one returns a non null result it yields that result begin user doc end user doc return the first non null result returned by a code casexxx code call generated
EMF,negative,validate now since the call we make after will skip validating
EMF,negative,non nls 
EMF,negative,demanddocumentroot epackage
EMF,negative,check the type of the specified child object and return the proper feature to use for adding see link addcommand it as a child
EMF,negative,index should be 
EMF,negative,menumanager insertbefore additions new separator schema actions menumanager insertafter schema actions generateschemaaction
EMF,negative,this may be called directly on an eobject for the case of a containment
EMF,negative,generateschemaaction setenabled generateschemaaction isenabled
EMF,negative,public list sublist estructuralfeature feature int from int to return null
EMF,negative,check the type of the specified child object and return the proper feature to use for adding see link addcommand it as a child
EMF,negative,undo the preparation for next and continue
EMF,negative,check the type of the specified child object and return the proper feature to use for adding see link addcommand it as a child
EMF,negative,if we ca not create one too bad
EMF,negative,do nothing
EMF,negative,simpler implementation that sets the range of any node to be the node and all preceding comments public sourcerange computesourcerange astnode node sourcerange range new sourcerange node getstartposition node getlength range extendrangebackward findleadingcomment node getpreviousnode node false range return range
EMF,negative,check the type of the specified child object and return the proper feature to use for adding see link addcommand it as a child
EMF,negative,handle the last byte at the end
