EMF,negative,if it is changing
EMF,negative,keep track of all the entry features that are already in the feature map and that will be added excluding xml text cdata and comments if we  re in a mixed type
EMF,negative,create the listener on demand
EMF,negative,else keep authority device path and query
EMF,negative,stop listening to the old one
EMF,negative,determine the values to be added and add them at the right position
EMF,negative,note it is okay for two uris to share a segments array since neither will ever modify it
EMF,negative,find the fragment root so that we can generate to the right location by default
EMF,negative,non nls non nls non nls non nls 
EMF,negative,select the root object in the view
EMF,negative,returns the base portion of the dynamic template path
EMF,negative,non nls non nls non nls non nls 
EMF,negative,start listening to the new one
EMF,negative,non javadoc see org eclipse ui iactiondelegate run org eclipse jface action iaction
EMF,negative,remember it
EMF,negative,either delegate the call or return nothing
EMF,negative,remove any non java dependencies from being added
EMF,negative,now we could check that the adapter implements interface itableitemfontprovider
EMF,negative,it is okay for there not be a precompiled template so fail quietly
EMF,negative,create package meta data objects
EMF,negative,eatm getdecoratedadapterfactory
EMF,negative,we do not need to encode here because the only platform resource uris in the map are for projects whose names are the same as corresponding plug in ids and hence never need to be encoded see ecoreplugin computeplatformresourcetoplatformpluginmap
EMF,negative,set the editors selection based on the current viewer is selection
EMF,negative,
EMF,negative,there must be at least one match
EMF,negative,non javadoc method declared on dialog
EMF,negative,gentypeparameter
EMF,negative,this implements the following order of preference full refresh and update full refresh add update if necessary refresh element with update refresh element if necessary update element
EMF,negative,gentypedelement
EMF,negative,the try catch provides backwards compatibility with the old resource key ui createchild label and should be removed at the next release when we can expect users to regenerate
EMF,negative,create the listener on demand
EMF,negative,eatm color startcolor display getsystemcolor swt color list selection
EMF,negative,genruntimeversion
EMF,negative,these will be the children belonging to this feature
EMF,negative,genmodelpackage
EMF,negative,there is no executable command so we  d better nix the whole deal
EMF,negative,this returns either attribute attribute list reference or reference list
EMF,negative,do the encoding
EMF,negative,getfirstfileextension ?
EMF,negative,get the target object from the item widget and the mouse location in it
EMF,negative,add variable fragment to new declaration
EMF,negative,determine if we can create a valid command at the current location
EMF,negative,load the resource through the editing domain
EMF,negative,non javadoc see org eclipse emf ecore util extendedmetadata gettype org eclipse emf ecore epackage java lang string
EMF,negative,javadoc copied from interface
EMF,negative,begin user doc the b adapter factory b for the model it provides an adapter code createxxx code method for each class of the model end user doc see org eclipse emf mapping ecore xml ecore xmlpackage generated
EMF,negative,javadoc copied from interface
EMF,negative,otherwise the source should be available now as event data and we can create the command
EMF,negative,javadoc copied from interface
EMF,negative,either the ieditingdomainitemprovider or itreeitemcontentprovider item provider interface can give us the children
EMF,negative,eatm getdecoratedadapterfactory
EMF,negative,initialize simple dependencies
EMF,negative,create a page for the selection tree view
EMF,negative,begin user doc the b switch b for the model is inheritance hierarchy it supports the call link doswitch eobject doswitch object to invoke the code casexxx code method for each class of the model starting with the actual class of the object and proceeding up the inheritance hierarchy until a non null result is returned which is the result of the switch end user doc see org eclipse emf mapping ecore xml ecore xmlpackage generated
EMF,negative,the content outline is just a tree
EMF,negative,initialize created meta data
EMF,negative,genmodelfactory
EMF,negative,current document reference keep no path or query
EMF,negative,set up the tree viewer
EMF,negative,calls code casexxx code for each class of the model until one returns a non null result it yields that result begin user doc end user doc return the first non null result returned by a code casexxx code call generated
EMF,negative,ignore if there is not substantial change
EMF,negative,constructors
EMF,negative,lower all except the last upper case character if there are more than one upper case characters in the beginning e g xsdelementcontent xsdelementcontent however if the whole string is upper case the whole string is turned into lower case e g cpu cpu
EMF,negative,mark meta data to indicate it ca not be changed
EMF,negative,select the root object in the view
EMF,negative,look for each unwrapped object as a value of a wrapper replacing it with the first one found
EMF,negative,make sure our popups work
EMF,negative,set bounds for type parameters
EMF,negative,genannotation
EMF,negative,it must be an unsettable feature to be empty and considered set
EMF,negative,javadoc copied from interface
EMF,negative,matching authorities and no device or path removal
EMF,negative,always keep fragment even if null and use scheme from base no validation needed since all components are from existing uris
EMF,negative,register package validator
EMF,negative,javadoc copied from interface
EMF,negative,check to see if a container is being put into a contained object
EMF,negative,listen to selection so that we can handle it is a special way
EMF,negative,new addcommand domain mapping mapping epackagemapping getmapping nested siblingstoreparent
EMF,negative,static initialization
EMF,negative,trick to import java util without warnings
EMF,negative,set the selection to the widget
EMF,negative,non nls 
EMF,negative,save only resources that have actually changed
EMF,negative,do allow an existing manifest mf to be overwritten since it may have been created as part of an empty emf project use the existence of a plugin xml as a guard against overwriting in a project that has already been generated
EMF,negative,add a listener to set the most recent command is affected objects to be the selection of the viewer with focus
EMF,negative,if there is not an executable command we should maybe try a copy operation but only if we  re allowed and not doing a link
EMF,negative,remember it
EMF,negative,the type string must be qualified by its package uri e g dtd xmi dtdelement the package uri is used to look up the package by calling refregister getpackage uri
EMF,negative,this is the method that gets invoked when the operation runs
EMF,negative,this will be the default return value
EMF,negative,save the resources to the file system
EMF,negative,non javadoc see org eclipse emf mapping action addrootbottomaction getbottomstoadd
EMF,negative,refresh the necessary state
EMF,negative,try again
EMF,negative,something went wrong that should not
EMF,negative,otherwise we could check that the adapter implements interface iitemcolorprovider
EMF,negative,javadoc copied from interface
EMF,negative,now we could check that the adapter implements interface itableitemcolorprovider
EMF,negative,remember the file
EMF,negative,and delegate the call
EMF,negative,do the work within an operation
EMF,negative,ignore
EMF,negative,create a resource set
EMF,negative,this turns a featureless set command into an operation to create a mapping this is invoked during drag and drop
EMF,negative,genenumimpl
EMF,negative,
EMF,negative,get the uri of the model file
EMF,negative,we  ve switch the operation
EMF,negative,select the new file resource in the current view
EMF,negative,if the type is not object we need to cast if it is a primitive we need to unbox
EMF,negative,use a stack to accumulate segments of base except for the last i e skip trailing separator and anything following it and of relative path
EMF,negative,now we want to find all the other objects with this same parent so we can collection siblings together and give the parent control over their removal
EMF,negative,we ca not have a null name in case we  re using emof serialization
EMF,negative,determine the object is parent
EMF,negative,static initialization
EMF,negative,if it is an interface then it will be treated as an eclass
EMF,negative,create type parameters
EMF,negative,this returns either eattribute or ereference
EMF,negative,ignore
EMF,negative,eclass getesupertypes addall extend eclass getesupertypes addall unspecified eclass getesupertypes addall mixin eclass getesupertypes addall nonclass
EMF,negative,continue to compute the offset
EMF,negative,defer the handling of the opposite
EMF,negative,ignore
EMF,negative,this guard is for extra security but should not be necessary
EMF,negative,remember the static instance
EMF,negative,the entity handler is the best place to resolve and deresolve uris since it can do it there just once to produce the entity so most often the entity handler will be a uri handler as well and when used as a uri handler will be an identity handler
EMF,negative,switch to the new selection provider
EMF,negative,do this first for better error message during seteparameterproperties
EMF,negative,fake a selection changed event to update the menus
EMF,negative,set properties
EMF,negative,ignore
EMF,negative,index counters into indices indices and indices
EMF,negative,javadoc copied from interface
EMF,negative,just remember it it is encoded later during execution which is more efficient
EMF,negative,javadoc copied from interface
EMF,negative,remove objects from the owner list by index starting from the end
EMF,negative,genmodelfactoryimpl
EMF,negative,we do not want to insert an object before or after itself
EMF,negative,add iana to java encoding mappings
EMF,negative,create a code formatter for this compilation unit if needed
EMF,negative,get the resource
EMF,negative,this is the feedback we use to indicate drop on it will only be used if the command is executable
EMF,negative,get the resource parent if its a file
EMF,negative,we  d like the collection of replacements selected after this replace completes
EMF,negative,set bounds for type parameters
EMF,negative,repeatedly select the lower index and corresponding object and advance past the selected pair
EMF,negative,this gives us a directory
EMF,negative,wrap any new children and add them to the map remove each current child from the set of old children
EMF,negative,ignore this soft dependency when it is not satisfied
EMF,negative,simply remove the object from the owner list
EMF,negative,make up a unique new name here
EMF,negative,trick to import java util without warnings
EMF,negative,prepare for createchild item addition or removal
EMF,negative,check all the siblings to see which if any should now be nested under this new mapping the are accumulated into a list so that they can be removed as a single command with a single notification
EMF,negative,j has problems assigning null to a class variable
EMF,negative,trick to import java util without warnings
EMF,negative,always returns original value
EMF,negative,we will assume that the copy command can execute and that adding a copy of the clipboard is the same test as adding the clipboard contents itself
EMF,negative,recompute the read only state
EMF,negative,use the original to do the add but only if it is of the same type as the copy this ensures that if there is conversion being done as part of the copy as would be the case for a cross domain copy in the mapping framework that we do actually use the converted instance
EMF,negative,add added super interfaces to the array
EMF,negative,mappingroot epackagemapping getmapping outputs mappingroot epackagemapping getmapping inputs
EMF,negative,javadoc copied from base class
EMF,negative,special case for a reference to ecore to ensure that flag settings are respected and are set only for ecore itself
EMF,negative,not supported in jdom
EMF,negative,testcase unsetgenfeature annotations insert javajetinc
EMF,negative,only fragment left revert the changes
EMF,negative,we will assume that all the createcopycommand is and initializecopycommand is can execute
EMF,negative,javadoc copied from interface
EMF,negative,obtain other dependent packages
EMF,negative,split is performed
EMF,negative,for removecommand we will find the owner by calling editingdomain getparent on the object s being removed
EMF,negative,not supported in jdom
EMF,negative,setresourcefactoryregister new extensiblecontextresourcefactoryregister eatm setresourcefactoryregister new contextresourcefactoryregister
EMF,negative,name already contains unset on demand property
EMF,negative,fill of value byte fill of value byte fill of value byte fill of value byte 
EMF,negative,three arguments are expected the xml getcontrolmodel uri the source java uri and the target java uri
EMF,negative,for lists maps and feature maps the default is many valued which can be overridden by an upper bound declaration
EMF,negative,javadoc copied from interface
EMF,negative,if there is no ecore representation or it is invalid e g when is used to omit a specification then just use the java representation
EMF,negative,javadoc copied from interface
EMF,negative,containers are transient by default unless explicitly annotated otherwise
EMF,negative,javadoc copied from interface
EMF,negative,consider each genmodel location uri for each required plugin
EMF,negative,prepare for createsibling item addition or removal
EMF,negative,get extra icon and bounds for first column of extendedtabletreeitem
EMF,negative,force an update because eclipse hides empty menus now
EMF,negative,if the notification is an iviewernotification it specifies how viewerrefresh should behave otherwise fall back to notifychangedtoviewerrefresh which determines how to refresh the viewer directly from the model notification
EMF,negative,remove any menu items for old selection
EMF,negative,a setcommand needs to go through setcommand create to ensure it can execute and undo
EMF,negative,query the new selection for appropriate new child sibling descriptors
EMF,negative,initialize enums and add enum literals
EMF,negative,generate actions for selection populate and redraw the menus
EMF,negative,draw ellipses offset if down
EMF,negative,empty extension to limit the effect of suppressing the deprecation warning
EMF,negative,protected command createsetcommand editingdomain domain object owner object feature object value return ieditingdomainitemprovider decorateditemprovider createcommand owner domain setcommand class new commandparameter owner feature value protected command createcopycommand editingdomain domain object owner copycommand helper helper return ieditingdomainitemprovider decorateditemprovider createcommand owner domain copycommand class new commandparameter owner null helper protected command createcreatecopycommand editingdomain domain object owner copycommand helper helper return ieditingdomainitemprovider decorateditemprovider createcommand owner domain createcopycommand class new commandparameter owner null helper protected command createinitializecopycommand editingdomain domain object owner copycommand helper helper return ieditingdomainitemprovider decorateditemprovider createcommand owner domain initializecopycommand class new commandparameter owner null helper protected command createremovecommand editingdomain domain object owner object feature collection collection return ieditingdomainitemprovider decorateditemprovider createcommand owner domain removecommand class new commandparameter owner feature collection protected command createreplacecommand editingdomain domain object owner object feature object value collection collection return ieditingdomainitemprovider decorateditemprovider createcommand owner domain replacecommand class new commandparameter owner feature value collection protected command createaddcommand editingdomain domain object owner object feature collection collection int index return ieditingdomainitemprovider decorateditemprovider createcommand owner domain replacecommand class new commandparameter owner feature collection index protected command createmovecommand editingdomain domain object owner object feature object value int index return ieditingdomainitemprovider decorateditemprovider createcommand owner domain replacecommand class new commandparameter owner feature value index protected command createdraganddropcommand editingdomain domain object owner float location int operations int operation collection collection draganddropcommand detail detail new draganddropcommand detail location operations operation return ieditingdomainitemprovider decorateditemprovider createcommand owner domain draganddropcommand class new commandparameter owner detail collection
EMF,negative,get the adapter from the factory
EMF,negative,iterate over all the plugin ids to determine the dependency closure the list grows as the plugins are visited
EMF,negative,look into subcontributionitems
EMF,negative,else keep device path and query
EMF,negative,delete the actioncontributionitems with matching action
EMF,negative,now we could check that the adapter implements interface itableitemcolorprovider
EMF,negative,if it is really a contained child return the feature for it
EMF,negative,we will need to keep track of the information we use to create the command so that we can recreate it in drop
EMF,negative,changes to the parameters should also update the label
EMF,negative,returns true if the non relative path includes segments that would be collapsed when resolving false otherwise if preserverootparents is true collapsible segments include any empty segments except for the last segment as well as and parent and self references if preserverootsparents is false parent references are not collapsible if they are the first segment or preceded only by other parent references
EMF,negative,the shared instance
EMF,negative,ignore the unset notification for an ismany feature the value is boolean in this case
EMF,negative,remember the static instance
EMF,negative,if necessary get a command that replaces unwrapped values by their wrappers in the result and affected objects
EMF,negative,inputstream contents new bytearrayinputstream bytes
EMF,negative,now we could check that the adapter implements interface itableitemlabelprovider
EMF,negative,initialize created meta data
EMF,negative,if we have children to remove for this feature create a command for it
EMF,negative,create helpers to cache and supply information for unique naming
EMF,negative,do nothing
EMF,negative,genannotationimpl
EMF,negative,create ok and cancel buttons by default
EMF,negative,create package meta data objects
EMF,negative,set the error message text see https bugs eclipse org bugs show bug cgi ? id 
EMF,negative,initialize simple dependencies
EMF,negative,walk the fields
EMF,negative,obtain or create and register package
EMF,negative,index of first segment that is different between endpath and startpath
EMF,negative,mark meta data to indicate it ca not be changed
EMF,negative,if the local transfer supports this data type switch to that data type
EMF,negative,create the options model
EMF,negative,drop last segment from base as in resolving
EMF,negative,add supertypes to classes
EMF,negative,the switch that delegates to the code createxxx code methods begin user doc end user doc generated
EMF,negative,set bounds for type parameters
EMF,negative,treat an empty base path as the root absolute path
EMF,negative,create classes and their features
EMF,negative,class unsetgenfeature override javajetinc
EMF,negative,create enums
EMF,negative,this is for backwards compatibility since the constructor may have been overridden before it was expected to set actiondelegate
EMF,negative,create type parameters
EMF,negative,etype instanceof edatatype
EMF,negative,genmodelpackageimpl
EMF,negative,determine the required plugins
EMF,negative,create resource
EMF,negative,in column the drop down is indented past the collapse expand icon
EMF,negative,does nothing
EMF,negative,user rejects a relative path keep absolute or no path
EMF,negative,fb tbd different objects for ecore model
EMF,negative,draw the icons
EMF,negative,i assume that the editorinput is a file object
EMF,negative,matching devices and no path removal
EMF,negative,clear the import manager
EMF,negative,class getgenfeature todo override javajetinc
EMF,negative,basicemap this removeentry index j
EMF,negative,initialize package
EMF,negative,order genpackages by putting firstgenpackage if non null first
EMF,negative,remember the viewer and listen to swt dragdetect to alert the start of the drag operation
EMF,negative,fb tbd different objects for ecore model
EMF,negative,obtain or create and register package
EMF,negative,genfeatureimpl
EMF,negative,text new text composite swt single swt border text setlayoutdata new griddata griddata grab horizontal griddata horizontal align fill
EMF,negative,if the value is null the key is a referenced object
EMF,negative,keep query and select relative or absolute path based on length
EMF,negative,generatecolor
EMF,negative,return a correctly sized result
EMF,negative,set from link ischildren children if unset and return value
EMF,negative,create package meta data objects
EMF,negative,ereversefeature isnavigable
EMF,negative,
EMF,negative,handle the creation of the model from the modelfile
EMF,negative,for debugging purposes may be removed in the future
EMF,negative,go through class super types to catch any from other packages
EMF,negative,for the control case we need a dialog to ask for the uri and obtain the resource then we create the command
EMF,negative,support for as proposed to be added to the iana registry in http lists w org archives public ietf charset julsep html
EMF,negative,if we are not getting the domain from the workbench part this happens when this action is used for a global popup action we try to get the editing domain from one of the objects in the selection dms editingdomain null ?
EMF,negative,scan feature lists for those with multiple elements and return them
EMF,negative,nothing more to do and we do not want to do the default stuff below
EMF,negative,gentypedelementimpl
EMF,negative,initialize created meta data
EMF,negative,data type
EMF,negative,else keep shorter absolute path
EMF,negative,remember the static instance
EMF,negative,if we are not doing an operation
EMF,negative,eobject is handled by default case
EMF,negative,clean up the command if there is one if we need it again in drop we will recreate it from draganddropcommandinformation
EMF,negative,changes to parameter types should also update the operation is label
EMF,negative,convert to an ereference
EMF,negative,escaped unicode form
EMF,negative,if we  ve found thing with type parameters search them for a match
EMF,negative,filter out types that are not permitted
EMF,negative,we need the wrapper not the item provider to handle a draganddropcommand the move add remove etc commands that implement it will have their values unwrapped as usual
EMF,negative,restore the persistent command stack if need be
EMF,negative,create a generic super type with an eclass as the classifier for each super interface in the model representation
EMF,negative,filter out types that are not permitted
EMF,negative,an operation is declared via the kind property or for backwards compatibility by specifying parameters though attribute or reference kind takes precedence
EMF,negative,support for as proposed to be added to the iana registry in http lists w org archives public ietf charset julsep html
EMF,negative,no index specified when removing all elements
EMF,negative,class unsetgenfeature javadoc override javajetinc
EMF,negative,check if the name is qualified
EMF,negative,avoid allowing choices that will lead to duplicates
EMF,negative,mark meta data to indicate it ca not be changed
EMF,negative,return getpresentationpackagename geteditorpluginclassname
EMF,negative,emf edit generation
EMF,negative,create a page for the selection tree view
EMF,negative,find the modeled package for the import and look up the name there
EMF,negative,avoid allowing a choice that will lead to duplicates
EMF,negative,just to be helpful we will recognize a type of org eclipse emf ecore util featuremap and convert it to efeaturemapentry this way a datatype need not be specified but we wo not do this if recorddemandcreateedatatype is false so we do not change the instanceclass of a new edatatype that is implicitly being defined for featuremap
EMF,negative,ensure that there are enough type arguments to match the number of type parameters
EMF,negative,wrappers from the old command parameter must be considered in order for cut and paste to work
EMF,negative,you cannot add any children for a type parameter
EMF,negative,look for the sibling value or an equivalent in the new child is feature if it is found the child should immediately follow it
EMF,negative,clinit
EMF,negative,fill of value byte 
EMF,negative,trick to import java util without warnings
EMF,negative,save the contents of the resource to the file system
EMF,negative,otherwise you ca not make it a child
EMF,negative,testcase issetgenfeature todo override javajetinc
EMF,negative,let them choose type parameters as well
EMF,negative,non nls non nls non nls 
EMF,negative,tbd
EMF,negative,if it is a list type value
EMF,negative,genpackageimpl
EMF,negative,non nls non nls non nls non nls 
EMF,negative,protected jetemitter extendeditemprovideremitter null
