EMF,positive,bug we should rely on xmlcalendar to normalize dave value to ensure that all date value fields are taken into account
EMF,positive,is this an error ? ? ?
EMF,positive,fb wo not compile with vaj or no jikes fb object adapter adapterfactory adapt mapping
EMF,positive,eatm must fix isset bits
EMF,positive,eatm must fix isset bits
EMF,positive,is this an error ? ? ?
EMF,positive,line comments at the end of annotations are not a part of the range of annotation todo is not including line comments at the end of annotations a bug ?
EMF,positive,eatm in jdk there will be an indexof on stringbuffer
EMF,positive,todo factor up into genbaseimpl
EMF,positive,eatm call the deprecated method which does the same thing but might have an override in older code
EMF,positive,todo factor up into genbaseimpl
EMF,positive,unused ?
EMF,positive,todo factor up into genbaseimpl ?
EMF,positive,call workaround
EMF,positive,todo deprecate since getpluginclass is no longer called
EMF,positive,ensure that this race condition is thread safe it does not matter who wins the race
EMF,positive,todo factor up into genbaseimpl ?
EMF,positive,todo this assumes we only get a set notification which is not a good assumption
EMF,positive,dms handle this well
EMF,positive,unused ?
EMF,positive,fb tbd can we come up with a better algorithm for choosing the default label feature ?
EMF,positive,dms should we let this exception out ?
EMF,positive,dms what if eclipse is running but an invalid facade has been specified ? we still should format code use encoding
EMF,positive,dms do a better job with specific exceptions ? just use chained runtimeexceptions ?
EMF,positive,if the delegate uri can be handled as a file we will hope that renaming it will be really efficient
EMF,positive,dms why not this ? new subprogressmonitor progressmonitor 
EMF,positive,assume that it is an attribute for now it will could become a reference if the type resolves to an eclass
EMF,positive,do nothing for now and avoid propagating the exception how should builders handle cancel ?
EMF,positive,this is a fall back however this should never be called
EMF,positive,todo fix the space above
EMF,positive,todo remove this bogus empty line
EMF,positive,todo handle class cast exception better
EMF,positive,i do not know if we should be run this deferred because we might have to give the editor a chance to process the viewer update events and hence to update the views first
EMF,positive,this is a big festering hack to make the images the right size from the start
EMF,positive,eatm demand create metadata needs to depend on processing mode
EMF,positive,todo this is really quite attrocious since there is code that will assume an iterator that returns strings
EMF,positive,tbd return user selected subset ? of referenced packages that contain super classes of classes in this package
EMF,positive,call the workaround
EMF,positive,tbd rethink where exactly some of the following methods belong genmodel or genpackage
EMF,positive,if there are multiple variables in declaration separate this variable fragment into a separate declaration
EMF,positive,eatm this would be wrong
EMF,positive,call workaround
EMF,positive,revisit remove this code
EMF,positive,the label is not used
EMF,positive,dms why not this ? new subprogressmonitor progressmonitor 
EMF,positive,motif kludge we would get something random instead of null
EMF,positive,todo so what should be the etype be now ?
EMF,positive,this runs the operation and shows progress it appears to be a bad thing to fork this onto another thread
EMF,positive,eatm kind of hacky
EMF,positive,dms why not this ? new subprogressmonitor progressmonitor 
EMF,positive,dms why not this ? new subprogressmonitor progressmonitor 
EMF,positive,this runs the operation and shows progress it appears to be a bad thing to fork this onto another thread
EMF,positive,this is a kludge to deal with enumerators which crash the doswitch
EMF,positive,this is a kludge to deal with enumerators which crash the doswitch
EMF,positive,this is copied from itemprovideradapterfactory
EMF,positive,eatm this might be better written as a single loop for the eobject case ?
EMF,positive,dms why not this ? new subprogressmonitor progressmonitor 
EMF,positive,dms why not this ? new subprogressmonitor progressmonitor 
EMF,positive,second alternative should be getmodelproject ?
EMF,positive,todo this is really quite attrocious since there is code that will assume an iterator that returns strings
EMF,positive,todo hack that should be removed
EMF,positive,todo specialize this to return a resource locator for messages specific to this validator ensure that you remove generated or mark it generated not
EMF,positive,todo i m concerned that folders will often return or even so should we consider something to exist even though access if unauthorized or forbidden ?
EMF,positive,only file scheme uris will be re encoded if a uri was decoded in the workaround above and platform resolve did not return a file scheme uri then this will return an decoded uri
EMF,positive,this functionality should eventually go away as it is replaced by model exporters we will just delegate to the deprecated genpackage method the monitor is not used so we wo not pass it
EMF,positive,the eannotations and egenerictype are possible containment references we will move them instead of copying
EMF,positive,note registry based authority is being removed from a new spec for uri which would obsolete rfc if the spec is added to xml errata processing of reg name needs to be removed mrglavas
EMF,positive,temporary structure to hold node is attributes namespaces in scope
EMF,positive,hack reading encoding
EMF,positive,because of the old factoring approach in the create method it might be the case that the state of the old value has changed by the time we get here and in that case we do not want to duplicate the removals in this code
EMF,positive,if there are multiple variables in declaration separate this variable fragment into a separate declaration
EMF,positive,revisit remove this code store port value as string instead of integer
EMF,positive,todo this is faster than many charat calls
EMF,positive,revisit remove this code
EMF,positive,revisit do we really need to support block names as in unicode or we can just create all the names in isblockname format xml schema rec ?
EMF,positive,note registry based authority is being removed from a new spec for uri which would obsolete rfc if the spec is added to xml errata processing of reg name needs to be removed mrglavas
EMF,positive,revisit remove this code store port value as string instead of integer
EMF,positive,bubble sort why ? in many cases this ranges has few elements
EMF,positive,per schema it is not clear if the result returned should be a valid uri for the future if we plant to support iris then it is better not to massage the initialvalue we should thought consider where would be the best way to validate anyuri values el
EMF,positive,note that the way they are sorted the values of index i always increase so the objects are added from right to left in the list eatm todo we could make this more efficient by grouping the adds when indices increment by one so that a single grouped notification would result
EMF,positive,todo deprecate since no longer used by geteditpluginclass geteditorpluginclass gettestsuiteclass
EMF,positive,if there are multiple variables in declaration separate this variable fragment into a separate declaration
EMF,positive,dms should we let this exception out ?
EMF,positive,dms should we let this exception out ?
EMF,positive,dms factor this into a method ? use a non static subclass ?
EMF,positive,dms this does not really produce nice output
EMF,positive,fb tbd filter out volatile and other inappropriate links ?
EMF,positive,i do not know if this should be run this deferred because we might have to give the editor a chance to process the viewer update events and hence to update the views first
EMF,positive,todo processing instructions are not sent to recordvalues
EMF,positive,todo comments are not sent to recordvalues
EMF,positive,todo ignore for now
EMF,positive,todo handle situation when astjnode is removed compilationunit is null
EMF,positive,tbd return super classes of classes in this package that come from a delegate package
EMF,positive,if current char is comma insert line break after it we should be able to find the comma because the range for enum constants includes all trailing comments up to the separator if targetsourcerangecomputer of astrewrite changes this logic should change to skip comments see org eclipse emf codegen merge java facade ast commentawaresourcerangecomputer getenumconstantsourcerange astnode
EMF,positive,todo translation
EMF,positive,todo binary incompatibility an old override must override putall
EMF,positive,i do not know if this should be run this deferred because we might have to give the editor a chance to process the viewer update events and hence to update the views first
EMF,positive,this runs the options and shows progress it appears to be a bad thing to fork this onto another thread
EMF,positive,i do not know if this should be run this deferred because we might have to give the editor a chance to process the viewer update events and hence to update the views first
EMF,positive,we should be able to find the comma because the range for enum constants includes all preceding comments up to the previous constant if targetsourcerangecomputer of astrewrite changes this logic should change to skip comments see org eclipse emf codegen merge java facade ast commentawaresourcerangecomputer getenumconstantsourcerange astnode
EMF,positive,todo we should generate this
EMF,positive,todo what about the instance type name and the fact that we should be matching its type argument structure ? if they match so far we must assume they are okay and then check all the arguments
EMF,positive,dms this is totally untested
EMF,positive,todo update this after old tests pass and then update the old tests to reflect this change
EMF,negative,set of options that we want to control
EMF,negative,get the end position of the range for the previous node
EMF,negative,adding  at  allows distinguish annotations from other members i e inner class verses annotation of a class
EMF,negative,get the adapter from the factory
EMF,negative,no methods added
EMF,negative,ignore
EMF,negative,javadoc copied from interface
EMF,negative,add trailing comments if necessary
EMF,negative,if the target is read only we can ask the platform to release it
EMF,negative,do nothing
EMF,negative,if entries do not have the same feature the feature maps are not equal
EMF,negative,attribute
EMF,negative,merge with an existing file
EMF,negative,get the adapter from the factory
EMF,negative,walk up the superpackages collecting the package names because empty packages are ommitted from the genmodel we need to walk up the epackages
EMF,negative,empty block
EMF,negative,any features that delegate to features in this package
EMF,negative,see java lang class getname javadoc for explanation of array encoding
EMF,negative,additional useful character classes including characters valid in certain uri components and separators used in parsing them out of a string ucschar escaped
EMF,negative,calls code casexxx code for each class of the model until one returns a non null result it yields that result begin user doc end user doc return the first non null result returned by a code casexxx code call generated
EMF,negative,if the target is read only we can ask the platform to release it and it may be updated in the process
EMF,negative,
EMF,negative,find start position of farthest preceding comment
EMF,negative,was the details button pressed ?
EMF,negative,set up the tree viewer
EMF,negative,process the children of the unittreenode recursively
EMF,negative,create a code formatter for this compilation unit if needed
EMF,negative,if the name is not qualified it might be a primitive or from java lang otherwise assume it is in the current package and use the nsprefix for the qualified package name
EMF,negative,determine the base url by looking for the plugin properties file in the standard way
EMF,negative,the notification for this list is being thrown by the delegating list
EMF,negative,make sure our popups work
EMF,negative,remove type insert enum
EMF,negative,we need to screen out duplicates in the unlikely event that we have two features with the same class qualified name we will only generate one property string in that case and let the user add the second one manually if necessary
EMF,negative,build mapping from classes to list of features that use them
EMF,negative,this runs the options and shows progress
EMF,negative,no paths keep query only
EMF,negative,select the root object in the view
EMF,negative,else absolute path keep it and query
EMF,negative,listen to selection so that we can handle it is a special way
EMF,negative,the algorithm for the order of the features in this list should never change also the fact that a new list is created whenever the contents change is something else that should never change there are clients who rely on both these behaviors and they will need to agree to any change so that they can adjust their own code
EMF,negative,this ensures that we handle selections correctly
EMF,negative,empty block
EMF,negative,create an adapter factory that yields item providers
EMF,negative,get the current time in milliseconds since the epoch and adjust it to match the epoch required by the specification
EMF,negative,get the first selected element
EMF,negative,otherwise the path needs only the remaining segments
EMF,negative,log the error ignore the change and continue
EMF,negative,absolute path or no path absolute path
EMF,negative,do a base conversion by turning every bytes into base characters
EMF,negative,create a composite with standard margins and spacing
EMF,negative,source method return type is array getexceptions target is not array i e addexception
EMF,negative,do nothing
EMF,negative,and we need to set it on any cached genmodels holding the special ecore and xml packages
EMF,negative,calls code validatexxx code for the corresponding classifier of the model begin user doc end user doc generated
EMF,negative,this is the page for the tree viewer
EMF,negative,empty last segment trailing separator
EMF,negative,refresh the necessary state
EMF,negative,a set command without a feature sets the value of this wrapper hence replacing it with a new wrapper so we need a special command wrapper that selects this new wrapper as the affected object
EMF,negative,cc
EMF,negative,maintain a weak hash set on the type parameter of all referencing generic types
EMF,negative,force the project to be setup properly
EMF,negative,javadoc copied from interface
EMF,negative,ignore
EMF,negative,wizardcontainer variables
EMF,negative,return getprefixedname editorplugin
EMF,negative,eparameter
EMF,negative,retrieve source node corresponding to target
EMF,negative,ignore
EMF,negative,create a default jetsettings file file
EMF,negative,subclasses may overrride
EMF,negative,save the resources to the file system
EMF,negative,calls code casexxx code for each class of the model until one returns a non null result it yields that result begin user doc end user doc return the first non null result returned by a code casexxx code call generated
EMF,negative,set the selection to the widget
EMF,negative,etypeparameter
EMF,negative,save only resources that have actually changed
EMF,negative,this is only at avoid needing an suppresswarnings unchecked on the emfobservablelist
EMF,negative,this is the method that gets invoked when the operation runs
EMF,negative,ignore this since we will throw an exception when all else fails
EMF,negative,fill of value byte 
EMF,negative,this is only at avoid needing an suppresswarnings unchecked on the emfobservablelist
EMF,negative,for enum constants use special range
EMF,negative,etypedelement
EMF,negative,so if the resolved object is also present
EMF,negative,ecorepackage
EMF,negative,subclasses may override this method
EMF,negative,create resource
EMF,negative,something went wrong that should not
EMF,negative,create package meta data objects
EMF,negative,fill of value byte fill of value byte fill of value byte fill of value byte fill of value byte fill of value byte fill of value byte fill of value byte fill of value byte fill of value byte fill of value byte fill of value byte fill of value byte fill of value byte fill of value byte fill of value byte fill of value byte fill of value byte 
EMF,negative,getobjectstodetachgen should be changed only if required
EMF,negative,if a newline from the previous character data remains add a generator for it
EMF,negative,obtain or create and register package
EMF,negative,remove the node
EMF,negative,initialize simple dependencies
EMF,negative,fill of value byte 
EMF,negative,obtain other dependent packages
EMF,negative,if the intersection is empty i e no ancestor is in the mapping
EMF,negative,create classes and their features
EMF,negative,continue with a different approach
EMF,negative,initialize created meta data
EMF,negative,if this mapping is not a parent it is children definitely wo not be either
EMF,negative,set bounds for type parameters
EMF,negative,make sure the collections are not identical
EMF,negative,initialize enums and add enum literals
EMF,negative,fill of value byte 
EMF,negative,add supertypes to classes
EMF,negative,fill of value byte 
EMF,negative,eobjecttochangesmapentryimpl
EMF,negative,fb used to check for parent null need to find the top most model object not including the resource parent instanceof eobject only checks for trees in model object space
EMF,negative,featuremapentry
EMF,negative,do the work within an operation because this is a long running activity that modifies the workbench
EMF,negative,resourcechange
EMF,negative,refresh the necessary state
EMF,negative,isolating the new objects
EMF,negative,this runs the options and shows progress
EMF,negative,featurechangeimpl
EMF,negative,set features and properties
EMF,negative,cache result
EMF,negative,this is the page for the list viewer
EMF,negative,cache result
EMF,negative,insert line break and comment out the first line if needed note that first line might move backward beyond node start e g if a comma of the previous enum constant has been commented out
EMF,negative,resourcechangeimpl
EMF,negative,something went wrong that should not
EMF,negative,featurechangeimpl
EMF,negative,if we change to pattern defaults will have to specify plain suffix in no main package case
EMF,negative,feature is instance of eattribute
EMF,negative,different than the edit and editor projects this method is invoked while generating the model plugin xml
EMF,negative,make sure that all the old values are cached
EMF,negative,include only non duplicate namespace declarations
EMF,negative,edatatype
EMF,negative,create the command stack that will notify this editor as commands are executed
EMF,negative,changedescriptionimpl
EMF,negative,try to select the items in the current content viewer of the editor
EMF,negative,caches the list value
EMF,negative,set the editors selection based on the current viewer is selection
EMF,negative,changefactory
EMF,negative,set of options that we want to copy from the current definition
EMF,negative,sorting only the genmodels
EMF,negative,we need to be careful that we do not end up requiring the no namespace package just because the feature is unqualified
EMF,negative,register package validator
EMF,negative,we must have a qualifier for an attribute that needs qualified
EMF,negative,changeadapterfactory
EMF,negative,system err println debug fixed only this fixedstring
EMF,negative,cached already ?
EMF,negative,see if prefix already exists in current context
EMF,negative,initialize classes and features add operations and parameters
EMF,negative,default implementation does nothing
EMF,negative,initialize package
EMF,negative,walk up the super types until we reach a root
EMF,negative,changeswitch
EMF,negative,try to select the affected objects
EMF,negative,continue with no instanceclass
EMF,negative,unwrap collection
EMF,negative,case notification remove many
EMF,negative,javadoc copied from interface
EMF,negative,case notification remove
EMF,negative,look for a matching element in the classifier is package but do not bother with the xml type package is document root
EMF,negative,create data types
EMF,negative,javadoc copied from interface
EMF,negative,egenerictypeimpl
EMF,negative,javadoc copied from interface
EMF,negative,return econtainer
EMF,negative,internal this is a specialized method to add attributes for a top root element
EMF,negative,create containment one
EMF,negative,it is intentional to keep going
EMF,negative,javadoc copied from interface
EMF,negative,it is intentional to keep going
EMF,negative,javadoc copied from interface
EMF,negative,it is intentional to keep going
EMF,negative,do nothing
EMF,negative,it is intentional to keep going
EMF,negative,initialize data types
EMF,negative,nothing to do
EMF,negative,do not really unset it
EMF,negative,this is the method that gets invoked when the operation runs
EMF,negative,estringtostringmapentryimpl
EMF,negative,something went wrong that should not
EMF,negative,etypeparameterimpl
EMF,negative,get the adapter from the factory
EMF,negative,set bounds for type parameters
EMF,negative,stop only on cancel
EMF,negative,system bar
EMF,negative,get the adapter from the factory
EMF,negative,continue to try a different approach
EMF,negative,produce the supplemental character as an entity
EMF,negative,keep trying until all else has failed
EMF,negative,if we ca not determine it by reading the file look at the preferences instead
EMF,negative,etypedelementimpl
EMF,negative,since we  re invoking plugged in code we must be defensive against cycles
EMF,negative,subclasses may override
EMF,negative,combine the two lists
EMF,negative,ecorefactoryimpl
EMF,negative,we not sure the encoding supports this code point so we write it as a character entity reference
EMF,negative,keep trying until all else false
EMF,negative,no property
EMF,negative,the switch that delegates to the code createxxx code methods begin user doc end user doc generated
EMF,negative,no property
EMF,negative,continue to try a different approach
EMF,negative,no property
EMF,negative,eparameterimpl
EMF,negative,do the work within an operation because this is a long running activity that modifies the workbench
EMF,negative,identifies a file type absolute uri
EMF,negative,only handle classifiers from this package
EMF,negative,changedescription
EMF,negative,fill of value byte 
EMF,negative,create classes and their features
EMF,negative,fill of value byte 
EMF,negative,featurechange
EMF,negative,if it is an unqualified name we will assume it refers to a type parameter since we do not support default package
EMF,negative,mark meta data to indicate it ca not be changed
EMF,negative,we effectively passed null to look up the general content feature
EMF,negative,egenerictype
EMF,negative,insert line break at the first line if there is something before the node start and the beginning of the line
EMF,negative,ecorefactory
EMF,negative,fill of value byte 
EMF,negative,eatm leave this disabled for now
EMF,negative,fill of value byte 
EMF,negative,fill of value byte fill of value byte fill of value byte fill of value byte fill of value byte fill of value byte fill of value byte fill of value byte fill of value byte fill of value byte fill of value byte fill of value byte fill of value byte fill of value byte 
EMF,negative,give all generator adapters the chance to do setup work
EMF,negative,javadoc copied from interface
EMF,negative,remove any non java dependencies from being added
EMF,negative,this should never happen
EMF,negative,clear old values
EMF,negative,we ca not update any properties via just a url connection
EMF,negative,trim off the segments corresponding to the package nesting
EMF,negative,ignore any exceptions and assume the class is not available
EMF,negative,for an archive uri check for the plugin properties in the archive
EMF,negative,create the iv for the password generation algorithm
EMF,negative,fill of value byte 
EMF,negative,opening the detail area
EMF,negative,fill of value byte 
EMF,negative,calls code validatexxx code for the corresponding classifier of the model begin user doc end user doc generated
EMF,negative,documentroot
EMF,negative,we do not want to diagnose any errors that have already been diagnosed by a super type although we ignore all the first super is features there may be mixin classes that still would result in duplicates
EMF,negative,loop for all commented out nodes
EMF,negative,we need to be careful that the proxy may be resolved while we are attaching this adapter we need to avoid attaching the adapter during the resolve and also attaching it again as we walk the econtents later checking here avoids having to check during addadapter
EMF,negative,non nls non nls 
EMF,negative,produce different levels of diagnostic depending whether the names are exactly the same or only matching
EMF,negative,switch to the new selection provider
EMF,negative,look for duplicates among the generic super types
EMF,negative,keep trying other member types until all have failed
EMF,negative,match against every other operation but this one
EMF,negative,fake a selection changed event to update the menus
EMF,negative,the referencing generic type must be contained to be in scope
EMF,negative,check the type of the specified child object and return the proper feature to use for adding see link addcommand it as a child
EMF,negative,if none of the generic super types are bounded then we  ve failed
EMF,negative,append extra dimensions since they are not stored in type object
EMF,negative,check if the bound specifies a classifier
