Hib,positive,todo create uk loaders for component properties
Hib,positive,todo still need to make collectionpersisters entitymode aware
Hib,positive,todo terrible implementation
Hib,positive,todo eventually put this back in once we think all is fixed object otheralias columnsunique put qualifiedcolumn columnalias
Hib,positive,todo i do not really like this implementation it would be better if this was handled by searchfordirtycollections
Hib,positive,todo check if key contains the owner id
Hib,positive,todo cache this in an instvar
Hib,positive,todo temporary initial step towards hhh 
Hib,positive,todo remove this once componentmetamodel is complete and merged
Hib,positive,todo add owner argument
Hib,positive,todo handle supportsnotnullunique false but such a case does not exist in the wild so far
Hib,positive,todo better error message since we actually support composites if names are explicitly listed
Hib,positive,todo for some dialects it would be appropriate to add the renderorderbypropertiesselect to other select strings
Hib,positive,todo unnecessary for databases with ansi style joins
Hib,positive,todo maybe call it getrowselection ?
Hib,positive,todo make this handle multiple collection roles
Hib,positive,todo include the rowids
Hib,positive,if we are still not resolved we might represent a constant needed to add this here because the allowance of naked prop refs in the grammar collides with the definition of literals constants nondeterminism todo cleanup the grammar so that processconstants is always just handled from here
Hib,positive,todo or should we return  containstablealias  ? ?
Hib,positive,todo look at perhaps caching this
Hib,positive,todo avoid this for non new instances where mightbedirty false
Hib,positive,todo theoretically non threadsafe
Hib,positive,todo look at optimizing these
Hib,positive,todo cache this sql
Hib,positive,todo check if mimer sql cannot handle the way db does
Hib,positive,todo if we are using identity columns fetch the identifier
Hib,positive,todo check there is no actual definition elemnents when a ref is defined
Hib,positive,table null an association fill it in later todo fill in the mappings for table null
Hib,positive,table null an association fill it in later todo fill in the mappings for table null
Hib,positive,todo add support for read write nonstrict read write ? ? ?
Hib,positive,todo return new lock ts
Hib,positive,todo add support for read write nonstrict read write ? ? ?
Hib,positive,todo why are not these the same ?
Hib,positive,todo proxies
Hib,positive,todo proxies
Hib,positive,todo if we support multiple fetch groups we would need to clone the set of lazy properties
Hib,positive,todo mappings getlogicaltablename ownertable
Hib,positive,todo if lock gettimestamp equals ts
Hib,positive,todo always true for now but not if we later decide to support elements in the from clause
Hib,positive,we could move this inside if we wanted to tolerate collection initializations during collection dirty checking
Hib,negative,see if the user configured a multiplexer stack
Hib,negative,root entity comes last
Hib,negative,elementtype ? ?
Hib,negative,scan the query string for class names appearing in the from clause and replace with all persistent implementors of the class interface returning multiple query strings make sure we do not pick up a class in the select clause
Hib,negative,identifier collections not supported for to many
Hib,negative,potentialtrimcharacterargindex assumes that a trim specification has been specified we handle the exception to that explicitly
Hib,negative,overridden informational metadata
Hib,negative,if the current depth is the root thing being loaded is the many to many collection itself here it is alright to use an inner join
Hib,negative,update removed rows fks to null
Hib,negative,registerfunction trim new standardsqlfunction trim hibernate string
Hib,negative,buf append selectfragment lhsalias ignore suffix for collection columns
Hib,negative,initialize the set of queried identifier spaces ie tables
Hib,negative,use suffix for the entity columns
Hib,negative,we got here because we assumed that an instance with an assigned id was detached when it was really persistent
Hib,negative,the class hierarchy structure
Hib,negative,remove the current element from insertions it will be added back later
Hib,negative,private final string roottablename
Hib,negative,note this is being used from the process of shutting down a sessionfactory specific things to consider this clearing of the region should not propagate to other nodes on the cluster if any this is the cache mode local option bit really just trying a best effort to cleanup after ourselves lock failures etc are not critical here this is the fail silently option bit
Hib,negative,initialization
Hib,negative,stuff that is persister centric and or entityinfo centric
Hib,negative,not null start with is implicit
Hib,negative,continue loop
Hib,negative,return existing object or initialized proxy unless deleted
Hib,negative,the list of entity names that indicate the batch number
Hib,negative,disassembled state gets put in a new array we write to cache by value
Hib,negative,add these directly to the executions queue
Hib,negative,execute the sql
Hib,negative,sort the updates by fk
Hib,negative,this could also just be true all the time
Hib,negative,the mapping of entity names to their latest batch numbers
Hib,negative,chop the last union all
Hib,negative,note that for sequential scrolling we make the assumption that the first persister element is the root entity
Hib,negative,todo check this
Hib,negative,for deprecated saveorupdatecopy
Hib,negative,initialization
Hib,negative, check constraint violation unique index or primary key violation 
Hib,negative,the closure of all properties in the entire hierarchy including subclasses and superclasses of this class
Hib,negative,expressionterminators add deliberately excluded
Hib,negative,subclass discrimination works by assigning particular values to certain combinations of null primary key values in the outer join using an sql case
Hib,negative,tokens that close a sub expression tokens that open a sub expression tokens that would indicate a sub expression is a boolean expression
Hib,negative,multi param numeric dialect functions
Hib,negative,use theta style for regression move the node up after the origin node
Hib,negative,multi param date dialect functions
Hib,negative,overridden informational metadata
Hib,negative,add the main query
Hib,negative,sqlexception support
Hib,negative,add the restriction to the outer select
Hib,negative,bit length feels a bit broken to me we have to cast to char in order to pass when a numeric value is supplied but of course the answers given will be wildly different for these two datatypes will be bytes as a char string but will be or bytes as a true numeric jay nance 
Hib,negative,this assumes you will want to ignore any update counts
Hib,negative,skip the from keyword in params
Hib,negative,custom sql
Hib,negative,return a newly loaded object
Hib,negative,make it circular reference safe
Hib,negative,cope with special cases of and not
Hib,negative,subclass closure properties
Hib,negative,for dialects which are known to not support ansi sql row value constructor syntax we should mutate the tree
Hib,negative,overridden informational metadata
Hib,negative,we have the form trim from trimsource this is functionally equivalent to trim trimsource early exit
Hib,negative,subclasses
Hib,negative,need to hydrate it
Hib,negative,starts with implicitly
Hib,negative,instantiate a new instance
Hib,negative,simple nullability constraint
Hib,negative,we need to upgrade the lock mode to the mode requested
Hib,negative,register the type of the out param an oracle specific type
Hib,negative,look for a proxy
Hib,negative,features which change between i i and g
Hib,negative,evicts do not cascade to uninitialized collections
Hib,negative,features which remain constant across i i and g
Hib,negative,need to treat this as if it where optimistic lock all dirty does not make sense first we need to locate the loaded state note it potentially could be a proxy so perform the location the safe way
Hib,negative,column sc gettable getprimarykey getcolumniterator next getname
Hib,negative,might happen with a managed connection
Hib,negative,do not need subclass tables because they ca not appear in conditions
Hib,negative,not final static to avoid possible classcast exceptions if using different oracle drivers
Hib,negative,make certain that this is called before any subsequent scheduledupdate aftertransactioncompletion
Hib,negative,private list aliases new arraylist
Hib,negative,the reason for this is sql does not let you sort by an expression you are not returning in the result set
Hib,negative,register resolvers set via environment property
Hib,negative,an existing collection that was either non empty or uninitialized is replaced by null or a different collection if the collection is uninitialized hibernate has no way of knowing if the collection is actually empty without querying the db
Hib,negative,update all the modified entries
Hib,negative,special case where we need to force incloude all subclass joins
Hib,negative,we did not find a collection element in the result set so we ensure that a collection is created with the owner is identifier since what we have is an empty collection
Hib,negative,binary stream character stream
Hib,negative,ignore it
Hib,negative,getdefaultproperties setproperty environment statement batch size no batch
Hib,negative,assumes that types are all of span 
Hib,negative,hibernate impelemnts cast in dialect java
Hib,negative,this is the root versioned table and we are using version based optimistic locking if we are not updating the version also do not check it unless this is a generated version column
Hib,negative,aggregate functions should not be registered right ? registerfunction list new standardsqlfunction list hibernate string stopped on list
Hib,negative,its the given optional object
Hib,negative,the class hierarchy structure
Hib,negative,decide which resultset to get the property value from
Hib,negative,properties of this class including inherited properties
Hib,negative,otherwise assume the parent is the the criteria that created us
Hib,negative,the closure of all columns used by the entire hierarchy including subclasses and superclasses of this class
Hib,negative,we can go straight to the first required row
Hib,negative,now look up the object we are really interested in this lets us correctly handle proxies and multi row or multi column queries
Hib,negative,before adding to collection
Hib,negative,discriminator column
Hib,negative,code to handle subclasses of topclass
Hib,negative,initialization
Hib,negative,none because its the requested lock mode not the actual
Hib,negative,private final map propertytablenumbersbyname new hashmap
Hib,negative,conceivable that the dialect ctor could throw hibernateexceptions so do not re wrap
Hib,negative,class table
Hib,negative,synchronized to avoid multi thread access issues defined as method synch to avoid potential deadlock issues due to nature of code
Hib,negative,required to exception table iconst i
Hib,negative,for now just re flatten the metamodel since this is temporary stuff anyway hhh 
Hib,negative,checkcast cast the bean into a raw bean
Hib,negative,this one only really needed for badly behaved applications if the transactionmanager has a sychronization registered its a noop actually we do need it for downgrading locks
Hib,negative,checkcast case of primitive type invokevirtual case of primitive type
Hib,negative,at this point we have drivingsqlalias the sql alias of the driving table corresponding to the given user alias however the driving table is not necessarily the table against which we want to apply locks mainly the exception case here is joined subclass hierarchies where we instead want to apply the lock against the root table for all other strategies it just happens that driving and root are the same
Hib,negative,this bean args i raw bean exception
Hib,negative,get the first child to be considered sub classes may do this differently in order to skip nodes that are not select expressions e g distinct
Hib,negative,new bulkaccessorexception
Hib,negative,as is not in keywords
Hib,negative,getfield get field javassist callback defined already
Hib,negative,all distinctrootentityresulttransformer are considered equal
Hib,negative,dup
Hib,negative,todo move this to sf per hhh also see hhh and componentmetamodel
Hib,negative,putfield put field javassist callback defined already
Hib,negative,configure the cache to use our tm
Hib,negative,local variables this callback
Hib,negative,find the batch number associated with the current association if any
Hib,negative,invokeinterface
Hib,negative,we always assume an instance with a null identifier or no identifier property is unsaved
Hib,negative,ddl support
Hib,negative,seems to not really public boolean supportsrowvalueconstructorsyntax return true
Hib,negative,below is for cache  that do not have str in there is str and we register str directly
Hib,negative,temporary
Hib,negative,byte
Hib,negative,the column doesnt exist at all
Hib,negative,note that string is deprecated
Hib,negative,if the object is already loaded return the loaded one
Hib,negative,create new lock that times out immediately
Hib,negative,convenience methods relating to operations across arrays of types
Hib,negative,we really could refresh the item if it is not a lock but it might be slower return freshtimestamp txtimestamp
Hib,negative,due to the complexity in initializing the selectclause do not generate one here if it is not found simply return null also do not cache since it gets generated well after we are created
Hib,negative,discriminator
Hib,negative,versiontype impl note simply returns null for seed and next as the only known application of binary types for versioning is for use with the timestamp datatype supported by sybase and sql server which are completely db generated values
Hib,negative,pre flushing section
Hib,negative,use the lower case function name remember whether we  re in a select clause or not
Hib,negative,upper is deprecated
Hib,negative,let this take precedence if defined since it works for assigned identifiers
Hib,negative,throw new unsupportedoperationexception ca not write to a readonly object
Hib,negative,the contract of entitytuplizer determineconcretesubclassentityname says that returning null is an indication that the specified entity name this getentityname should be used
Hib,negative,subclasses
Hib,negative,according to both the ansi sql and ejb specs trim can either take exactly one parameter or a variable number of parameters between and from the sql spec trim function trim left paren trim operands right paren trim operands trim specification trim character from trim source trim specification leading trailing both if only trim specification is omitted both is assumed if trim character is omitted space is assumed
Hib,negative,the syntax used to add a foreign key constraint to a table
Hib,negative,note it is conceptually possible that a usertype could map null to a non null value so the following is arguable
Hib,negative,execute the sql
Hib,negative,note interfaces is assumed to already contain hibernateproxy class
Hib,negative,identifier commalist
Hib,negative,note interfaces is assumed to already contain hibernateproxy class
Hib,negative,assembled state gets put in a new array we read from cache by value
Hib,negative,we do not have to worry about queued additions to uninitialized collections since they can only occur for inverse collections
Hib,negative,disassemble named parameters
Hib,negative,if not wrappered yet its dirty this ca not occur because we now always call wrap before getting to here return obj instanceof persistentcollection ? true searchfordirtycollections persistentcollection obj type
Hib,negative,again ccs did not have such a concept but a reasonable proximity is to clear the cache after transaction as long as the underlying cache is not jta aware
Hib,negative,oracle driver reports to support getgeneratedkeys but they only support the version taking an array of the names of the columns to be returned via its returning clause no other driver seems to support this overloaded version
Hib,negative,again ccs did not have such a concept however a reasonable proximity is to clear the cache for non transaction aware caches we will also do a clear at the end of the transaction
Hib,negative,remove all collections for the entity from the session level cache
Hib,negative,invokeinterface callback write
Hib,negative,moved up from abstractentitypersister
Hib,negative,joins
Hib,negative,if this is an entity and the property is the identifier property then use getidentifiertype note that the propertyname equals propertypath checks whether we have a component key reference where the component class property name is the same as the entity id property name if the two are not equal this is the case and we  d need to fall through to using the property mapping
Hib,negative,classes mentioned in extends not available so put it in queue
Hib,negative,stuff that is tuplizer centric
Hib,negative,propertytablenumbersbyname put prop getname join
Hib,negative,needed to bump this up to dotnode because that is the only thing which currently knows about the property ref path in the correct format it is either this or recurse over the dotnodes constructing the property path just like dotnode does internally
Hib,negative,access cached sql
Hib,negative,stuff that is tuplizer centric but is passed a session
Hib,negative,figure out which tables need to be fetched
Hib,negative,private final list persisters new arraylist
Hib,negative,figure out which columns are needed
Hib,negative,it is possible for this method to be called during flush processing so make certain that we do not accidently initialize an uninitialized proxy
Hib,negative,figure out which formulas are needed
Hib,negative,get em on the second pass
Hib,negative,render the sql
Hib,negative,local cache so we use synchronization
Hib,negative,sql strings
Hib,negative,public static object clone class elementclass object array object result object array newinstance elementclass array length system arraycopy array result array length return result
Hib,negative,identity support
Hib,negative,if there is no resulting row return null
Hib,negative,load each type
Hib,negative,unfortunately not really safe to normalize this to as an initial value like we do the others because we would not be able to control this if we are using a sequence
Hib,negative,
Hib,negative,select topic syntax from information schema help where section like  function   order by section topic see also http www h database com html functions html
Hib,negative,the optional sql string defined in the where attribute
Hib,negative,pass this as an argument only to avoid double looking
Hib,negative,for version properties marked as being generated make sure they are always generated aka insert is invalid this is dis allowed by the dtd but just to make sure
Hib,negative,added this caching as i noticed that gettype is being called multiple times
Hib,negative,information about lazy properties of this class
Hib,negative,if there are any scalars non entities selected render the select column aliases
Hib,negative,information about all columns formulas in class hierarchy
Hib,negative,inner classes
Hib,negative,column discrim getcolumniterator next settype type
Hib,negative,saveorupdatecopy operations
Hib,negative,dynamic filters attached to the class level
Hib,negative,the loaded owner will be set to null after the collection is removed so capture its value as the affected owner so it is accessible to both pre and post events
Hib,negative,temporary table support
Hib,negative,assume we are in an auto commit state
Hib,negative,custom sql
Hib,negative,cascade first so that all unsaved objects get their copy created before we actually copy cascadeonmerge event persister entity copycache cascades cascade before merge
Hib,negative,model getkey settype new type model getidentifier
Hib,negative,stuff that is tuplizer centric
Hib,negative,the syntax used to add a column to a table
Hib,negative,simple because we ca not have a one to one or a collection or even a property ref in a composite element
Hib,negative,completely optional cascading drop clause
Hib,negative,during deserialization we need to reconnect all proxies and collections to this session as well as the entityentry and collectionentry instances these associations are transient because serialization is used for different things
Hib,negative,properties
Hib,negative,sqlresulttypes type sqlresulttypelist toarray new type sqlresulttypelist size
Hib,negative,
Hib,negative,potentialtrimcharacterargindex assumes that a trim specification has been specified we handle the exception to that explicitly
Hib,negative,identifier
Hib,negative,we call getkeyfromresultset here so that we can know the key value upon which to perform the breaking logic however it is also then called from getrowfromresultset which is certainly not the most efficient but the call here is needed and there currently is no other way without refactoring of the doquery getrowfromresultset methods
Hib,negative,version
Hib,negative,operations which cascade as far as the collection also cascade to collection elements
Hib,negative,where string
Hib,negative,the loop ensures atomicity of the select update even for no transaction or read committed isolation level
Hib,negative,subclass property closure
Hib,negative,in an effort to avoid concurrent modification exceptions from potential recursive calls back through here as a result of the eventual call to persistentcollection endread we scan the internal loadingcollections map for matches and store those matches in a temp collection the temp collection is then used to drive the endread processing
Hib,negative,before add
Hib,negative,the configured transaction factory says it only supports local callback mode so no sense attempting to register a jta synchronization
Hib,negative,handle any filters applied to the class level
Hib,negative,sybase driver jconnect throwing npe here in certain cases but we will just handle the general unexpected case
Hib,negative,only one to one is lazy fetched
Hib,negative,replicate does cascade to uninitialized collections
Hib,negative,note early exit here
Hib,negative,translates an ast join type i e the token type into a joinfragment xxx join type param astjointype the ast join type from hqlsqltokentypes or sqltokentypes return a joinfragment xxx join type see joinfragment see sqltokentypes
Hib,negative,note this assumes something about how propertyselectfragment is implemented by the subclass
Hib,negative,deliberately ignore return value
Hib,negative,strip leading
Hib,negative,if the metadata allowed proxy creation and caller did not request forceful eager loading generate a proxy
Hib,negative,if there is no resulting row return null
Hib,negative,if this from element is a collection and the path is a collection property maxindex etc then generate a sub query
Hib,negative,otherwise return the hydrated state ie associations are not resolved
Hib,negative,the name of the sql function that transforms a string to lowercase
Hib,negative,null owner ok ? ?
Hib,negative,essentially if the real session is closed allow any method call to pass through since the real session will complain by throwing an appropriate exception note that allowing close above has the same basic effect but we capture that there simply to perform the unbind
Hib,negative,automatically makes a column with the default name if none is specifed by xml
Hib,negative,just ignore
Hib,negative,this is the exception returned by reflecthelper getconstructor if it cannot locate an appropriate constructor
Hib,negative,ok in normal hibernate usage to delete a detached entity jpa however forbids it thus this is a hook for hem to affect this behavior
Hib,negative,null sql means that the only lazy properties are shared pk one to one associations which are handled differently in the type nullsafeget code
Hib,negative,if the property mapping consists of all formulas make it non updateable
Hib,negative,the user specifically supplied insert true which constitutes an illegal combo
Hib,negative,if the property mapping consists of all formulas make it insertable
Hib,negative,it might be an unwrapped collection reference try to find a wrapper slowish
Hib,negative,custom sql
Hib,negative,tablename mappings getnamingstrategy propertytotablename classname path
Hib,negative,package
Hib,negative,return
Hib,negative,the entry will be removed after the flush and will no longer override the stale snapshot this is now handled by removeentity in entitydeleteaction persistencecontext removedatabasesnapshot key
Hib,negative,bad cast
Hib,negative,arraylist list new arraylist list addall getkey getconstraintcolumns list addall getindex getconstraintcolumns getcollectiontable createuniquekey list
Hib,negative,property refs for associations defined on a component are not supported so no need to slice
Hib,negative,we have an embedded composite identifier
Hib,negative,if there is no property ref assume the join is to the subclass table ie the table of the subclass that the association belongs to
Hib,negative,stops flush being called multiple times if this method is recursively called
Hib,negative,create a new from node for the referenced class
Hib,negative,custom sql
Hib,negative,performance op to avoid the array search
Hib,negative,now get an existing proxy for each row element if there is one
Hib,negative,orphan delete used for programmer error detection
Hib,negative,empty means no scoping
Hib,negative,enable for hhh which we do not like
Hib,negative,lockmode anything
Hib,negative,this forcecacherefresh forcecacherefresh
