Hib,negative,we ca not batch joined inserts especially not if it is an identity insert nor can we batch statements where the expectation is based on an output param
Hib,negative,
Hib,negative,unfortunately this stuff ca not be cached because it is per invocation not constant for the querytranslator instance
Hib,negative,return the proxied object
Hib,negative,else no collection element but also no owner
Hib,negative,ignore
Hib,negative,we have the form trim trimsource so we trim leading and trailing spaces early exit
Hib,negative,overwrite old proxy
Hib,negative,the mru cache used to keep hard references to the most recently used query plans note lru here is a bit of a misnomer it indicates that lru entries are removed the actual kept entries are the mru entries
Hib,negative,early exit
Hib,negative,handles things like a and b or c a and b or c not a and not b not a and b x between y and z overloaded and x in a b c overloaded brackets not not a a is not null overloaded not etc and expressions like foo bar maps to foo id bar id foo bar  foo  maps to foo bar  foo  foo bar baz maps to foo bar bar id and bar baz foo bar baz maps to bar baz and foo bar bar id foo bar baz a b c maps to bar baz b c and foo bar bar id and a b b id foo bar baz a b c maps to bar baz b c and foo bar bar id and a b b id foo bar baz maps to bar baz and foo bar bar id
Hib,negative,or should it actually throw an exception ?
Hib,negative,both many to one and one to one are represented as a property entitypersister is relying on this value to determine lazy fetch groups in terms of field level interception so we need to make sure that we return true here for the case of many to one and one to one with lazy no proxy impl note lazy no proxy currently forces both lazy and unwrap to be set to true the other case we are extremely interested in here is that of lazy proxy where lazy is set to true but unwrap is set to false thus we use both here under the assumption that this return is really only ever used during persister construction to determine the lazy property field fetch groupings if that assertion changes then this check needs to change as well partially this is an issue with the overloading of the term lazy here
Hib,negative,the property is a component
Hib,negative,the ids are fully resolved so compare them with isdirty not ismodified
Hib,negative,cant instantiate
Hib,negative,queryjoinfragment join q createjoinfragment usethetastylejoin
Hib,negative,if it is a property of an embedded component invoke on the identifier
Hib,negative,subclasses
Hib,negative,otherwise
Hib,negative,starts with the name of a mapped class new style
Hib,negative,treat it just like a new collection
Hib,negative,we must return a valid rdms rsa command from this method to prevent rdms rsa from issuing error 
Hib,negative,skip finalize methods
Hib,negative,return the fully resolved identifier value but do not resolve to the actual referenced entity instance note the owner of the association is not really the owner of the id
Hib,negative,do this work only at the very highest level of the load do not let this method be called recursively
Hib,negative,public static jdbcexception newjdbcexception string string sqlexception root string sql string string sql log error string root logexceptions root return new jdbcexception string root sql public static jdbcexception newjdbcexception string string sqlexception root log error string root logexceptions root return new jdbcexception string root
Hib,negative,note that each iteration of the loop may add new elements
Hib,negative,if we know there is exactly row we can skip it would be great if we could always skip this it is a problem for key many to one
Hib,negative,this can never happen because this rule will always eliminate the child not case not return x getfirstchild not not x x
Hib,negative,we need to obtain the lock before any actions are executed since this may be an inverse true bidirectional association and it is one of the earlier entity actions which actually updates the database this action is resposible for second level cache invalidation only
Hib,negative,hhh make sure the callback gets cleared otherwise the instance stays in a static thread local
Hib,negative,no point doing this if none was requested
Hib,negative,while constructor is running
Hib,negative,the keyword used to specify a nullable column
Hib,negative,while constructor is running
Hib,negative,there is probably a row there so try to update if no rows were updated we will find out
Hib,negative,note interface is assumed to already contain hibernateproxy class
Hib,negative,do nothing to avoid a lazy property initialization
Hib,negative,interfaces arguments
Hib,negative,not called at runtime so does not matter if its slow
Hib,negative,todo
Hib,negative,chop off the rest of the tree
Hib,negative,get the caller
Hib,negative,prefer re generation of identity
Hib,negative,get the caller principals
Hib,negative,refresh does not cascade to uninitialized collections
Hib,negative,private static final alias default alias new alias null
Hib,negative,do nothing
Hib,negative,public boolean isnonexistant entitykey key return nonexistantentitykeys contains key
Hib,negative,generate id select fragment and then property select fragment for each expression just like generateselectfragments
Hib,negative,public boolean isnonexistant entityuniquekey key return nonexistententityuniquekeys contains key
Hib,negative,special case this is the leaf of the containment graph even though not immutable
Hib,negative,iterate all the entities currently associated with the persistence context
Hib,negative,according to both the ansi sql and jpa specs trim takes a variable number of parameters between and at least one paramer trimsource is required from the sql spec trim function trim left paren trim operands right paren trim operands trim specification trim character from trim source trim specification leading trailing both if trim specification is omitted both is assumed if trim character is omitted space is assumed
Hib,negative,does this entity entry pertain to the entity persister in which we are interested owner ?
Hib,negative,prepare persisters and link them up with their cache region access strategy
Hib,negative,check if the managed object is the parent
Hib,negative,allows various loaders ok mainly the queryloader to check whether scrolling of their result set should be allowed by default it is allowed
Hib,negative,otherwise the proxy was pruned during the serialization process
Hib,negative,does not handle arrays thats ok cos they ca not be lazy or newly instantiated collections so we can do the cast
Hib,negative,adds remove as a sort of alias for delete
Hib,negative,unquotedidentifiercolumnname identifiercolumnalias
Hib,negative,return lhspersister getsubclasspropertycolumnnames property
Hib,negative,saves updates do not cascade to uninitialized collections
Hib,negative,early exit
Hib,negative,create our own copy of the user supplied tuplizer impl map
Hib,negative,if the identifier is quoted remove the quotes
Hib,negative,we can do the cast since orphan delete does not apply to newly instantiated collections arrays we ca not track orphans for detached arrays
Hib,negative,truncate the identifier to the max alias length less the suffix length
Hib,negative,
Hib,negative,full joins are not supported yet
Hib,negative,you may still have other resultsets or update counts left to process here but you ca not do it now or the resultset you just got will be closed
Hib,negative,null is not considered the same type as integer non nls non nls 
Hib,negative,properly handle property ref based associations
Hib,negative,the outerjoinsafterwhere needs to come before where clause to properly handle dynamic filters
Hib,negative,determine the id getter and setter methods from the proxy interface if any determine all interfaces needed by the resulting proxy
Hib,negative,non nls 
Hib,negative,add another inner nested select add the main query close off the inner nested select
Hib,negative,non nls 
Hib,negative,origin adddestination destination this was the cause of hhh origin settype from fragment set the parent node type so that the ast is properly formed the destination node will have all the from text the parent node is a collection join too voodoo see joinprocessor
Hib,negative,non nls 
Hib,negative,then handle any user defined entity modes
Hib,negative,non nls 
Hib,negative,overridden informational metadata
Hib,negative,strip off any leading  and  token
Hib,negative,then the pojo tuplizer using the dynamic map tuplizer if no pojo representation is available
Hib,negative,if the condition is not already there
Hib,negative,this has been shown to happen occasionally in rare cases when using a transaction manager transaction timeout where the timeout calls back through hibernate is registered transaction synchronization on a separate reaping thread in cases where that reaping thread executes through this block at the same time the main application thread does we can get into situations where these cmes occur and though it is not allowed per se the end result without handling it specifically is infinite looping so here we simply break the loop
Hib,negative,dontspace add  
Hib,negative,public componentmetamodel component component sessionfactoryimplementor sessionfactory
Hib,negative,for mysql
Hib,negative,detect discriminator values
Hib,negative,set a custom entity resolver this entity resolver must be set before addxxx misc call default value is link org hibernate util dtdentityresolver param entityresolver entity resolver to use
Hib,negative,handle any filters applied to this collection
Hib,negative,handle a property ref
Hib,negative,if we could not register a synchronization do the before after completion callbacks ourself but we need to let jdbccontext know that this is what we are going to do so it does not keep trying to register synchronizations
Hib,negative,hashmap columnsunique new hashmap
Hib,negative,then the pojo tuplizer using the dynamic map tuplizer if no pojo representation is available
Hib,negative,null caused some problems
Hib,negative,two conditions where we need to transform this to a theta join syntax  elem  is the root from element in correlated subqueries the dotnode usethetastyleimplicitjoins has been set to true and  elem  represents an implicit join
Hib,negative,package
Hib,negative,cascade the refresh prior to refreshing this entity
Hib,negative,not sure if this would ever be null but wanted to be careful
Hib,negative,impl note takes advantage of the fact that an escpaed single quote embedded within a quote block can really be handled as two seperate quote blocks for the purposes of this method
Hib,negative,even on inverse true
Hib,negative,properties
Hib,negative,package
Hib,negative,we need to dirty check many to ones with not found ignore in order to update the cache not the database since in this case a null entity reference can lose information
Hib,negative,package
Hib,negative,register hibernate types for default use in scalar sqlquery type auto detection
Hib,negative,if true then execute db updates otherwise just generate and display updates
Hib,negative,sqlfunction implementation
Hib,negative,we only release the connection
Hib,negative,we only check the version when upgrading lock modes
Hib,negative,deprecated option
Hib,negative,only carry on if the method has no parameters
Hib,negative,nativesqlqueryreturn
Hib,negative,woops we got an instance of another class hierarchy branch
Hib,negative,composite id
Hib,negative,create an outerjoingenerator for this dialect
Hib,negative,if an exception occurs during flush user must call rollback
Hib,negative,string
Hib,negative,actually this last test is probably unnecessary since beforecompletion does not get called during rollback
Hib,negative,we need to step through the rows one row at a time slow
Hib,negative,final boolean forcecacherefresh
Hib,negative,lock acquisition support
Hib,negative,create an dotnode ast for the path and resolve it
Hib,negative,its already loaded so do not need to hydrate it
Hib,negative,if an exception occurs during flush user must call rollback
Hib,negative,orphans should be deleted during delete
Hib,negative,swallow it and continue to roll back jta transaction
Hib,negative,here we have two possibilities the property name matches the explicitly identifier property name the property name matches the implicit  id  property name
Hib,negative,so the transaction is already rolled back by jta spec
Hib,negative,we found a collection element in the result set
Hib,negative,this method is a noop if there is a synchronization
Hib,negative,register the standard dialect resolver
Hib,negative,why is all others non final ?
Hib,negative,even though we might find a pre existing element by join path we may not be able to reuse it
Hib,negative,hella important optimization
Hib,negative,include the discriminator and class level where but not filters
Hib,negative,return that type equals type equalshelper equals that value value
Hib,negative,null child could occur for no from clause in a filter
Hib,negative,the  from element  that the property is in
Hib,negative,since the result set cursor is always left at the first physical row after the last processed we need to jump back one position to get the key value we are interested in skipping
Hib,negative,websphere however is not a sane jee jta container
Hib,negative,loop through all the associated entities and make sure they have been processed before the latest batch associated with this entity type
Hib,negative,for sane jee jta containers the transaction itself functions as its identifier
Hib,negative,first try to find a matching constructor accepting a violatedconstraintnameextracter param
Hib,negative,swallow the transaction was finished
Hib,negative,will be ignored using the existing entry instead
Hib,negative, seconds
Hib,negative,this property belongs to the table and it is not specifically excluded from optimistic locking by optimistic lock false
Hib,negative,do not hold a transactional lock for this
Hib,negative,some collections are not lazy
Hib,negative,fix up the resident flag
Hib,negative,does the limit clause come at the start of the select statement rather than at the end ?
Hib,negative,all aliastoentitymapresulttransformer are considered equal
Hib,negative,the following two lines were added to ensure that this params is not null which can happen with two deep nested subqueries
Hib,negative,set the attributes of the property reference expression
Hib,negative,the current batch number is the latest batch for this entity type
Hib,negative,take a snapshot
Hib,negative,we can inner join to superclass tables the row must be there we can never inner join to subclass tables
Hib,negative,never evict this node
Hib,negative,does the collection referenced by this fromelement specify an order by attribute ? if so attach it to the query is order by
Hib,negative,create the join element under the from element
Hib,negative,for merging of versioned entities we consider the version having been changed only when the two version values are different and the target actually represents database state this second condition is a special case which allows an entity to be merged during the same transaction though during a seperate operation in which it was originally persisted saved
Hib,negative,moved here from selectclause jsd
Hib,negative,pre determine and cache the hashcode
Hib,negative,
Hib,negative,not between a b not between a b
Hib,negative,make sure the root node for the region exists and has a dataversion that never complains
Hib,negative,ps close just close it do not try to return it to the pool note early exit
Hib,negative,map of entitymode tuplizer
Hib,negative,now write the values of fields onto the prepared statement
Hib,negative,this is a virtual id property
Hib,negative,need to use the identifier type of the collection owner since the incoming is value is actually the owner is id using the collection is key type causes problems with property ref keys
Hib,negative,create our own copy of the user supplied tuplizer impl map
Hib,negative,the current timestamp is more accurate but only known to be supported in sql server and later i e sybase not known to support it at all
Hib,negative,this one needed only for guessentitymode
Hib,negative,will check current level if some of them are not null or sublevels if they exist
Hib,negative,build the dynamic map tuplizer
Hib,negative,pointbase has no known variation of a select for update syntax
Hib,negative,then dom j tuplizer if dom j representation is available
Hib,negative,see if the entity is already bound to this session if not look at the entity identifier and assume that the entity is persistent if the id is not unsaved that is we rely on foreign keys to keep database integrity
Hib,negative,do the work
Hib,negative,if its an uninitialized proxy it ca not be transient
Hib,negative,we  ve been here before
Hib,negative,return the id so we can use it to reset the proxy id return result
Hib,negative,build the dynamic map tuplizer
Hib,negative,return false here as most databases do not properly support this construct
Hib,negative,do the work
Hib,negative,stuff that is persister centric and or entityinfo centric
Hib,negative,put the standard tuplizers into the tuplizer map first
Hib,negative,hit the database after checking the session cache for a snapshot
Hib,negative,found a ctor but it was not publicly accessible so try to request accessibility
Hib,negative,our parent is another dot node meaning we are being further dereferenced thus we need to generate a join unless the parent refers to the associated entity is pk because  our  table would know the fk
Hib,negative,private final sessionfactoryimplementor sessionfactory
Hib,negative,search for collections by reachability updating their role we do not want to touch collections reachable from a deleted object
Hib,negative,cached for efficiency
Hib,negative,sql server just returns automatically
Hib,negative,this sessionfactory sessionfactory
Hib,negative,table support
Hib,negative,it was not embedded so the argument is just an id
Hib,negative,we have specialized case of a detached entity from the perspective of the merge operation specifically we have an incoming entity instance which has a corresponding entry in the current persistence context but registered under a different entity instance
Hib,negative,then dom j tuplizer if dom j representation is available
Hib,negative,where fragment must be empty
Hib,negative,or its key changed
Hib,negative,int parameterstart getwalker getnumberofparametersinsetclause list allparams getidselectparameterspecifications iterator whereparams allparams sublist parameterstart allparams size iterator
Hib,negative,put the standard tuplizers into the tuplizer map first
Hib,negative,miscellaneous support
Hib,negative,we will need to remove ye olde entries
Hib,negative,add the current fragment to the theta joins node
Hib,negative,force initialize
Hib,negative,lock does not cascade to uninitialized collections
Hib,negative,return currentid
Hib,negative,unquotedidentifiercolumnname null
Hib,negative,reset the id
Hib,negative,addinitializedcollection collection persister id
Hib,negative,collectionpropertymapping processes everything except  index 
Hib,negative,if it is an uninitialized proxy pointing with this session then when it is accessed the underlying instance will be contained
Hib,negative,reset the version
Hib,negative,note this simply constructs a raw sql token representing the where fragment and injects this into the tree this works however it is probably not the best long term solution at some point we probably want to apply an additional grammar to properly tokenize this where fragment into constituent parts focused on the operators embedded within the fragment
Hib,negative,the default is to simply not lazy fetch properties for now
Hib,negative,aliases for identifier alias id skip if the entity defines a non id property named  id 
Hib,negative,else if it is elements changed
Hib,negative,this assumes you will want to ignore any update counts
Hib,negative,attributes maintained between flush cycles
Hib,negative,now rebuild the insertions list there is a batch for each entry in the name list
Hib,negative,should be safe to only ever expect entitypersister references here
Hib,negative,if the original is a persistentcollection and that original was not flagged as dirty then reset the target is dirty flag here after the copy operation p one thing to be careful of here is a bare original collection in which case we should never ever ever reset the dirty flag on the target because we simply do not know
Hib,negative,session start post flush persistent state
Hib,negative,temporary
Hib,negative,allow the collectionsnapshot to be serialized
Hib,negative,first break down the returns into maps keyed by alias so that role returns can be more easily resolved to their owners
Hib,negative,add the second join the one that ends in the destination table
Hib,negative,generate an d array of column names the first dimension is parallel with the return types array the second dimension is the list of column names for each type
Hib,negative,attributes used only during flush cycle
Hib,negative,create sql token nodes for the columns
Hib,negative,current means the reference that was found during flush
Hib,negative,rdms has no known variation of a select for update syntax
Hib,negative,ignore this row of results note the early exit
Hib,negative,not final static to avoid possible classcast exceptions if using different oracle drivers
Hib,negative,found a ctor but it was not publicly accessible so try to request accessibility
Hib,negative,add the new node to the map so that we do not create it twice
Hib,negative,return getfactory getsettings getbytecodeprovider getproxyfactoryfactory buildproxyfactory
Hib,negative,oracle driver reports to support getgeneratedkeys but they only support the version taking an array of the names of the columns to be returned via its returning clause no other driver seems to support this overloaded version
Hib,negative,not final because proxy factory creation can fail
Hib,negative,register the fromelement with the from clause now that we have the names and aliases
Hib,negative,superclass entity name
Hib,negative,first allow the actual type to control the return value the actual underlying sqltype could actually be different
Hib,negative,temporary
Hib,negative,cascade save to collections after the collection owner was saved
Hib,negative,
Hib,negative,pass along our initial embedded parameter node s to the first generated sql fragment so that it can be handled later for parameter binding
Hib,negative,loaded means the reference that is consistent with the current database state
Hib,negative,cache the actual id of the object not the value of the property ref which might not be initialized
Hib,negative,init the aliases after initing the constructornode
Hib,negative,you may still have other resultsets or update counts left to process here but you ca not do it now or the resultset you just got will be closed
Hib,negative,temporary
Hib,negative,multi param string dialect functions
Hib,negative,during flush we navigate the object graph to collections and decide what to do with them
Hib,negative,save operations
Hib,negative,collection cleardirty
Hib,negative,the  from element  that represents the elements of the collection
Hib,negative,legacy behavior with no abstract attribute specified
Hib,negative,constructors are always considered scalar results
Hib,negative,get ready to start adding nodes
Hib,negative,use the id column alias
Hib,negative,collection types
Hib,negative, note that this is also true of datetime param
Hib,negative,collection cleardirty
Hib,negative,we do not need to worry about existing version being uninitialized because this block is not called by a re entrant load re entrant loads always have lock mode none
Hib,negative,note this affects the return value
Hib,negative,istransactioncallbackregistered denotes whether any hibernate transaction has registered as a callback against this jdbccontext only one such callback is allowed directly serializing this value causes problems with jdbctransaction or really any transaction impl where the callback is local to the transaction instance itself since that transaction is not serialized along with the jdbccontext thus we handle that fact here explicitly
Hib,negative,note evict operates locally only i e does not propogate to any other nodes in the potential cluster this is exactly what is needed when we destroy here destroy is used as part of the process of shutting down a sessionfactory thus these removals should not be propogated
Hib,negative,generate the inner join the elements need to be joined to the collection they are in
Hib,negative,otherwise perform a deep equivalence check
Hib,negative,might happen with a managed connection
Hib,negative,need to account for allowable within the variant
Hib,negative,for expected parameter type injection we expect that the lhs represents some form of property ref and that the children of the in list represent one or more params
Hib,negative,if there is no where node make one
Hib,negative,we found it in the temp pc should indicate we are in the midst of processing a result set containing eager fetches via join fetch
Hib,negative,add the type to the list of returned sqlresulttypes
Hib,negative,overridden informational metadata
Hib,negative,create one
Hib,negative,persists do not cascade to uninitialized collections
Hib,negative,lobs cannot be compared
Hib,negative,this property belongs to the table and it is not specifically excluded from optimistic locking by optimistic lock false
Hib,negative,blobs are ignored by merge
