Hib,positive,this is only needed afaict for processing results from the query cache however this cannot possibly work in the case of discovered types
Hib,positive,note that this timestamp is not correct if the connection provider returns an older jdbc connection that was associated with a transaction that was already begun before opensession was called do not know any possible solution to this
Hib,positive,todo this is assertion is disabled because there is a bug that means the original owner of a transient uninitialized collection is not known if the collection is re referenced by a different object associated with the current session throw new assertionfailure bug loading unowned collection
Hib,positive,this does not support the cache sql  distinct by comma list   extensions but this extension is not supported through hibernate anyway
Hib,positive,todo when this is the entry point we should use an inner join for fetching the many to many elements
Hib,positive,could happen for custom criteria impls not likely but for long term solution see hhh 
Hib,positive,todo currently broken for unique key references does not detect change to unique key property of the associated object the owner of the association is not the owner of the id
Hib,positive,todo currently broken for unique key references does not detect change to unique key property of the associated object
Hib,positive,todo entities can be compared by pk and entity name fix this
Hib,positive,todo does not work for entitymode dom j yet
Hib,positive,todo deal with the optional attribute in the join mapping this code assumes that optional defaults to true because it does not actually seem to work in the fetch join code note that actual proper handling of optional ality here is actually more involved than this patch assumes remember that we might have multiple join mappings associated with a single entity really a couple of things need to happen to properly handle optional here first and foremost when handling multiple join s we really should be using the entity root table as the driving table another option here would be to choose some non optional joined table to use as the driving table in all likelihood just using the root table is much simplier need to add the fk columns corresponding to each joined table to the generated select list these would then be used when iterating the result set to determine whether all non optional data is present my initial thoughts on the best way to deal with this would be to introduce a new sequentialselect abstraction that actually gets generated in the persisters ok singletable and utilized here it would encapsulated all this required optional ality checking
Hib,positive,todo would be nice to use false but issues with ms sql
Hib,positive,todo not really completely correct since the uoe could occur while resolving associations leaving the pc in an inconsistent state
Hib,positive,todo this is kinda inconsistent with collectiontype
Hib,positive,for a one to many a bag is not really a bag it is really a set since it ca not contain the same element twice it could be considered a bug in the mapping dtd that bag allows one to many
Hib,positive,todo entities can be compared by pk fix this only if when we can extract the id values
Hib,positive,todo old version did not require hashmap lookup keys collectionowner getidentifier
Hib,positive,todo this disables laziness even in non pojo entity modes
Hib,positive,todo at the point where we are resolving collection references we do not know if the uk value has been resolved depends if it was earlier or later in the mapping document now we could try and use e getstatus to decide to semiresolve trouble is that initializeentity reuses the same array for resolved and hydrated values
Hib,positive,todo currently we do not know a sessionfactory reference when building the tuplizer this is a bug embedded xml false on component todo fix this after hhh is complete
Hib,positive,todo this requires that the collection is defined after the referenced property in the mapping file ok ?
Hib,positive,todo currently we really do not handle valueinclusion partial valueinclusion partial would indicate parts of a component need to be included in the select currently we then just render the entire component into the select clause in that case
Hib,positive,todo is this completely correct ?
Hib,positive,todo what if batchupdate is a callablestatement ? calls executebatch
Hib,positive,this does not actually seem to work but it might work on some dbs also it does not work if there are multiple columns of results because it is not accounting for the suffix return new string getdiscriminatorcolumnname
Hib,positive,first validate all the enabled filters todo this implementation has bad performance
Hib,positive,todo passing null here because this method is not really used for dom j at the moment but it is still a bug if we do not get rid of this
Hib,positive,todo this really needs to be delayed unitl after we definitively know the operand node type where this is currently a problem is parameters for which where we cannot unequivocally resolve an expected type
Hib,positive,algorithm check for any level one nullability breaks look at non null components to recursively check next level of nullability breaks look at collections contraining component to recursively check next level of nullability breaks in the previous implementation not null stuffs where checked filtering by level one only updateable or insertable columns so setting a sub component as update false has no effect on not null check if the main component had good checkeability in this implementation we keep this feature however i never see any documentation mentioning that but it is for sure a limitation
Hib,positive,assume that the row was not there since it previously had only null values so do an insert instead todo does not respect dynamic insert
Hib,positive,todo this call will not work for anything other than pojos
Hib,positive,note that this implementation is kinda broken for components with many to one associations
Hib,positive,no need to take a snapshot this is a performance optimization but not really important except for entities with huge mutable property values
Hib,positive,todo this is broke for subqueries in statements other than selects
Hib,positive,the following types are not supported in rdms jdbc and therefore commented out however in some cases mapping them to character columns works for many applications but does not work for all cases
Hib,positive,todo should this be an error ?
Hib,positive,three general cases we check here as to whether to render a physical sql join is our parent a dotnode as well ? if so our property reference is being further de referenced is this a dml statement we were asked to generate any needed joins generatejoins true or we are currently processing a select or from clause an additional check is the regression style join suppression check solely intended for the test suite the regression style join suppression is an additional check intended solely for use within the test suite this forces the implicit join resolution to behave more like the classic parser the underlying issue is that classic translator is simply wrong about its decisions on whether or not to render an implicit join into a physical sql join in a lot of cases the piece it generally tends to miss is that inner joins effect the results by further restricting the data set a particular manifestation of this is the fact that the classic translator will skip the physical join for toone implicit joins if the query is shallow the result being that query list and query iterate could return different number of results
Hib,positive,todo figure out how this should be set this was the reason for failures regarding index op and subclass joins on theta join dialects not sure what behaviour we were trying to emulate joinsequence joinsequence getfrompart emulate the old addfromonly behavior
Hib,positive,the preference here would be sqlfunctiontemplate hibernate timestamp current timestamp ? false but this appears not to work jay nance 
Hib,positive,todo would be nice to use false but issues with ms sql
Hib,positive,todo inexact what we really need to know is are any outer joins used ?
Hib,positive,todo would be nice to use false but issues with ms sql
Hib,positive,todo not sure which either ? is correct could not find docs on how to do this did find various blogs and forums mentioning that select current timestamp does not work
Hib,positive,todo cannot use generatesuffixes it handles the initial suffix differently
Hib,positive,do not need this because we should never ever be selecting no columns in an insert select and because it causes a bug on db 
Hib,positive,starts with an alias old style semi bad thing about this ca not re alias another alias
Hib,positive,todo bug this currently fails for named queries for non pojo entities
Hib,positive,fixme we do not have the associated entity table name here has to be done in a second pass
Hib,positive,this call is side effecty
Hib,positive,rdms does not directly support the trim function we use rtrim and ltrim
Hib,positive,note at least my local sql server express shows this not working
Hib,positive,note at least my local mysql install shows this not working
Hib,positive,use count as the default this mimics the old behavior although none might be a better option moving forward in the case of callable
Hib,positive,perhaps not really necessary
Hib,positive,todo what else to do here ?
Hib,positive,todo disable batch loading if lockmode read ?
Hib,positive,todo what else to do here ?
Hib,positive,todo to handle concurrent writes correctly the client should pass in a lock
Hib,positive,turn hibernate c p into c p so c p gets a chance to see all hibernate c p 
Hib,positive,note there is a wierd implementation in the client side
Hib,positive,todo this was added to support initializing an entity is entityentry snapshot during reattach this should be refactored to instead expose a method to assemble a entityentry based on this state for return
Hib,positive,do we need to drop constraints before dropping tables in this dialect ?
Hib,positive,fixme per the regionfactory class javadoc this constructor version should not be necessary param props the configuration properties
Hib,positive,does this dialect support check constraints ?
Hib,positive,this is called by sessionfactory irregardless we just disregard here could also add a check to sessionfactory to only conditionally call start
Hib,positive,does this dialect support the unique column syntax ?
Hib,positive,this is done here  cos we might only know the type here ugly todo improve this a lot
Hib,positive,does this dialect support the for update syntax ?
Hib,positive,todo what is the implication of this ?
Hib,positive,todo yuck
Hib,positive,todo again how should this work for non pojo entities ?
Hib,positive,does this dialect support for update of allowing particular rows to be locked ?
Hib,positive,todo really bad evil hack to fix
Hib,positive,aliasrefnode resolve false false aliasrefnode gettext todo is it kosher to do it here ? todo is it kosher to do it here ?
Hib,positive,todo better to degrade to lazy false if uninstrumented
Hib,positive,does this dialect support the oracle style for update nowait syntax ?
Hib,positive,fixme per the regionfactory class javadoc this constructor version should not be necessary param props the configuration properties
Hib,positive,icky workaround for mysql bug
Hib,positive,we have to set up the table later yuck
Hib,positive,todo somehow add the newly created foreign keys to the internal collection
Hib,positive,this inner class implements a case statement perhaps im being a bit over clever here
Hib,positive,todo merge into one method
Hib,positive,todo this is a bit of copy paste from indexedcollection createprimarykey
Hib,positive,todo what type ?
Hib,positive,todo inefficient
Hib,positive,fixme get the persistentclass
Hib,positive,todo we can remove this once the deprecated ctor can be made private
Hib,positive,todo this is too conservative if all preceding joins were also inner joins we could use an inner join here
Hib,positive,todo redesign how propertyaccessors are acquired
Hib,positive,todo not so sure this is needed
Hib,positive,todo we can remove this once the deprecated ctor can be made private
Hib,positive,create an index on the key columns ? ?
Hib,positive,todo joinkeycolumnname foreignkeycolumnname should be called either here or at a slightly higer level in the stack to get all the information we need right now hbmbinder does not support the
Hib,positive,todo improve this hack
Hib,positive,todo bad implementation cos it depends upon ordering of mapping doc fixing this requires that collection persistentclass gain access to the mappings reference from configuration or the filterdefinitions map directly sometime during configuration buildsessionfactory after all the types filter defs are known and before building persisters
Hib,positive,use of trim here is ugly ?
Hib,positive,todo ideally we need the construction of propertyaccessor to take the following entitymode entitymode specific data i e the classname for pojo entities property specific data based on the entitymode i e property name or dom j node name the easiest way with the introduction of the new runtime metamodel classes would be the the following predicates propertyaccessorfactory getpropertyaccessor takes references to both a org hibernate metadata entitymodemetadata and org hibernate metadata property what is now termed a propertyaccessor stores any values needed from those two pieces of information code can then simply call propertyaccess getgetter with no parameters likewise with propertyaccessor getsetter
Hib,positive,can happen because of the multiple ways cache remove can be invoked
Hib,positive,ick
Hib,positive,todo we can remove this once the deprecated ctor can be made private
Hib,positive,todo this is very suboptimal for some subclasses namely components since it does not take advantage of two phase load
Hib,positive,todo should this be session instantiate persister ?
Hib,positive,todo suck this into initlaziness
Hib,positive,todo we can remove this once the deprecated ctor can be made private
Hib,positive, hibernate temp use jdbc metadata defaults  is a temporary magic value the need for it is intended to be alleviated with future developement thus it is not defined as an environment constant it is used to control whether we should consult the jdbc metadata to determine certain settings default values it is useful to not do this when the database may not be available mainly in tools usage
Hib,positive,todo is this right ? ?
Hib,positive,ie the subquery yuck
Hib,positive,use of a stringbuffer to workaround a jdk bug
Hib,positive,todo copy paste from recreate
Hib,positive,workaround for backward compatibility of sets with no not null columns assume all columns are used in the row locator sql
Hib,positive,todo this eventually needs to be removed
Hib,positive,todo remove
Hib,positive,just to help out during the load ugly i know
Hib,positive,hack workaround as sqlquery impl depend on having a key
Hib,positive,todo handle the case of a foreign key to something other than the pk
Hib,positive,todo assumes all collections disassemble to an array
Hib,positive,todo would love to have this work on a notification basis where the successful binding of an entity subclass would emit a notification which the extendsqueue entries could react to
Hib,positive,todo is it really neceassry to provide configuration to collectionpersisters ? should it not be enough with associated class ? or why does entitypersister is not get access to configuration ? the only reason i could see that configuration gets passed to collection persisters is so that they can look up the dom j node name of the entity element in case no explicit node name was applied at the collection element level are you kidding me ? trivial to fix then just store and expose the node name on the entity persister which the collection persister looks up anyway via other means
Hib,positive,todo deprecated remove eventually
Hib,positive,todo possibly relax that
Hib,positive,todo this is a bit dodgy come up with a better way to check this plus see above comment
Hib,positive,use a degenerated strategy for backward compatibility
Hib,positive,todo this is temporary in that the end result will probably not take a property reference per se
Hib,positive,todo better to handle dynamic filters through implicit dynamicfilterparameterspecification see the discussion there in dynamicfilterparameterspecification is javadocs as to why it is currently not done that way
Hib,positive,get the right object from the list would it be easier to just call getentity ? ?
Hib,positive,todo should record how many properties we have reffered to and if we do not get em all we throw an exception way better than trial and error
Hib,positive,todo this dependency is kinda bad
Hib,positive,todo get sql rendering out of this package
Hib,positive,why does this matter ?
Hib,positive,important to account for newly saved entities in query todo some kind of check for new status
Hib,positive,todo get sql rendering out of this package
Hib,positive,todo can we always use the null property approach for everything ?
Hib,positive,does this need holdlock also ? return tablename with updlock rowlock holdlock
Hib,positive,for sets we should end the collection load after resolving the entities since we might call hashcode on the elements todo or we could do this polymorphically and have two different operations implemented differently for arrays
Hib,positive,todo remove this and just have subclasses use isolater isolatedwork directly
Hib,positive,sql server at least needed this dropped after use strange
Hib,positive,is it necessary to register exact since it can only appear in a where clause ?
Hib,positive,for arrays we should end the collection load before resolving the entities since the actual array instances are not instantiated during loading todo or we could do this polymorphically and have two different operations implemented differently for arrays
Hib,positive,does this dialect support the alter table syntax ?
Hib,positive,this next bit is to allow for both unsaved value negative and for older behavior where version number did not get seeded if it was already set in the object todo shift it into unsaved value strategy
Hib,positive,todo reenable if we also fix the above todo
Hib,positive,orphans should not be deleted during copy ? ?
Hib,positive,orphans should not be deleted during merge ? ?
Hib,positive,todo suck this logic into the collection
Hib,positive,todo we can actually just determine this from the incoming entityentry s
Hib,positive,todo this bit actually has to be called after all cascades but since identity insert is called synchronously instead of asynchronously as other actions it is not
Hib,positive,this class has no proxies so do a shortcut
Hib,positive,todo should this be an initializeentityeventlistener ? ? ? watch out for performance
Hib,positive,todo need map ? the prob is a proper key right ?
Hib,positive,todo better to pass the id in as an argument ?
Hib,positive,do we even really need this ? the update will fail anyway
Hib,positive,todo would it be better to do a refresh from db ?
Hib,positive,this form used from annotations ? essentially the same as the above using a resultset mapping reference but without cachemode readonly and comment fixme annotations do not use it so it can be remove from my pov deprecated param query the sql query string param resultsetref the result set mapping name param queryspaces any specified query spaces used for auto flushing param cacheable whether the query results are cacheable param cacheregion if cacheable the region into which to store the results param timeout a jdbc level timeout to be applied param fetchsize a jdbc level fetch size to be applied param flushmode the flush mode to use for this query param parametertypes parameter type map param callable does the query string represent a callable object i e proc
Hib,positive,todo ugly here
Hib,positive,todo not quite sure about the full implications of this
Hib,positive,this only works because collection entries are kept in a sequenced map by persistence context maybe we should do like entities and keep a separate sequences set todo calling entryset on an identitymap is slow
Hib,positive,todo i  d much rather have this done from endloadingcollection collectionpersister loadingcollectionentry
Hib,positive,todo hack note here we cleanup the load context when we have no more local lce entries this works for the time being because really only the collection load contexts are implemented long term this cleanup should become part of the close result set processing from the sandbox jdbc jdbc container code
Hib,positive,todo add the notion of enabled filters to the cachekey to differentiate filtered collections from non filtered but cachekey is currently used for both collections and entities would ideally need to define two seperate ones currently this works in conjuction with the check on defaultinitializecollectioneventhandler initializecollectionfromcache which makes sure to not read from cache with enabled filters early exit
Hib,positive,postload is needed for ejb todo reuse the postloadevent
Hib,positive,todo should we check the current isolation mode explicitly ?
Hib,positive,brand new collection todo or an array we ca not lock objects with arrays now ? ?
Hib,positive,todo iteratively get transient entities and retry merge until one of the following conditions transientcopycache size transientcopycache size is not decreasing and copycache size is not increasing todo find out if retrying can add entities to copycache do not think it can for now just retry once throw transientobjectexception if there are still any transient entities
Hib,positive,null or brand new collection this will also inefficiently handle arrays which have no snapshot so we ca not do any better
Hib,positive,todo perhaps we should additionally require that the incoming entity version be equivalent to the defined unsaved value ?
Hib,positive,provides query splitting methods which were originally in querytranslator br todo this will need to be refactored at some point author josh
Hib,positive,todo most of below was taken verbatim from dotnode should either delegate this logic or super type it
Hib,positive,todo currently expects that the individual with expressions apply to the same sql table join this may not be the case for joined subclass where the property values might be coming from different tables in the joined hierarchy at some point we should expand this to support that capability however that has some difficulties the biggest is how to handle ors when the individual comparisons are linked to different sql joins here we would need to track each comparison individually along with the join alias to which it applies and then pass that information back to the fromelement so it can pass it along to the joinsequence
Hib,positive,no explicit select expression render the id and properties projection lists for every persister in the from clause into a single  token node  todo the only reason we need this stuff now is collection filters we should get rid of derived select clause completely
Hib,positive,todo better way ? ?
Hib,positive,hack alert attempt to work around ghost impliedfromelements that occasionally show up between the actual things being joined this consistently occurs from index nodes at least against many to many not sure if there are other conditions essentially look ahead to the next fromelement that actually writes something to the sql
Hib,positive,not possible to simply re use the versionpropertynode here as it causes oom errors due to circularity
Hib,positive,this function has a template restore output apply the template and write the result out todo downcast to avoid using an interface ? yuck
Hib,positive,at some point the generate phase needs to be moved out of here because a single object level dml might spawn multiple sql dml command executions possible to just move the sql generation for dml stuff but for consistency sake probably best to just move responsiblity for the generation phase completely into the delegates queryloader statementexecutor themselves also not sure why queryloader currently even has a dependency on this at all does it need it ? ideally like to see the walker itself given to the delegates directly
Hib,positive,todo this is only needed during compilation can we eliminate the instvar ?
Hib,positive,todo absolutely no usages of this constructor form can it go away ?
Hib,positive,todo is this a bit ugly ?
Hib,positive,even here if only properties mapped to the base table are referenced in the set and where clauses this could be handled by the basicdelegate todo decide if it is better performance wise to perform that check or to simply use the multitableupdatedelegate
Hib,positive,todo remove these last two as batcher is no longer managing connections
Hib,positive,very important this class needs to be free of any static references to any cglib or javassist classes otherwise users will always need both on their classpaths no matter which if either they use another option here would be to remove the hibernate ispropertyinitialized method and have the users go through the sessionfactory to get this information
