Hib,negative,get the function return value type based on the type of the first argument
Hib,negative,this will call initialize tok
Hib,negative,mutation depends on the types of nodes invloved
Hib,negative,logic operators by definition resolve to booleans
Hib,negative,generated select expressions are already resolved nothing to do
Hib,negative,the path may be a reference to an alias defined in the parent query
Hib,negative,the hql class alias refers to the class name
Hib,negative,associate the table alias with the element
Hib,negative,try the parent fromclause
Hib,negative,make sure that all from elements registered with this from clause are actually in the ast
Hib,negative,invoke setscalarcolumntext on each constructor argument
Hib,negative,collect the select expressions skip the first child because it is the class name
Hib,negative,return an empty type array
Hib,negative,we ensure async semantics jbcache 
Hib,negative,if there is no order by make one
Hib,negative,initial load from jbc
Hib,negative,find the where if there is no where find the from
Hib,negative,now inject the newly built order by into the tree
Hib,negative,logic operators by definition resolve to boolean
Hib,negative,render the identifier select fragment using the table alias
Hib,negative,class names in the from clause result in a joinsequence the old fromparser does this
Hib,negative,will still be issued when it used to be null
Hib,negative,otherwise use the property mapping
Hib,negative,we ensure async semantics jbcache 
Hib,negative,the standard comparator types are not serializable but are singletons
Hib,negative,ignore
Hib,negative,ignore it
Hib,negative,generate implicit joins only if necessary
Hib,negative,if the property is a special collection property name return a collectionpropertymapping
Hib,negative,collection of components
Hib,negative,construct the cache
Hib,negative,local cache so we use synchronization
Hib,negative,ie seconds
Hib,negative,we need to seed the version value as part of this bulk insert
Hib,negative,make sure the lhs is assignable
Hib,negative,false indicates to not generate parens around the assignment
Hib,negative,currently allowed
Hib,negative,in non select queries the only time we should need to join is if we are in a subquery from clause
Hib,negative,return classalias null ? classname classalias
Hib,negative,this is an explicit from element
Hib,negative,swaldman define c p style configuration parameters for initialpoolsize which hibernate sensibly lets default to minpoolsize but we will let users override it with the c p style property if they want
Hib,negative,parametercontainer impl
Hib,negative,fetch ca not be used with scroll or iterate
Hib,negative,if it is not implied or it is implied and it is a many to many join where the target was not found
Hib,negative,we need to wrtap the param in a cast
Hib,negative,since this is an explicit from element it ca not be implied in the from clause
Hib,negative,do nothing eplicit from elements are always in the projection list
Hib,negative,propertyname refers to something like collection size
Hib,negative,property name is a sub path of a component
Hib,negative,always add the collection is query spaces
Hib,negative,nothing to do even if the operand is a parameter no way we could infer an appropriate expected type here
Hib,negative,notify the from element that it is being referenced by the select
Hib,negative,logic operators by definition resolve to booleans
Hib,negative,dotnode uses null here
Hib,negative,we represent a from clause alias
Hib,negative,we are the rhs of the dot representing a naked comp prop ref
Hib,negative,we represent a naked simple prop ref
Hib,negative,early exit return so the resolve call explicitly coming from dotnode can resolve this
Hib,negative,assume this ident is text does not refer to a property on the given persister
Hib,negative,just ignore it for now it will get resolved later
Hib,negative,this is not actually a constant but a reference to from element
Hib,negative,check to see if our proppath actually represents a property on the persister
Hib,negative,these pieces are needed for usage in select clause
Hib,negative,assume we do not refer to a property on the given persister
Hib,negative,true if the pool is borrowed from the outside false if we used to create it
Hib,negative,assume we do not refer to a property on the given persister
Hib,negative,get a connection from the pool thru drivermanager cfr proxool doc
Hib,negative,set the transaction isolation if defined
Hib,negative,naked property refs cannot be used with an aliased from element
Hib,negative,do not over write the column text as that has already been rendered during resolve
Hib,negative,look up class name using the first identifier in the path
Hib,negative,toggle autocommit to false if set
Hib,negative,add to the query spaces
Hib,negative,return the connection
Hib,negative,if the from element is not in the same clause create a new from element
Hib,negative,correlated subqueries create ispecial  implied from nodes because correlated subselects ca not use an ansi style join
Hib,negative,super duper classic parser regression testing mojo magic
Hib,negative,get the configurator files if available
Hib,negative,a collection of entities
Hib,negative,a collection of components
Hib,negative,default the proxool alias setting
Hib,negative,a collection of scalar elements
Hib,negative,validate that an alias name was provided to determine which pool to use
Hib,negative,we only build caches if none were passed in passing in caches counts as a clear statement of exactly what is wanted
Hib,negative,validate that an alias name was provided to determine which pool to use
Hib,negative,do not include sub classes for implied collection joins or subquery joins
Hib,negative,treat explict from elements in sub queries properly
Hib,negative,semantic action handling
Hib,negative,append the stem to the proxool pool alias
Hib,negative,configured using the jaxp configurator
Hib,negative,append the stem to the proxool pool alias
Hib,negative,append the stem to the proxool pool alias
Hib,negative,configured using the properties file configurator
Hib,negative,remember isolation level
Hib,negative,if the provider was leeching off an existing pool do not close it
Hib,negative,note because we  re using astutil createparent the tree must be created from the bottom up is empty x exists query select from from x
Hib,negative,the root from element in correlated subqueries do need this piece
Hib,negative,create the from element for the target the elements of the collection
Hib,negative,if the join is implied then do not include sub classes on the element
Hib,negative,overridden informational metadata
Hib,negative,not really a many to one association necessarily
Hib,negative,the associated entity is implied but it must be included in the from the collection alias is the role
Hib,negative,not really a many to one association necessarily
Hib,negative,always overwrite nonversioned data
Hib,negative,tag this node as a join do not include subclasses in the join this is a clollection join
Hib,negative,public currency getcurrency int col throws hibernateexception
Hib,negative,get the class name of the associated entity
Hib,negative,default is pojo
Hib,negative,use setparameter for null values
Hib,negative,origin path implied columns classalias
Hib,negative,implied
Hib,negative,for implied many to many just add the end join
Hib,negative,interceptor returned null so do the dirtycheck ourself if possible
Hib,negative,use setparameter for null values
Hib,negative,note this
Hib,negative,overridden informational metadata
Hib,negative,overridden informational metadata
Hib,negative,error message constants
Hib,negative,the standard sql function name is current timestamp
Hib,negative,scan for next non whitespace token
Hib,negative,this causes the factory to instantiate the desired class
Hib,negative,private type sqlresulttypes
Hib,negative,private cacheentry cacheentry
Hib,negative,make certain that this is called before any subsequent scheduledupdate aftertransactioncompletion
Hib,negative,typefactory deepcopy currentstate proptypes persister getpropertyupdateability deletedstate session
Hib,negative,frontbase has no known variation of a select for update syntax
Hib,negative,public type getsqlresulttypes return sqlresulttypes
Hib,negative,sqlresulttypelist addall constructorargumenttypelist
Hib,negative,sqlresulttypelist add type
Hib,negative,always add the type to the return type list
Hib,negative,have the entity entry perform post update processing passing it the update state and the new version if one
Hib,negative,this entity defines proeprty generation so process those generated values
Hib,negative,add the fetched entities
Hib,negative,get ready to start adding nodes
Hib,negative,early exit
Hib,negative,oj getjoinable consumescollectionalias
Hib,negative,just especially for the trivial collection filter
Hib,negative,need to look it up from the persistence context
Hib,negative,sort first by role name
Hib,negative,function support
Hib,negative,update last non whitespace token if necessary
Hib,negative,then by fk
Hib,negative,sqlresulttypelist
Hib,negative,nothing to do
Hib,negative,arraylist sqlresulttypelist
Hib,negative,nothing to do
Hib,negative,this method is called when a new non null collection is persisted or when an existing non null collection is moved to a new owner
Hib,negative,notafterclasstokens add
Hib,negative,beforeclasstokens add new definitely do not have this
Hib,negative,lock acquisition support
Hib,negative,todo
Hib,negative,remove initial
Hib,negative,add the type to the list of returned sqlresulttypes
Hib,negative,generate the select expression
Hib,negative,now update all changed or added rows fks
Hib,negative,boolean put persister getcache insert ck cacheentry
Hib,negative,union subclass support
Hib,negative,skip  distinct  and  all  so we return the first expression node
Hib,negative,generate the property select tokens
Hib,negative,get the function name node
Hib,negative,aload 
Hib,negative,this handles hhh where there is a strange property name in a where clause if the lookahead contains a dot then something that is not an ident
Hib,negative,method expressions in a select should always be considered scalar
Hib,negative,areturn return the value of the field
Hib,negative,do nothing we only need to notify the cache
Hib,negative,sort first by entity name
Hib,negative,if this is  elements  then create a new from element
Hib,negative,then by id
Hib,negative,not elements x
Hib,negative,dialect function
Hib,negative,to be safe
Hib,negative,collection  property function 
Hib,negative,if the constant is an ident figure out what it means
Hib,negative,no transformations took place so handle it as we would a non instrumented class
Hib,negative,ident is a class alias in the from
Hib,negative,resolve to an identity column
Hib,negative,see if the entry represents a class file
Hib,negative,otherwise it is a literal
Hib,negative,the name of an entity class
Hib,negative,see if the entry represents a class file
Hib,negative,the class discriminator value
Hib,negative,add a space before the display text
Hib,negative,intentionally empty
Hib,negative,find or create the where clause
Hib,negative,child parent getfirstchild
Hib,negative,set the name of bulk accessor
Hib,negative,aload 
Hib,negative,aload 
Hib,negative,invokespecial
Hib,negative,return
Hib,negative,find or create the where clause
Hib,negative,aload load bean
Hib,negative,filter conditions need to be inserted before the hql where condition and the theta join node this is because org hibernate loader loader binds the filter parameters first then it binds all the hql query parameters see org hibernate loader loader processfilterparameters
Hib,negative,checkcast cast bean
Hib,negative,put the filters node before the hql condition and theta joins
Hib,negative,astore store bean
Hib,negative,add the current fragment to the filters node
Hib,negative,create a new theta joins node as a parent of all filters
Hib,negative,aload args
Hib,negative,put the theta joins node before the hql condition after the filters
Hib,negative,first try to get the persister using the given name directly
Hib,negative,iconst i continue to aastore growing stack is 
Hib,negative,unable to locate it using this name
Hib,negative,if that did not work try using the  import  name
Hib,negative,implicit joins use theta style where pk fk explicit joins use join after from
Hib,negative,locate the registered function by the given name
Hib,negative,determine the type of the first argument
Hib,negative,aload 
Hib,negative,use the dot node to emit the first column name create the column names folled by the column aliases
Hib,negative,append the text of the current node
Hib,negative,if the node has a first child recurse into the first child
Hib,negative,new
Hib,negative,if there is a second child rhs recurse into that child
Hib,negative,dup
Hib,negative,aload load the raw bean
Hib,negative,invokeinterface
Hib,negative,invokevirtual
Hib,negative,invokevirtual
Hib,negative,aastore args
Hib,negative,istore store i
Hib,negative,aload load the bean
Hib,negative,current stack len 
Hib,negative,iterate through the alias joinsequence pairs and generate sql token nodes
Hib,negative,this is used during sqlgenerator processing
Hib,negative,start region to handling exception bulkaccessorexception
Hib,negative,if there is a from fragment and the from element is an explicit then add the from part
Hib,negative,stringhelper isnotempty frag
Hib,negative,iinc 
Hib,negative,the from fragment will probably begin with remove this if it is present
Hib,negative,this uses a pathexpressionparser but notice that compound paths are not valid only bare names and simple paths
Hib,negative,aload load the raw bean
Hib,negative,select p from p in class eg person order by p name p address p
Hib,negative,the reason for this is sql does not let you sort by an expression you are not returning in the result set
Hib,negative,oracle sql state code for deadlock
Hib,negative,aload load the args
Hib,negative,otherwise try to use the no arg constructor
Hib,negative,iconst i
Hib,negative,eat it and try next
Hib,negative,aaload
Hib,negative,checkcast
Hib,negative,default mode
Hib,negative,checkcast case of reference type
Hib,negative,current stack len 
Hib,negative,at some point the processing went bad so we need to make sure the connection handle gets released try to cleanup the jta context as much as possible
Hib,negative,end region to handling exception bulkaccessorexception
Hib,negative,register in exception table
Hib,negative,private constructor stops checkstyle from complaining
Hib,negative,reset the dotcount but not the path after reset
Hib,negative,aload 
Hib,negative,after reset
Hib,negative,following methods we do not delegate since they have so little logic it is clearer to just implement them here
Hib,negative,aload 
Hib,negative,return
Hib,negative,return
Hib,negative,invokevirtual
Hib,negative,checkcast
Hib,negative,dotcount 
Hib,negative,local variables target obj each oldvalue
Hib,negative,astore store exception
Hib,negative,aload load exception
Hib,negative,this bean args raw bean
Hib,negative,iload i
Hib,negative,do the corresponding rhs
Hib,negative,invokespecial bulkaccessorexception init
Hib,negative,athrow
Hib,negative,warning classfile only
Hib,negative,if its id
Hib,negative,swallow
Hib,negative,or its the id property name
Hib,negative,join q createjoinfragment usethetastylejoin
Hib,negative,local variable this
Hib,negative,important
Hib,negative,an association
Hib,negative,aload load this
Hib,negative,allow index function
Hib,negative,aload load this
Hib,negative,aload load callback
Hib,negative,case of non static field
Hib,negative,log a message about potential connection leaks
Hib,negative,getfield get each field
Hib,negative,invokeinterface invoke enabled getinterceptfieldcallback
Hib,negative,ifnonnull
Hib,negative,return each type
Hib,negative,return each type
Hib,negative,store each type
Hib,negative,many to many
Hib,negative,ldc name of the field
Hib,negative,opening paren in new foo
Hib,negative,if we are inside a new result but not inside a nested function
Hib,negative,invokeinterface invoke callback read each type
Hib,negative,special case
Hib,negative,the name of an sql function
Hib,negative,this is basically a copy paste of orderbyparser might be worth refactoring
Hib,negative,select p from p in class eg person group by p name p address p
Hib,negative,return aliases not supported in classic translator
Hib,negative,int
Hib,negative,register collection role
Hib,negative,just do the regular thing if you ca not find the ctor your ast must have default ctor to use this
Hib,negative,return
Hib,negative,the keyword used to specify an identity column if identity column key generation is supported
Hib,negative,getelementpropertymapping
Hib,negative,dup
Hib,negative,following does not handle null not null but unnecessary since this would mean all rows
Hib,negative,checkcast
Hib,negative,checkcast
Hib,negative,crossjoins add name
Hib,negative,ie no select clause in hql
Hib,negative,invokeinterface enabled getinterceptfieldcallback
Hib,negative,invokeinterface enabled getinterceptfieldcallback
Hib,negative,ifnonnull label 
Hib,negative,we are the lhs of the dot representing a naked comp prop ref
Hib,negative,load 
Hib,negative,load 
Hib,negative,ie no select clause
Hib,negative,putfield
Hib,negative,there was a select clause
Hib,negative,return
Hib,negative,ldc field name
Hib,negative,getfield old value of the field
Hib,negative,reference type
Hib,negative,return the concrete type or the underlying type if a concrete type was not specified
Hib,negative,many to many
Hib,negative,reference type
Hib,negative,not array
Hib,negative,array of reference type
Hib,negative,q addcollection collectionname collectionrole
Hib,negative,boolean
Hib,negative,char
Hib,negative,short
Hib,negative,classic parser does not support bulk manipulation statements
Hib,negative,double
Hib,negative,aload 
Hib,negative,float
Hib,negative,float
Hib,negative,this is called when it is time to fully resolve a path expression
Hib,negative,long
Hib,negative,ca not cache this stuff either per invocation
Hib,negative,this is the legacy behaviour for hql queries
Hib,negative,long
Hib,negative,bad type
Hib,negative,bad type
Hib,negative,not known
Hib,negative,boolean byte char int short
Hib,negative,not known
Hib,negative,boolean byte char int short
Hib,negative,not known
Hib,negative,reference type
Hib,negative,not known
Hib,negative,need this since join condition can appear inside parens
Hib,negative,double
Hib,negative,float
Hib,negative,float
Hib,negative,bad type
Hib,negative,bad type
Hib,negative,boolean byte char int short
Hib,negative,expressionopeners add deliberately excluded
Hib,negative,skip finalize methods
Hib,negative,mainly for oscache
Hib,negative,decrement the lock
Hib,negative,recache the updated state
Hib,negative,noop
Hib,negative,null clientlock is remotely possible but will never happen in practice
Hib,negative,by requiring we rely on lock timeout in the case of an unsuccessful update
Hib,negative,the user provided resulttransformer not the one used with select new here to avoid mangling transformed non transformed results
Hib,negative,disassemble positional parameters
Hib,negative,ie seconds
Hib,negative,noop
Hib,negative,otherwise a trim specification and or a trim character have been specified we need to decide which options are present and do the right thing should leading trim characters be trimmed ? should trailing trim characters be trimmed ? the trim character what is to be trimmed off ? the trim source from where should it be trimmed ?
Hib,negative,noop
Hib,negative,noop
Hib,negative,this is called from settingsfactory irregardless trivial to simply disregard
Hib,negative,do nothing subclasses may override
Hib,negative,do nothing subclasses may override
Hib,negative,table
Hib,negative,inside a between and expression
Hib,negative,were an odd or even number of nots encountered the join string built up by compound paths inside this expression a flag indicating if the subexpression is known to be boolean
Hib,negative,ie a many to many
Hib,negative,cope with
Hib,negative,cope with a continued path expression ie baz
Hib,negative,note early return
Hib,negative,cope with a subselect
Hib,negative,use the id value of a newly instantiated instance as the unsaved value
Hib,negative,close extra brackets we opened
Hib,negative,take note when this is a boolean expression
Hib,negative,persister setidentifier result id before calling interceptor for consistency with normal load
Hib,negative,no op ccs did not have such a concept
Hib,negative,joinprocessor needs to know if the where clause fragment came from a dynamic filter or not so it can put the where clause fragment in the right place in the sql ast  hasfiltercondition  keeps track of that fact
Hib,negative,no op ccs did not have such a concept
Hib,negative,assumes that types are all of span 
Hib,negative,again ccs did not have such a concept however a reasonable proximity is to clear the cache for non transaction aware caches we will also do a clear at the end of the transaction
Hib,negative,process a token mapping oo path expressions to sql expressions
Hib,negative,open any extra brackets we might need
Hib,negative,cope with special cases of and not
Hib,negative,the next one up must also be
Hib,negative,add any joins
Hib,negative,named query parameter
Hib,negative,get meta is from hibernate mapping
Hib,negative,get meta is from class
Hib,negative,path expression
Hib,negative,db objectname
Hib,negative,just decrement the lock do not recache we do not know which transaction won
Hib,negative,saves updates do not cascade to uninitialized collections
Hib,negative,mutable
Hib,negative,a container for collections we load up when the owning entity is not yet loaded for now this is purely transient
Hib,negative,where
Hib,negative,check
Hib,negative,polymorphism
Hib,negative,properties that we have tried to load and not found in the database
Hib,negative,todo
Hib,negative,persists do not cascade to uninitialized collections
Hib,negative,anything else
Hib,negative,the path expression continues after a
Hib,negative,careful with this
Hib,negative,the path expression ends at the
Hib,negative,finish off the join
Hib,negative,notice no or since they are part of compound identifiers
Hib,negative,cannot instantiate
Hib,negative,start by looking for hql keywords
Hib,negative,inner joins can be abbreviated to  join 
Hib,negative, outer  is optional and is ignored
Hib,negative,now anything that is not a hql keyword
Hib,negative,process the old hql style where aliases appear first ie using the in or in class constructions
Hib,negative,treat it as a classname
Hib,negative,treat it as a path expression
Hib,negative,starts with a path expression new style
Hib,negative,id
Hib,negative,allow odmg oql style from person p p cars c
Hib,negative,handle quoted strings
Hib,negative,version timestamp
Hib,negative,discriminator
Hib,negative,primary key constraint
Hib,negative,this is either a version tag with no type attribute or a timestamp tag
Hib,negative,object insertions updates and deletions have list semantics because they must happen in the right order so as to respect referential integrity
Hib,negative,finish off the join
Hib,negative,ignore whitespace
Hib,negative,do replacements
Hib,negative,handle hql collection syntax
Hib,negative,uuid hex is deprecated
Hib,negative,abstractselectingdelegate impl
Hib,negative,hilo params
Hib,negative,sql query
Hib,negative,for ejb 
Hib,negative,performance opt
Hib,negative,sql update
Hib,negative,discriminator
Hib,negative,hilo config
Hib,negative,so we clock over on the first invocation
Hib,negative,do not allow comments on these insert statements as comments totally blow up the oracle getgeneratedkeys support
Hib,negative,throw new identifiergenerationexception save associated object first or disable cascade for inverse association
Hib,negative,count
Hib,negative,go ahead and set the lazy here since pojo proxy can override it
Hib,negative,dynamic update
Hib,negative,import
Hib,negative,batch size
Hib,negative,we need to dirty check collections since they can cause an owner version number increment
Hib,negative,select before update
Hib,negative,optimistic lock mode
Hib,negative,intentionally empty
Hib,negative,first element of array is reserved for the actual instance we are loading
Hib,negative,keep the behavior consistent even for boundary usages
Hib,negative,so we clock over on the first invocation
Hib,negative,do nothing until we hit the rsult set containing the generated id
Hib,negative,use the delegate resolve identifiers as from element aliases
Hib,negative,persister
Hib,negative,custom sql
Hib,negative,loaded entity instances by entitykey
Hib,negative,if the given name is un qualified we may neen to qualify it
Hib,negative,the default
Hib,negative,cascade save to many to one before the parent is saved
Hib,negative,get meta is from subclass
Hib,negative,properties
Hib,negative,joined subclasses
Hib,negative,key
Hib,negative,check
Hib,negative,properties
Hib,negative,intentionally empty
Hib,negative,key
Hib,negative,even process null collections
Hib,negative,keep the existing version number in the case of replicate
Hib,negative,source getpersistencecontext removenonexist new entitykey id persister source getentitymode
Hib,negative,substitutes into values by side effect
Hib,negative,identity map of collectionentry instances by the collection wrapper
Hib,negative,tablename
Hib,negative,table specific parameters
Hib,negative,join getkey settype new type lazz getidentifier
Hib,negative,source getbatcher executebatch found another way to ensure that all batched joined inserts have been executed
Hib,negative,identifiergenerator implementation
Hib,negative,properties
